[I 2026-09-13 01:43:32,457] Trial 115 finished with value: 0.25854924980045996 and parameters: {'phi_model': 'eid', 'kappa': 1.1343397639949193, 'svgd_iters': 0, 'debt_weight': 0.805253666422529, 'visit_sat': 0.4208435005821252, 'visit_halflife': 3.908121765052995, 'phi_mode': 'quantile', 'n_particles': 128, 'phi_quantile': 0.3644899344846525, 'gp_lengthscale': 0.11619539707295097, 'gp_noise': 0.03353885186813554, 'cfg_weight': 1.2216651862500973}. Best is trial 115 with value: 0.25854924980045996.
[I 2026-09-13 01:47:00,840] Trial 116 finished with value: 0.26367479069424804 and parameters: {'phi_model': 'eid', 'kappa': 1.1768070057720972, 'svgd_iters': 0, 'debt_weight': 0.8252695761763935, 'visit_sat': 0.47971280315674053, 'visit_halflife': 3.5744109866751166, 'phi_mode': 'quantile', 'n_particles': 128, 'phi_quantile': 0.3630282041735259, 'gp_lengthscale': 0.14059515714239204, 'gp_noise': 0.029984801117459874, 'cfg_weight': 1.583118446175123}. Best is trial 115 with value: 0.25854924980045996.
[I 2026-09-13 01:50:29,195] Trial 117 finished with value: 0.26174835244128253 and parameters: {'phi_model': 'eid', 'kappa': 1.5961125507472353, 'svgd_iters': 0, 'debt_weight': 0.8189258945355453, 'visit_sat': 0.3504098938127524, 'visit_halflife': 4.029253713685736, 'phi_mode': 'quantile', 'n_particles': 128, 'phi_quantile': 0.31782236327635893, 'gp_lengthscale': 0.11910402505215978, 'gp_noise': 0.028998266174966758, 'cfg_weight': 1.2076358458050602}. Best is trial 115 with value: 0.25854924980045996.
[I 2026-09-13 01:50:52,151] Trial 118 pruned. 
[I 2026-09-13 01:54:20,474] Trial 119 finished with value: 0.2619103597164459 and parameters: {'phi_model': 'eid', 'kappa': 1.5600304414498534, 'svgd_iters': 0, 'debt_weight': 0.8830719733293342, 'visit_sat': 0.5161725761899121, 'visit_halflife': 3.6048016442811877, 'phi_mode': 'quantile', 'n_particles': 128, 'phi_quantile': 0.3037713981811603, 'gp_lengthscale': 0.14183201916712498, 'gp_noise': 0.029166281226490294, 'cfg_weight': 1.2002137798213695}. Best is trial 115 with value: 0.25854924980045996.
[I 2026-09-13 01:57:48,853] Trial 120 finished with value: 0.25894787587178986 and parameters: {'phi_model': 'eid', 'kappa': 1.17474379964426, 'svgd_iters': 0, 'debt_weight': 0.8710875252347166, 'visit_sat': 0.47574109388202845, 'visit_halflife': 3.5586692162534916, 'phi_mode': 'quantile', 'n_particles': 128, 'phi_quantile': 0.3033256817630928, 'gp_lengthscale': 0.11402720603065705, 'gp_noise': 0.032907465263643416, 'cfg_weight': 1.230808738620231}. Best is trial 115 with value: 0.25854924980045996.
[I 2026-09-13 02:01:17,183] Trial 121 pruned. 
[I 2026-09-13 02:01:40,144] Trial 122 pruned. 
[I 2026-09-13 02:05:08,462] Trial 123 pruned. 
[I 2026-09-13 02:08:36,844] Trial 124 finished with value: 0.26357160263410273 and parameters: {'phi_model': 'eid', 'kappa': 1.5771184449598132, 'svgd_iters': 0, 'debt_weight': 0.7563023130860593, 'visit_sat': 0.43411459311394013, 'visit_halflife': 3.723523229118962, 'phi_mode': 'quantile', 'n_particles': 128, 'phi_quantile': 0.3319252204265718, 'gp_lengthscale': 0.11251288817721337, 'gp_noise': 0.03289972642295194, 'cfg_weight': 1.128359921155584}. Best is trial 115 with value: 0.25854924980045996.
C:\Users\Philipp\Documents\Uni\Master_Thesis\Master_thesis_ergodic_learning\thesis_architecture\exploration_optimierung\optuna_search.py:525: ExperimentalWarning: Argument ``group`` is an experimental feature. The interface can change in the future.
  sampler=optuna.samplers.TPESampler(
[I 2026-09-14 12:19:16,800] Using an existing study with `study_name='ideal_v2'` instead of creating a new one.
  1 verwaiste(r) Versuch(e) aus einem frueheren Abbruch gefunden, 1 als FAIL markiert.

======================================================================
  Optuna-Suche  study=ideal_v2  space=ideal
  bereits in der Datenbank: 126 Versuche
  dieser Aufruf: +5000 Versuche, Deckel 25.4h
  n_max=12  n_shapes=25  quality=cov
  Rollout-Seeds je Versuch: 3   Sampler-Seed: 0
  Hyperband: Sprossen 4 -> ... -> 36 Runden (Faktor 3)
  erste 50 Versuche zufaellig (= Kontrollgruppe)
  immer fest: {'sensor_radius': 0.06, 'meas_noise': 0.02}
  Strg+C haelt nach dem laufenden Versuch an (nichts geht verloren).
======================================================================

  25 Formen geladen, Planer bereit

  SVGD-Pool mit 10 Prozessen

[I 2026-09-14 12:20:40,512] Trial 126 pruned. 
[I 2026-09-14 12:24:09,570] Trial 127 finished with value: 0.25995961570274395 and parameters: {'phi_model': 'eid', 'kappa': 0.8693195699306004, 'svgd_iters': 0, 'debt_weight': 0.8749151309506888, 'visit_sat': 0.446949698517186, 'visit_halflife': 3.4087990807795387, 'phi_mode': 'quantile', 'n_particles': 128, 'phi_quantile': 0.19253697998558716, 'gp_lengthscale': 0.11733224093201314, 'gp_noise': 0.041051912034882614, 'cfg_weight': 1.2169383720316067}. Best is trial 115 with value: 0.25854924980045996.
[I 2026-09-14 12:27:38,357] Trial 128 pruned. 
[I 2026-09-14 12:31:05,953] Trial 129 pruned. 
[I 2026-09-14 12:31:28,854] Trial 130 pruned. 
[I 2026-09-14 12:34:56,621] Trial 131 pruned. 
[I 2026-09-14 12:36:05,930] Trial 132 pruned. 
[I 2026-09-14 12:39:33,992] Trial 133 pruned. 
[I 2026-09-14 12:43:01,853] Trial 134 pruned. 
[I 2026-09-14 12:46:30,362] Trial 135 finished with value: 0.26356105796498114 and parameters: {'phi_model': 'eid', 'kappa': 1.5714557439121866, 'svgd_iters': 0, 'debt_weight': 0.8591672854365008, 'visit_sat': 0.44910785685642596, 'visit_halflife': 3.948693807099081, 'phi_mode': 'quantile', 'n_particles': 128, 'phi_quantile': 0.3853576800071146, 'gp_lengthscale': 0.14322465075894655, 'gp_noise': 0.029256361725703138, 'cfg_weight': 1.2328241202364703}. Best is trial 115 with value: 0.25854924980045996.
[I 2026-09-14 12:46:54,009] Trial 136 pruned. 
[I 2026-09-14 12:48:04,223] Trial 137 pruned. 
[I 2026-09-14 12:49:14,349] Trial 138 pruned. 
[I 2026-09-14 12:50:23,903] Trial 139 pruned. 
[I 2026-09-14 12:51:34,063] Trial 140 pruned. 
[I 2026-09-14 12:55:04,831] Trial 141 finished with value: 0.2591211438748126 and parameters: {'phi_model': 'eid', 'kappa': 1.3153864984483314, 'svgd_iters': 0, 'debt_weight': 0.8573159215975503, 'visit_sat': 0.3817829851124046, 'visit_halflife': 3.63837415152016, 'phi_mode': 'quantile', 'n_particles': 128, 'phi_quantile': 0.3335451513620338, 'gp_lengthscale': 0.1097674484380782, 'gp_noise': 0.03455992281404717, 'cfg_weight': 1.1581124350967285}. Best is trial 115 with value: 0.25854924980045996.
[I 2026-09-14 12:56:15,061] Trial 142 pruned. 
[I 2026-09-14 12:57:24,795] Trial 143 pruned. 
[I 2026-09-14 13:00:53,099] Trial 144 pruned. 
[I 2026-09-14 13:04:27,751] Trial 145 finished with value: 0.2628400257745281 and parameters: {'phi_model': 'eid', 'kappa': 1.857653449100972, 'svgd_iters': 0, 'debt_weight': 0.8846924720148287, 'visit_sat': 0.33907205483043973, 'visit_halflife': 3.8322882831509757, 'phi_mode': 'quantile', 'n_particles': 128, 'phi_quantile': 0.5070409625974265, 'gp_lengthscale': 0.12906853851055103, 'gp_noise': 0.0362861056435847, 'cfg_weight': 1.2625190390690324}. Best is trial 115 with value: 0.25854924980045996.
[I 2026-09-14 13:08:05,146] Trial 146 finished with value: 0.2636228190169116 and parameters: {'phi_model': 'eid', 'kappa': 1.1441631993115953, 'svgd_iters': 0, 'debt_weight': 0.9166538830132405, 'visit_sat': 0.5855805386980188, 'visit_halflife': 3.3069165682082233, 'phi_mode': 'quantile', 'n_particles': 128, 'phi_quantile': 0.34472083652002283, 'gp_lengthscale': 0.1293039059132668, 'gp_noise': 0.034359117694450284, 'cfg_weight': 1.1769028265037145}. Best is trial 115 with value: 0.25854924980045996.
[I 2026-09-14 13:11:40,576] Trial 147 finished with value: 0.2578901164068493 and parameters: {'phi_model': 'eid', 'kappa': 0.763397000573164, 'svgd_iters': 0, 'debt_weight': 0.8246243673492164, 'visit_sat': 0.35915646518665434, 'visit_halflife': 3.5442051147793254, 'phi_mode': 'quantile', 'n_particles': 128, 'phi_quantile': 0.40761358663613007, 'gp_lengthscale': 0.09536324155702657, 'gp_noise': 0.039082250979292764, 'cfg_weight': 1.2093918446670144}. Best is trial 147 with value: 0.2578901164068493.
[I 2026-09-14 13:15:13,397] Trial 148 finished with value: 0.26090281329188203 and parameters: {'phi_model': 'eid', 'kappa': 0.9189540449853202, 'svgd_iters': 0, 'debt_weight': 0.879609032347618, 'visit_sat': 0.4147823993207382, 'visit_halflife': 2.9934148880171083, 'phi_mode': 'quantile', 'n_particles': 128, 'phi_quantile': 0.40723400773904156, 'gp_lengthscale': 0.1333601789885994, 'gp_noise': 0.02502708100522922, 'cfg_weight': 1.371244581747136}. Best is trial 147 with value: 0.2578901164068493.
[I 2026-09-14 13:18:47,908] Trial 149 pruned. 
[I 2026-09-14 13:19:11,798] Trial 150 pruned. 
[I 2026-09-14 13:20:24,288] Trial 151 pruned. 
[I 2026-09-14 13:21:36,343] Trial 152 pruned. 
[I 2026-09-14 13:25:06,933] Trial 153 finished with value: 0.26045048838613505 and parameters: {'phi_model': 'eid', 'kappa': 0.8142747098355593, 'svgd_iters': 0, 'debt_weight': 0.8217110752046978, 'visit_sat': 0.5333719264344653, 'visit_halflife': 3.1081329346079922, 'phi_mode': 'quantile', 'n_particles': 128, 'phi_quantile': 0.35751413423560896, 'gp_lengthscale': 0.1446907956485656, 'gp_noise': 0.03156791459643715, 'cfg_weight': 1.3928972186177844}. Best is trial 147 with value: 0.2578901164068493.
[I 2026-09-14 13:25:30,140] Trial 154 pruned. 
[I 2026-09-14 13:26:40,232] Trial 155 pruned. 
[I 2026-09-14 13:30:10,153] Trial 156 finished with value: 0.2622942726918685 and parameters: {'phi_model': 'eid', 'kappa': 0.7999230025092721, 'svgd_iters': 0, 'debt_weight': 0.7850088185968409, 'visit_sat': 0.4703212517790869, 'visit_halflife': 3.178035563383365, 'phi_mode': 'quantile', 'n_particles': 128, 'phi_quantile': 0.35096738645464887, 'gp_lengthscale': 0.12908082494371975, 'gp_noise': 0.0220670995868729, 'cfg_weight': 1.372793978229855}. Best is trial 147 with value: 0.2578901164068493.
[I 2026-09-14 13:31:20,515] Trial 157 pruned. 
[I 2026-09-14 13:34:52,248] Trial 158 finished with value: 0.2623775230050458 and parameters: {'phi_model': 'eid', 'kappa': 0.6450608649913789, 'svgd_iters': 0, 'debt_weight': 0.8745296226460686, 'visit_sat': 0.46638585906190816, 'visit_halflife': 3.1610925005345116, 'phi_mode': 'quantile', 'n_particles': 128, 'phi_quantile': 0.3234156441835013, 'gp_lengthscale': 0.12333032413656798, 'gp_noise': 0.03356343726666471, 'cfg_weight': 1.5013438856802994}. Best is trial 147 with value: 0.2578901164068493.
[I 2026-09-14 13:38:28,326] Trial 159 finished with value: 0.2608908506930725 and parameters: {'phi_model': 'eid', 'kappa': 1.3158065826979881, 'svgd_iters': 0, 'debt_weight': 0.8887802520636423, 'visit_sat': 0.5411017236535856, 'visit_halflife': 3.9586895861382434, 'phi_mode': 'quantile', 'n_particles': 128, 'phi_quantile': 0.42075241104185135, 'gp_lengthscale': 0.1468242663948727, 'gp_noise': 0.03473753290743422, 'cfg_weight': 1.2249380363546036}. Best is trial 147 with value: 0.2578901164068493.
[I 2026-09-14 13:41:59,212] Trial 160 pruned. 
[I 2026-09-14 13:45:31,345] Trial 161 pruned. 
[I 2026-09-14 13:49:05,907] Trial 162 finished with value: 0.26020452719035125 and parameters: {'phi_model': 'eid', 'kappa': 1.0847824816502272, 'svgd_iters': 0, 'debt_weight': 0.8556234651898337, 'visit_sat': 0.4999881814800119, 'visit_halflife': 3.0680214383718645, 'phi_mode': 'quantile', 'n_particles': 128, 'phi_quantile': 0.42171173415279317, 'gp_lengthscale': 0.11601997084641483, 'gp_noise': 0.03997681666749832, 'cfg_weight': 1.2066897627178723}. Best is trial 147 with value: 0.2578901164068493.
[I 2026-09-14 13:52:42,715] Trial 163 finished with value: 0.25910204314618235 and parameters: {'phi_model': 'eid', 'kappa': 1.095299855377092, 'svgd_iters': 0, 'debt_weight': 0.904319730296756, 'visit_sat': 0.3943199851818328, 'visit_halflife': 3.36815601295712, 'phi_mode': 'quantile', 'n_particles': 128, 'phi_quantile': 0.41949028623945694, 'gp_lengthscale': 0.12088498203877865, 'gp_noise': 0.028043961228199035, 'cfg_weight': 1.3093677821449201}. Best is trial 147 with value: 0.2578901164068493.
[I 2026-09-14 13:53:55,187] Trial 164 pruned. 
[I 2026-09-14 13:57:32,487] Trial 165 finished with value: 0.26136852793625803 and parameters: {'phi_model': 'eid', 'kappa': 1.149616992393238, 'svgd_iters': 0, 'debt_weight': 0.7949056517640367, 'visit_sat': 0.4280392075937872, 'visit_halflife': 3.3820655397189245, 'phi_mode': 'quantile', 'n_particles': 128, 'phi_quantile': 0.39288010004953833, 'gp_lengthscale': 0.09394269552379468, 'gp_noise': 0.03258894372272803, 'cfg_weight': 1.172776092768746}. Best is trial 147 with value: 0.2578901164068493.
[I 2026-09-14 14:01:09,227] Trial 166 finished with value: 0.26103943457384954 and parameters: {'phi_model': 'eid', 'kappa': 1.1508593485695626, 'svgd_iters': 0, 'debt_weight': 0.8646568912443088, 'visit_sat': 0.37974007119124803, 'visit_halflife': 3.6019615916476586, 'phi_mode': 'quantile', 'n_particles': 128, 'phi_quantile': 0.4327450634025263, 'gp_lengthscale': 0.09724980021725052, 'gp_noise': 0.037324597978171434, 'cfg_weight': 1.1621734283140779}. Best is trial 147 with value: 0.2578901164068493.
[I 2026-09-14 14:04:41,482] Trial 167 pruned. 
[I 2026-09-14 14:08:19,215] Trial 168 finished with value: 0.2569257235052576 and parameters: {'phi_model': 'eid', 'kappa': 1.2994638946649053, 'svgd_iters': 0, 'debt_weight': 0.8924698726130771, 'visit_sat': 0.3621173242313718, 'visit_halflife': 3.451477427768596, 'phi_mode': 'quantile', 'n_particles': 128, 'phi_quantile': 0.4060084744656878, 'gp_lengthscale': 0.08224625583518032, 'gp_noise': 0.04059767699657346, 'cfg_weight': 1.2220828940617146}. Best is trial 168 with value: 0.2569257235052576.
[I 2026-09-14 14:11:56,512] Trial 169 pruned. 
[I 2026-09-14 14:15:32,334] Trial 170 finished with value: 0.2585334429492753 and parameters: {'phi_model': 'eid', 'kappa': 1.0427509138634772, 'svgd_iters': 0, 'debt_weight': 0.9159864801767804, 'visit_sat': 0.4036284611521478, 'visit_halflife': 3.13682641090948, 'phi_mode': 'quantile', 'n_particles': 128, 'phi_quantile': 0.42396374175213475, 'gp_lengthscale': 0.12080807325425708, 'gp_noise': 0.03500668666982606, 'cfg_weight': 1.0580672584445274}. Best is trial 168 with value: 0.2569257235052576.
[I 2026-09-14 14:19:02,021] Trial 171 finished with value: 0.25719978023260365 and parameters: {'phi_model': 'eid', 'kappa': 1.0299827797758776, 'svgd_iters': 0, 'debt_weight': 0.9012704150187171, 'visit_sat': 0.41970553349162126, 'visit_halflife': 4.014420611902622, 'phi_mode': 'quantile', 'n_particles': 128, 'phi_quantile': 0.4242915157491528, 'gp_lengthscale': 0.11712750821841024, 'gp_noise': 0.031538050434949845, 'cfg_weight': 1.2623983206381193}. Best is trial 168 with value: 0.2569257235052576.
[I 2026-09-14 14:22:31,830] Trial 172 pruned. 
[I 2026-09-14 14:23:41,855] Trial 173 pruned. 
[I 2026-09-14 14:27:12,493] Trial 174 finished with value: 0.25986855079084653 and parameters: {'phi_model': 'eid', 'kappa': 1.0018999933757076, 'svgd_iters': 0, 'debt_weight': 0.8685802174191157, 'visit_sat': 0.515282548131065, 'visit_halflife': 3.3210409410657613, 'phi_mode': 'quantile', 'n_particles': 128, 'phi_quantile': 0.4301304240628379, 'gp_lengthscale': 0.11710478562256894, 'gp_noise': 0.03326045399417865, 'cfg_weight': 1.0752867761584726}. Best is trial 168 with value: 0.2569257235052576.
[I 2026-09-14 14:27:35,714] Trial 175 pruned. 
[I 2026-09-14 14:31:10,385] Trial 176 finished with value: 0.26172385300093265 and parameters: {'phi_model': 'eid', 'kappa': 1.0802399051341032, 'svgd_iters': 0, 'debt_weight': 0.8729441668036348, 'visit_sat': 0.42932895092665646, 'visit_halflife': 3.038880373325488, 'phi_mode': 'quantile', 'n_particles': 128, 'phi_quantile': 0.4339801521230605, 'gp_lengthscale': 0.1371141225142373, 'gp_noise': 0.026188410728323324, 'cfg_weight': 1.1727601832466445}. Best is trial 168 with value: 0.2569257235052576.
[I 2026-09-14 14:34:52,388] Trial 177 finished with value: 0.26063211121809643 and parameters: {'phi_model': 'eid', 'kappa': 0.976933086363484, 'svgd_iters': 0, 'debt_weight': 0.8240752909273161, 'visit_sat': 0.4801499935723542, 'visit_halflife': 3.592607726512858, 'phi_mode': 'quantile', 'n_particles': 128, 'phi_quantile': 0.41505200805680165, 'gp_lengthscale': 0.11993728378950134, 'gp_noise': 0.027715452601223784, 'cfg_weight': 1.1716668806613117}. Best is trial 168 with value: 0.2569257235052576.
[I 2026-09-14 14:38:32,110] Trial 178 finished with value: 0.26276738774171043 and parameters: {'phi_model': 'eid', 'kappa': 0.9963063350568255, 'svgd_iters': 0, 'debt_weight': 0.9004677110285562, 'visit_sat': 0.39505237798843545, 'visit_halflife': 3.8741041623966006, 'phi_mode': 'quantile', 'n_particles': 128, 'phi_quantile': 0.4174066399855907, 'gp_lengthscale': 0.11850363029864591, 'gp_noise': 0.027114934930676505, 'cfg_weight': 1.2873904378575656}. Best is trial 168 with value: 0.2569257235052576.
[I 2026-09-14 14:38:57,089] Trial 179 pruned. 
[I 2026-09-14 14:39:20,289] Trial 180 pruned. 
[I 2026-09-14 14:39:43,618] Trial 181 pruned. 
[I 2026-09-14 14:40:06,931] Trial 182 pruned. 
[I 2026-09-14 14:43:53,383] Trial 183 pruned. 
[I 2026-09-14 14:44:17,111] Trial 184 pruned. 
[I 2026-09-14 14:47:53,328] Trial 185 finished with value: 0.2620225463795364 and parameters: {'phi_model': 'eid', 'kappa': 0.8430860452197423, 'svgd_iters': 0, 'debt_weight': 0.8135748055962291, 'visit_sat': 0.5382538509374984, 'visit_halflife': 3.0221479214814138, 'phi_mode': 'quantile', 'n_particles': 128, 'phi_quantile': 0.408912902104193, 'gp_lengthscale': 0.12783365774020913, 'gp_noise': 0.027211968129954058, 'cfg_weight': 1.1768532516835744}. Best is trial 168 with value: 0.2569257235052576.
[I 2026-09-14 14:51:42,955] Trial 186 pruned. 
[I 2026-09-14 14:55:33,386] Trial 187 pruned. 
[I 2026-09-14 14:59:21,838] Trial 188 finished with value: 0.26251203835447723 and parameters: {'phi_model': 'eid', 'kappa': 1.219357181624003, 'svgd_iters': 0, 'debt_weight': 0.7114194657864049, 'visit_sat': 0.4545483493681969, 'visit_halflife': 3.4901044991202204, 'phi_mode': 'quantile', 'n_particles': 128, 'phi_quantile': 0.39379837641794424, 'gp_lengthscale': 0.13736792990345573, 'gp_noise': 0.02533527831459655, 'cfg_weight': 1.1204491334362956}. Best is trial 168 with value: 0.2569257235052576.
[I 2026-09-14 14:59:58,048] Trial 189 pruned. 
[I 2026-09-14 15:01:48,523] Trial 190 pruned. 
[I 2026-09-14 15:02:24,916] Trial 191 pruned. 
[I 2026-09-14 15:04:21,867] Trial 192 pruned. 
[I 2026-09-14 15:06:18,801] Trial 193 pruned. 
[I 2026-09-14 15:08:15,138] Trial 194 pruned. 
[I 2026-09-14 15:12:19,676] Trial 195 finished with value: 0.2627026762586821 and parameters: {'phi_model': 'eid', 'kappa': 1.4281810932878534, 'svgd_iters': 0, 'debt_weight': 0.9630691933202761, 'visit_sat': 0.40372761148178377, 'visit_halflife': 3.1210671210118575, 'phi_mode': 'quantile', 'n_particles': 128, 'phi_quantile': 0.37762363718648057, 'gp_lengthscale': 0.12687022447394491, 'gp_noise': 0.029550272305309596, 'cfg_weight': 1.1575110342922712}. Best is trial 168 with value: 0.2569257235052576.
[I 2026-09-14 15:16:04,623] Trial 196 finished with value: 0.2601132540031597 and parameters: {'phi_model': 'eid', 'kappa': 0.9086385966467205, 'svgd_iters': 0, 'debt_weight': 0.8765189728344163, 'visit_sat': 0.35345114172307746, 'visit_halflife': 3.2714256099296506, 'phi_mode': 'quantile', 'n_particles': 128, 'phi_quantile': 0.39229540533419766, 'gp_lengthscale': 0.11814110181279146, 'gp_noise': 0.03513591836181896, 'cfg_weight': 1.1694302631775324}. Best is trial 168 with value: 0.2569257235052576.
[I 2026-09-14 15:19:46,476] Trial 197 pruned. 
[I 2026-09-14 15:23:27,105] Trial 198 pruned. 
[I 2026-09-14 15:23:51,069] Trial 199 pruned. 
[I 2026-09-14 15:27:27,235] Trial 200 finished with value: 0.26001007750366023 and parameters: {'phi_model': 'eid', 'kappa': 0.7338913586565265, 'svgd_iters': 0, 'debt_weight': 0.8311279740063965, 'visit_sat': 0.4058894410309349, 'visit_halflife': 3.293989653814359, 'phi_mode': 'quantile', 'n_particles': 128, 'phi_quantile': 0.3921637048794421, 'gp_lengthscale': 0.1330034341296878, 'gp_noise': 0.03697262246963058, 'cfg_weight': 1.1672616667609488}. Best is trial 168 with value: 0.2569257235052576.
[I 2026-09-14 15:31:07,014] Trial 201 pruned. 
[I 2026-09-14 15:31:31,498] Trial 202 pruned. 
[I 2026-09-14 15:31:56,016] Trial 203 pruned. 
[I 2026-09-14 15:33:08,630] Trial 204 pruned. 
[I 2026-09-14 15:33:32,671] Trial 205 pruned. 
[I 2026-09-14 15:37:09,841] Trial 206 pruned. 
[I 2026-09-14 15:38:20,419] Trial 207 pruned. 
[I 2026-09-14 15:41:54,251] Trial 208 pruned. 
[I 2026-09-14 15:45:29,870] Trial 209 pruned. 
[I 2026-09-14 15:46:43,985] Trial 210 pruned. 
[I 2026-09-14 15:50:27,534] Trial 211 finished with value: 0.2589012331121377 and parameters: {'phi_model': 'eid', 'kappa': 1.1850463208359732, 'svgd_iters': 0, 'debt_weight': 0.835613597354158, 'visit_sat': 0.3924695821159596, 'visit_halflife': 3.790526837752601, 'phi_mode': 'quantile', 'n_particles': 128, 'phi_quantile': 0.36416328367593764, 'gp_lengthscale': 0.08434786468505825, 'gp_noise': 0.04006997363928234, 'cfg_weight': 1.107869997549207}. Best is trial 168 with value: 0.2569257235052576.
[I 2026-09-14 15:53:59,287] Trial 212 finished with value: 0.26030592116409995 and parameters: {'phi_model': 'eid', 'kappa': 1.1756781198009805, 'svgd_iters': 0, 'debt_weight': 0.8524145237967914, 'visit_sat': 0.4609648558846237, 'visit_halflife': 3.016905359964529, 'phi_mode': 'quantile', 'n_particles': 128, 'phi_quantile': 0.3600372256284729, 'gp_lengthscale': 0.11030980253944832, 'gp_noise': 0.04072132386833419, 'cfg_weight': 1.2154338134805978}. Best is trial 168 with value: 0.2569257235052576.
[I 2026-09-14 15:57:34,572] Trial 213 pruned. 
[I 2026-09-14 15:58:01,140] Trial 214 pruned. 
[I 2026-09-14 15:58:26,181] Trial 215 pruned. 
