[I 2026-09-15 17:51:20,243] Trial 683 finished with value: 0.25903831384984927 and parameters: {'phi_model': 'eid', 'kappa': 1.0900647963929389, 'svgd_iters': 0, 'debt_weight': 0.8539481568437854, 'visit_sat': 0.528739683360549, 'visit_halflife': 1.794686642323344, 'phi_mode': 'quantile', 'n_particles': 128, 'phi_quantile': 0.7770667625184684, 'gp_lengthscale': 0.12234461589537447, 'gp_noise': 0.09716807758597808, 'cfg_weight': 1.0948116122060754}. Best is trial 623 with value: 0.25173625097173163.
[I 2026-09-15 17:52:30,270] Trial 684 pruned. 
[I 2026-09-15 17:52:53,371] Trial 685 pruned. 
[I 2026-09-15 17:56:22,629] Trial 686 finished with value: 0.2593311138972693 and parameters: {'phi_model': 'eid', 'kappa': 5.6273628740515145, 'svgd_iters': 0, 'debt_weight': 0.9052453162597686, 'visit_sat': 0.5521678632011969, 'visit_halflife': 1.8428152606110997, 'phi_mode': 'quantile', 'n_particles': 128, 'phi_quantile': 0.8472303521517432, 'gp_lengthscale': 0.12576174189395517, 'gp_noise': 0.07557474851034157, 'cfg_weight': 1.4073663803409748}. Best is trial 623 with value: 0.25173625097173163.
[I 2026-09-15 17:59:51,969] Trial 687 pruned. 
[I 2026-09-15 18:03:21,283] Trial 688 finished with value: 0.256092714591842 and parameters: {'phi_model': 'eid', 'kappa': 1.264203023500605, 'svgd_iters': 0, 'debt_weight': 0.8023811791123172, 'visit_sat': 0.46183083808166525, 'visit_halflife': 2.19798697016314, 'phi_mode': 'quantile', 'n_particles': 128, 'phi_quantile': 0.8088480045867622, 'gp_lengthscale': 0.13172098403530427, 'gp_noise': 0.07738092406611466, 'cfg_weight': 1.3997769148806776}. Best is trial 623 with value: 0.25173625097173163.
[I 2026-09-15 18:06:50,473] Trial 689 pruned. 
[I 2026-09-15 18:11:13,527] Trial 690 pruned. 
[I 2026-09-15 18:12:23,455] Trial 691 pruned. 
[I 2026-09-15 18:15:52,955] Trial 692 finished with value: 0.2584776190377976 and parameters: {'phi_model': 'eid', 'kappa': 0.8871682381007593, 'svgd_iters': 0, 'debt_weight': 0.8211447235470889, 'visit_sat': 0.41733041345265787, 'visit_halflife': 2.3021892569297573, 'phi_mode': 'quantile', 'n_particles': 128, 'phi_quantile': 0.7945521396380256, 'gp_lengthscale': 0.14612801322035124, 'gp_noise': 0.07127029344856287, 'cfg_weight': 1.4377143261637322}. Best is trial 623 with value: 0.25173625097173163.
[I 2026-09-15 18:19:22,397] Trial 693 pruned. 
[I 2026-09-15 18:19:45,514] Trial 694 pruned. 
[I 2026-09-15 18:20:55,483] Trial 695 pruned. 
[I 2026-09-15 18:21:18,605] Trial 696 pruned. 
[I 2026-09-15 18:24:48,033] Trial 697 pruned. 
[I 2026-09-15 18:25:11,151] Trial 698 pruned. 
[I 2026-09-15 18:28:40,689] Trial 699 finished with value: 0.25727661845510713 and parameters: {'phi_model': 'eid', 'kappa': 0.8529831801882378, 'svgd_iters': 0, 'debt_weight': 0.9458181251443571, 'visit_sat': 0.5873123323109001, 'visit_halflife': 2.2606061179645183, 'phi_mode': 'quantile', 'n_particles': 128, 'phi_quantile': 0.2930627903447639, 'gp_lengthscale': 0.08570857419166696, 'gp_noise': 0.0691063011886585, 'cfg_weight': 1.2243192285717774}. Best is trial 623 with value: 0.25173625097173163.
[I 2026-09-15 18:29:50,696] Trial 700 pruned. 
[I 2026-09-15 18:31:00,721] Trial 701 pruned. 
[I 2026-09-15 18:32:10,713] Trial 702 pruned. 
[I 2026-09-15 18:32:33,835] Trial 703 pruned. 
[I 2026-09-15 18:32:56,962] Trial 704 pruned. 
[I 2026-09-15 18:33:20,103] Trial 705 pruned. 
[I 2026-09-15 18:36:49,695] Trial 706 finished with value: 0.25583958238500487 and parameters: {'phi_model': 'eid', 'kappa': 0.8993516482894852, 'svgd_iters': 0, 'debt_weight': 0.8435031023836722, 'visit_sat': 0.48117579063272037, 'visit_halflife': 2.0567500732049586, 'phi_mode': 'quantile', 'n_particles': 128, 'phi_quantile': 0.1583216616422398, 'gp_lengthscale': 0.1316649474506346, 'gp_noise': 0.08720641426143333, 'cfg_weight': 1.4030181681006746}. Best is trial 623 with value: 0.25173625097173163.
[I 2026-09-15 18:37:12,823] Trial 707 pruned. 
[I 2026-09-15 18:37:35,965] Trial 708 pruned. 
[I 2026-09-15 18:41:05,518] Trial 709 finished with value: 0.25888813382453907 and parameters: {'phi_model': 'eid', 'kappa': 0.9118734706023522, 'svgd_iters': 0, 'debt_weight': 0.7908675793847731, 'visit_sat': 0.4655650293893897, 'visit_halflife': 1.301814536438002, 'phi_mode': 'quantile', 'n_particles': 128, 'phi_quantile': 0.22749971407169095, 'gp_lengthscale': 0.13469369709736323, 'gp_noise': 0.05698068857403538, 'cfg_weight': 1.4896511614624037}. Best is trial 623 with value: 0.25173625097173163.
[I 2026-09-15 18:41:28,651] Trial 710 pruned. 
[I 2026-09-15 18:41:51,777] Trial 711 pruned. 
[I 2026-09-15 18:45:21,246] Trial 712 pruned. 
[I 2026-09-15 18:45:49,579] Trial 713 pruned. 
[I 2026-09-15 18:46:59,509] Trial 714 pruned. 
[I 2026-09-15 18:47:22,613] Trial 715 pruned. 
[I 2026-09-15 18:48:32,552] Trial 716 pruned. 
[I 2026-09-15 18:52:01,854] Trial 717 pruned. 
[I 2026-09-15 18:55:31,167] Trial 718 pruned. 
[I 2026-09-15 18:59:00,557] Trial 719 pruned. 
[I 2026-09-15 19:02:29,833] Trial 720 pruned. 
[I 2026-09-15 19:03:17,057] Trial 721 pruned. 
[I 2026-09-15 19:06:46,620] Trial 722 finished with value: 0.25788437641293316 and parameters: {'phi_model': 'eid', 'kappa': 0.9977908682950071, 'svgd_iters': 0, 'debt_weight': 0.8566251910182151, 'visit_sat': 0.6247160411594511, 'visit_halflife': 1.7370944293693238, 'phi_mode': 'quantile', 'n_particles': 128, 'phi_quantile': 0.15548129049557463, 'gp_lengthscale': 0.14749263494249193, 'gp_noise': 0.0767715784372805, 'cfg_weight': 1.4280873511216277}. Best is trial 623 with value: 0.25173625097173163.
[I 2026-09-15 19:07:09,745] Trial 723 pruned. 
[I 2026-09-15 19:07:32,874] Trial 724 pruned. 
[I 2026-09-15 19:11:02,397] Trial 725 finished with value: 0.25635908699830273 and parameters: {'phi_model': 'eid', 'kappa': 0.9417667722300882, 'svgd_iters': 0, 'debt_weight': 0.8763515026810967, 'visit_sat': 0.4951433013136697, 'visit_halflife': 1.771040227339521, 'phi_mode': 'quantile', 'n_particles': 128, 'phi_quantile': 0.12183466507779561, 'gp_lengthscale': 0.13229458194768823, 'gp_noise': 0.09210357485212696, 'cfg_weight': 1.354825654286077}. Best is trial 623 with value: 0.25173625097173163.
[I 2026-09-15 19:14:31,864] Trial 726 pruned. 
[I 2026-09-15 19:18:01,420] Trial 727 finished with value: 0.25603652902656077 and parameters: {'phi_model': 'eid', 'kappa': 0.9241692079283402, 'svgd_iters': 0, 'debt_weight': 0.7857238784968544, 'visit_sat': 0.4781376783346443, 'visit_halflife': 1.9464243709114135, 'phi_mode': 'quantile', 'n_particles': 128, 'phi_quantile': 0.16973555451306138, 'gp_lengthscale': 0.13564842078188188, 'gp_noise': 0.07412005996721309, 'cfg_weight': 1.5022937620976338}. Best is trial 623 with value: 0.25173625097173163.
[I 2026-09-15 19:18:24,554] Trial 728 pruned. 
[I 2026-09-15 19:18:47,678] Trial 729 pruned. 
[I 2026-09-15 19:22:17,107] Trial 730 pruned. 
[I 2026-09-15 19:22:40,231] Trial 731 pruned. 
[I 2026-09-15 19:23:03,349] Trial 732 pruned. 
[I 2026-09-15 19:26:32,864] Trial 733 finished with value: 0.25772607726531865 and parameters: {'phi_model': 'eid', 'kappa': 0.9719080732001507, 'svgd_iters': 0, 'debt_weight': 0.7807676609302877, 'visit_sat': 0.44349004085659005, 'visit_halflife': 2.0028305076780146, 'phi_mode': 'quantile', 'n_particles': 128, 'phi_quantile': 0.11528898284869481, 'gp_lengthscale': 0.1472329232372793, 'gp_noise': 0.06130577343378437, 'cfg_weight': 1.5075796103689802}. Best is trial 623 with value: 0.25173625097173163.
[I 2026-09-15 19:30:02,354] Trial 734 pruned. 
[I 2026-09-15 19:33:31,922] Trial 735 finished with value: 0.2576013188646567 and parameters: {'phi_model': 'eid', 'kappa': 0.9982040720756525, 'svgd_iters': 0, 'debt_weight': 0.8654846859314921, 'visit_sat': 0.5314607787893485, 'visit_halflife': 1.5093603025311206, 'phi_mode': 'quantile', 'n_particles': 128, 'phi_quantile': 0.14888809260044233, 'gp_lengthscale': 0.13066434045404562, 'gp_noise': 0.11266336096776297, 'cfg_weight': 1.3939318778841274}. Best is trial 623 with value: 0.25173625097173163.
[I 2026-09-15 19:34:41,927] Trial 736 pruned. 
[I 2026-09-15 19:38:11,458] Trial 737 finished with value: 0.25814094593207304 and parameters: {'phi_model': 'eid', 'kappa': 0.8468853636404005, 'svgd_iters': 0, 'debt_weight': 0.996434464929765, 'visit_sat': 0.5163395523642142, 'visit_halflife': 3.123170365271542, 'phi_mode': 'quantile', 'n_particles': 128, 'phi_quantile': 0.1756524455167206, 'gp_lengthscale': 0.07719368513471017, 'gp_noise': 0.0773771629090837, 'cfg_weight': 1.066926005095679}. Best is trial 623 with value: 0.25173625097173163.
[I 2026-09-15 19:41:40,934] Trial 738 pruned. 
[I 2026-09-15 19:42:04,065] Trial 739 pruned. 
[I 2026-09-15 19:42:27,189] Trial 740 pruned. 
[I 2026-09-15 19:45:56,713] Trial 741 finished with value: 0.25762837396427246 and parameters: {'phi_model': 'eid', 'kappa': 0.9387102330211328, 'svgd_iters': 0, 'debt_weight': 0.9988230249495846, 'visit_sat': 0.5312796345476013, 'visit_halflife': 3.0827461734304697, 'phi_mode': 'quantile', 'n_particles': 128, 'phi_quantile': 0.1955706140966117, 'gp_lengthscale': 0.10428542089779075, 'gp_noise': 0.06661224184566808, 'cfg_weight': 1.0454239417420976}. Best is trial 623 with value: 0.25173625097173163.
[I 2026-09-15 19:46:19,848] Trial 742 pruned. 
[I 2026-09-15 19:47:29,827] Trial 743 pruned. 
[I 2026-09-15 19:48:39,847] Trial 744 pruned. 
[I 2026-09-15 19:49:49,849] Trial 745 pruned. 
[I 2026-09-15 19:50:59,881] Trial 746 pruned. 
[I 2026-09-15 19:51:22,993] Trial 747 pruned. 
[I 2026-09-15 19:54:52,511] Trial 748 pruned. 
[I 2026-09-15 19:56:02,519] Trial 749 pruned. 
[I 2026-09-15 19:59:32,054] Trial 750 finished with value: 0.25647971763829447 and parameters: {'phi_model': 'eid', 'kappa': 0.8112834804927704, 'svgd_iters': 0, 'debt_weight': 0.8043905757154545, 'visit_sat': 0.4980053885425828, 'visit_halflife': 2.5992119504862914, 'phi_mode': 'quantile', 'n_particles': 128, 'phi_quantile': 0.10158723786628457, 'gp_lengthscale': 0.11817179592454176, 'gp_noise': 0.07873638915788182, 'cfg_weight': 1.2818896940387643}. Best is trial 623 with value: 0.25173625097173163.
[I 2026-09-15 19:59:55,195] Trial 751 pruned. 
[I 2026-09-15 20:00:18,358] Trial 752 pruned. 
[I 2026-09-15 20:01:28,351] Trial 753 pruned. 
[I 2026-09-15 20:01:51,478] Trial 754 pruned. 
[I 2026-09-15 20:03:01,494] Trial 755 pruned. 
[I 2026-09-15 20:03:24,629] Trial 756 pruned. 
[I 2026-09-15 20:03:47,775] Trial 757 pruned. 
[I 2026-09-15 20:07:17,334] Trial 758 finished with value: 0.25580634981144224 and parameters: {'phi_model': 'eid', 'kappa': 0.9988181093065882, 'svgd_iters': 0, 'debt_weight': 0.8013068475826347, 'visit_sat': 0.5271161071537095, 'visit_halflife': 3.335500362596341, 'phi_mode': 'quantile', 'n_particles': 128, 'phi_quantile': 0.1257829974459912, 'gp_lengthscale': 0.1031691350432523, 'gp_noise': 0.09013196230863076, 'cfg_weight': 1.35505909700328}. Best is trial 623 with value: 0.25173625097173163.
[I 2026-09-15 20:07:40,474] Trial 759 pruned. 
[I 2026-09-15 20:08:50,472] Trial 760 pruned. 
[I 2026-09-15 20:12:20,005] Trial 761 finished with value: 0.2556043679678192 and parameters: {'phi_model': 'eid', 'kappa': 1.038874547044187, 'svgd_iters': 0, 'debt_weight': 0.8559932715125218, 'visit_sat': 0.49182359716275464, 'visit_halflife': 2.504601944117195, 'phi_mode': 'quantile', 'n_particles': 128, 'phi_quantile': 0.11976981362228482, 'gp_lengthscale': 0.1341094843139086, 'gp_noise': 0.09757767441265434, 'cfg_weight': 1.5932681806701294}. Best is trial 623 with value: 0.25173625097173163.
[I 2026-09-15 20:15:49,506] Trial 762 pruned. 
[I 2026-09-15 20:19:19,097] Trial 763 finished with value: 0.25547849326029853 and parameters: {'phi_model': 'eid', 'kappa': 1.0398403011150352, 'svgd_iters': 0, 'debt_weight': 0.9269094375546091, 'visit_sat': 0.48222212262728725, 'visit_halflife': 2.3329156998477765, 'phi_mode': 'quantile', 'n_particles': 128, 'phi_quantile': 0.11785101496918965, 'gp_lengthscale': 0.14799869990385733, 'gp_noise': 0.09399915670474848, 'cfg_weight': 1.5554835785581527}. Best is trial 623 with value: 0.25173625097173163.
[I 2026-09-15 20:22:48,593] Trial 764 pruned. 
[I 2026-09-15 20:23:11,730] Trial 765 pruned. 
[I 2026-09-15 20:26:41,259] Trial 766 finished with value: 0.2572057169390341 and parameters: {'phi_model': 'eid', 'kappa': 1.1618268278289803, 'svgd_iters': 0, 'debt_weight': 0.8116585863603626, 'visit_sat': 0.654579183643613, 'visit_halflife': 1.8199919722928473, 'phi_mode': 'quantile', 'n_particles': 128, 'phi_quantile': 0.12048381923777737, 'gp_lengthscale': 0.11689124102079884, 'gp_noise': 0.06525799064564163, 'cfg_weight': 1.4231890001955274}. Best is trial 623 with value: 0.25173625097173163.
[I 2026-09-15 20:27:04,403] Trial 767 pruned. 
[I 2026-09-15 20:27:27,533] Trial 768 pruned. 
[I 2026-09-15 20:27:50,656] Trial 769 pruned. 
[I 2026-09-15 20:29:00,517] Trial 770 pruned. 
[I 2026-09-15 20:32:30,033] Trial 771 finished with value: 0.255310020492475 and parameters: {'phi_model': 'eid', 'kappa': 1.1242156651523367, 'svgd_iters': 0, 'debt_weight': 0.9013944718354765, 'visit_sat': 0.5298119618718863, 'visit_halflife': 2.1422451398102322, 'phi_mode': 'quantile', 'n_particles': 128, 'phi_quantile': 0.150633190453901, 'gp_lengthscale': 0.15313098843628545, 'gp_noise': 0.09034124481218275, 'cfg_weight': 1.5829115516768606}. Best is trial 623 with value: 0.25173625097173163.
[I 2026-09-15 20:35:59,520] Trial 772 pruned. 
[I 2026-09-15 20:36:22,663] Trial 773 pruned. 
[I 2026-09-15 20:39:52,104] Trial 774 pruned. 
[I 2026-09-15 20:43:21,616] Trial 775 finished with value: 0.2541317681426201 and parameters: {'phi_model': 'eid', 'kappa': 1.0382881920163476, 'svgd_iters': 0, 'debt_weight': 0.7883265856949646, 'visit_sat': 0.4969474573101905, 'visit_halflife': 3.640428112158463, 'phi_mode': 'quantile', 'n_particles': 128, 'phi_quantile': 0.16021964837244745, 'gp_lengthscale': 0.1050035133564843, 'gp_noise': 0.08681170643683143, 'cfg_weight': 1.4394820901190277}. Best is trial 623 with value: 0.25173625097173163.
[I 2026-09-15 20:46:51,133] Trial 776 finished with value: 0.25492610963781787 and parameters: {'phi_model': 'eid', 'kappa': 1.1966608897809, 'svgd_iters': 0, 'debt_weight': 0.8098190337036496, 'visit_sat': 0.5174813031098808, 'visit_halflife': 3.3588459435135802, 'phi_mode': 'quantile', 'n_particles': 128, 'phi_quantile': 0.17961030479814433, 'gp_lengthscale': 0.10644311741811203, 'gp_noise': 0.10265129231951561, 'cfg_weight': 1.3866199655826847}. Best is trial 623 with value: 0.25173625097173163.
[I 2026-09-15 20:50:20,573] Trial 777 pruned. 
[I 2026-09-15 20:51:30,554] Trial 778 pruned. 
[I 2026-09-15 20:55:46,000] Trial 779 finished with value: 0.25820271021816393 and parameters: {'phi_model': 'eid', 'kappa': 1.2163007855602002, 'svgd_iters': 25, 'debt_weight': 0.8709548456682779, 'visit_sat': 0.5619415692097615, 'visit_halflife': 2.0303904668477375, 'phi_mode': 'quantile', 'n_particles': 128, 'phi_quantile': 0.1742352061897794, 'gp_lengthscale': 0.12542779260138057, 'gp_noise': 0.06155647535346505, 'cfg_weight': 1.2272106001044982}. Best is trial 623 with value: 0.25173625097173163.
[I 2026-09-15 20:56:55,961] Trial 780 pruned. 
[I 2026-09-15 21:00:25,501] Trial 781 finished with value: 0.25345431180375705 and parameters: {'phi_model': 'eid', 'kappa': 1.0233105745800395, 'svgd_iters': 0, 'debt_weight': 0.8344175395730754, 'visit_sat': 0.4827091162661404, 'visit_halflife': 2.1328597409852077, 'phi_mode': 'quantile', 'n_particles': 128, 'phi_quantile': 0.1568725298479687, 'gp_lengthscale': 0.1460271106675455, 'gp_noise': 0.08487752894038782, 'cfg_weight': 1.4971725861037433}. Best is trial 623 with value: 0.25173625097173163.
[I 2026-09-15 21:00:48,626] Trial 782 pruned. 
[I 2026-09-15 21:01:58,618] Trial 783 pruned. 
[I 2026-09-15 21:05:28,162] Trial 784 pruned. 
[I 2026-09-15 21:05:51,303] Trial 785 pruned. 
[I 2026-09-15 21:09:20,872] Trial 786 finished with value: 0.258064266131581 and parameters: {'phi_model': 'eid', 'kappa': 1.0166842357801318, 'svgd_iters': 0, 'debt_weight': 0.8250200456111613, 'visit_sat': 0.48370182105909687, 'visit_halflife': 3.4607246610602376, 'phi_mode': 'quantile', 'n_particles': 128, 'phi_quantile': 0.15535053924513217, 'gp_lengthscale': 0.11221294319224785, 'gp_noise': 0.1067715304774214, 'cfg_weight': 1.216582642233136}. Best is trial 623 with value: 0.25173625097173163.
[I 2026-09-15 21:10:30,912] Trial 787 pruned. 
[I 2026-09-15 21:10:54,056] Trial 788 pruned. 
[I 2026-09-15 21:12:04,078] Trial 789 pruned. 
[I 2026-09-15 21:12:27,212] Trial 790 pruned. 
[I 2026-09-15 21:12:50,341] Trial 791 pruned. 
[I 2026-09-15 21:16:20,421] Trial 792 finished with value: 0.2576276414559841 and parameters: {'phi_model': 'eid', 'kappa': 1.0629387309612448, 'svgd_iters': 0, 'debt_weight': 0.9335168198263204, 'visit_sat': 0.5085136909761934, 'visit_halflife': 2.541381330044832, 'phi_mode': 'quantile', 'n_particles': 128, 'phi_quantile': 0.20393927022792696, 'gp_lengthscale': 0.14406724224804157, 'gp_noise': 0.09129653686660225, 'cfg_weight': 1.685977853057446}. Best is trial 623 with value: 0.25173625097173163.
[I 2026-09-15 21:16:43,586] Trial 793 pruned. 
[I 2026-09-15 21:17:06,736] Trial 794 pruned. 
[I 2026-09-15 21:17:29,875] Trial 795 pruned. 
[I 2026-09-15 21:18:39,918] Trial 796 pruned. 
[I 2026-09-15 21:19:03,071] Trial 797 pruned. 
[I 2026-09-15 21:20:13,092] Trial 798 pruned. 
[I 2026-09-15 21:20:36,232] Trial 799 pruned. 
[I 2026-09-15 21:20:59,389] Trial 800 pruned. 
[I 2026-09-15 21:24:28,923] Trial 801 pruned. 
[I 2026-09-15 21:24:52,059] Trial 802 pruned. 
[I 2026-09-15 21:25:15,170] Trial 803 pruned. 
[I 2026-09-15 21:28:44,804] Trial 804 finished with value: 0.25952360194620266 and parameters: {'phi_model': 'eid', 'kappa': 1.0769575346279714, 'svgd_iters': 0, 'debt_weight': 0.7894479220958158, 'visit_sat': 0.45515181657536163, 'visit_halflife': 3.0358043351473007, 'phi_mode': 'quantile', 'n_particles': 128, 'phi_quantile': 0.17002409182673633, 'gp_lengthscale': 0.10467362708604645, 'gp_noise': 0.09859104376166063, 'cfg_weight': 1.3986848565632448}. Best is trial 623 with value: 0.25173625097173163.
[I 2026-09-15 21:32:14,410] Trial 805 finished with value: 0.2558479106372441 and parameters: {'phi_model': 'eid', 'kappa': 1.183124661166524, 'svgd_iters': 0, 'debt_weight': 0.8774258366179656, 'visit_sat': 0.4541815768283585, 'visit_halflife': 1.6615687965290986, 'phi_mode': 'quantile', 'n_particles': 128, 'phi_quantile': 0.1305121070784992, 'gp_lengthscale': 0.1151479321619751, 'gp_noise': 0.08101637729598256, 'cfg_weight': 1.3576418791227538}. Best is trial 623 with value: 0.25173625097173163.
[I 2026-09-15 21:32:37,545] Trial 806 pruned. 
[I 2026-09-15 21:33:00,677] Trial 807 pruned. 
[I 2026-09-15 21:36:30,240] Trial 808 pruned. 
[I 2026-09-15 21:39:59,851] Trial 809 finished with value: 0.25502023472864316 and parameters: {'phi_model': 'eid', 'kappa': 0.9569665737631854, 'svgd_iters': 0, 'debt_weight': 0.887328871988969, 'visit_sat': 0.4977581224484262, 'visit_halflife': 2.010334347964275, 'phi_mode': 'quantile', 'n_particles': 128, 'phi_quantile': 0.1312565805010387, 'gp_lengthscale': 0.13790701360225996, 'gp_noise': 0.11120795525905333, 'cfg_weight': 1.5910766184829817}. Best is trial 623 with value: 0.25173625097173163.
[I 2026-09-15 21:43:29,435] Trial 810 finished with value: 0.25742202129141284 and parameters: {'phi_model': 'eid', 'kappa': 1.1555469291518803, 'svgd_iters': 0, 'debt_weight': 0.8020826216849107, 'visit_sat': 0.5043913568921342, 'visit_halflife': 4.093922970606702, 'phi_mode': 'quantile', 'n_particles': 128, 'phi_quantile': 0.12712280107696844, 'gp_lengthscale': 0.1131494477774594, 'gp_noise': 0.08817291173479216, 'cfg_weight': 1.4282204360908641}. Best is trial 623 with value: 0.25173625097173163.
[I 2026-09-15 21:44:39,460] Trial 811 pruned. 
[I 2026-09-15 21:48:09,070] Trial 812 finished with value: 0.25939541433914676 and parameters: {'phi_model': 'eid', 'kappa': 1.101144942031083, 'svgd_iters': 0, 'debt_weight': 0.8551619895464575, 'visit_sat': 0.4199310685339048, 'visit_halflife': 1.175378353678886, 'phi_mode': 'quantile', 'n_particles': 128, 'phi_quantile': 0.13705112622783594, 'gp_lengthscale': 0.1193944792997796, 'gp_noise': 0.08873953448186317, 'cfg_weight': 1.4547031998144146}. Best is trial 623 with value: 0.25173625097173163.
[I 2026-09-15 21:48:32,207] Trial 813 pruned. 
[I 2026-09-15 21:52:01,876] Trial 814 finished with value: 0.25220564250978844 and parameters: {'phi_model': 'eid', 'kappa': 1.0398244732513393, 'svgd_iters': 0, 'debt_weight': 0.8712501382831721, 'visit_sat': 0.4233045527942416, 'visit_halflife': 1.4275864965329088, 'phi_mode': 'quantile', 'n_particles': 128, 'phi_quantile': 0.11485545546209855, 'gp_lengthscale': 0.10718779593026372, 'gp_noise': 0.09187118298854204, 'cfg_weight': 1.182542759499152}. Best is trial 623 with value: 0.25173625097173163.
[I 2026-09-15 21:53:11,889] Trial 815 pruned. 
[I 2026-09-15 21:53:35,031] Trial 816 pruned. 
[I 2026-09-15 21:53:58,163] Trial 817 pruned. 
[I 2026-09-15 21:57:27,747] Trial 818 finished with value: 0.2592651996061577 and parameters: {'phi_model': 'eid', 'kappa': 1.1269939195314396, 'svgd_iters': 0, 'debt_weight': 0.915380016527404, 'visit_sat': 0.4511328625431853, 'visit_halflife': 1.6433942086612237, 'phi_mode': 'quantile', 'n_particles': 128, 'phi_quantile': 0.13284183539212854, 'gp_lengthscale': 0.1257693935557433, 'gp_noise': 0.07922331105990145, 'cfg_weight': 1.3741135543357164}. Best is trial 623 with value: 0.25173625097173163.
