[I 2026-09-15 22:00:57,317] Trial 819 finished with value: 0.255700057130459 and parameters: {'phi_model': 'eid', 'kappa': 1.0335093856970143, 'svgd_iters': 0, 'debt_weight': 0.9069757806327399, 'visit_sat': 0.4853219850291278, 'visit_halflife': 1.8409954410784197, 'phi_mode': 'quantile', 'n_particles': 128, 'phi_quantile': 0.142430858444944, 'gp_lengthscale': 0.11582402015386611, 'gp_noise': 0.10831904351902791, 'cfg_weight': 1.5704073377684662}. Best is trial 623 with value: 0.25173625097173163.
[I 2026-09-15 22:01:20,473] Trial 820 pruned. 
[I 2026-09-15 22:02:30,469] Trial 821 pruned. 
[I 2026-09-15 22:02:53,547] Trial 822 pruned. 
[I 2026-09-15 22:03:16,675] Trial 823 pruned. 
[I 2026-09-15 22:06:46,247] Trial 824 finished with value: 0.25479578834416516 and parameters: {'phi_model': 'eid', 'kappa': 1.050947051723391, 'svgd_iters': 0, 'debt_weight': 0.8782635737923687, 'visit_sat': 0.48949909072319575, 'visit_halflife': 2.365998245211358, 'phi_mode': 'quantile', 'n_particles': 128, 'phi_quantile': 0.16188015868422587, 'gp_lengthscale': 0.1475588178021854, 'gp_noise': 0.11555876402619636, 'cfg_weight': 1.5314288702674894}. Best is trial 623 with value: 0.25173625097173163.
[I 2026-09-15 22:10:15,812] Trial 825 finished with value: 0.2575076798173979 and parameters: {'phi_model': 'eid', 'kappa': 8.848419953282493, 'svgd_iters': 0, 'debt_weight': 0.9834307293304166, 'visit_sat': 0.5669932756501737, 'visit_halflife': 1.1654128053923167, 'phi_mode': 'quantile', 'n_particles': 128, 'phi_quantile': 0.1494183053197028, 'gp_lengthscale': 0.1150350031974704, 'gp_noise': 0.0849499393282886, 'cfg_weight': 1.291499774835279}. Best is trial 623 with value: 0.25173625097173163.
[I 2026-09-15 22:10:38,944] Trial 826 pruned. 
[I 2026-09-15 22:11:48,937] Trial 827 pruned. 
[I 2026-09-15 22:15:18,404] Trial 828 pruned. 
[I 2026-09-15 22:18:47,972] Trial 829 finished with value: 0.256973886740212 and parameters: {'phi_model': 'eid', 'kappa': 1.1736724583107045, 'svgd_iters': 0, 'debt_weight': 0.8751239622491778, 'visit_sat': 0.4860576570976717, 'visit_halflife': 1.747939216332954, 'phi_mode': 'quantile', 'n_particles': 128, 'phi_quantile': 0.18580212710876592, 'gp_lengthscale': 0.10881005748734181, 'gp_noise': 0.08755963714481693, 'cfg_weight': 1.3069368234679901}. Best is trial 623 with value: 0.25173625097173163.
[I 2026-09-15 22:22:17,518] Trial 830 pruned. 
[I 2026-09-15 22:22:40,667] Trial 831 pruned. 
[I 2026-09-15 22:26:10,292] Trial 832 finished with value: 0.2587285839278754 and parameters: {'phi_model': 'eid', 'kappa': 0.9831740221348473, 'svgd_iters': 0, 'debt_weight': 0.9481176184319883, 'visit_sat': 0.4517826045727048, 'visit_halflife': 1.9813077893339257, 'phi_mode': 'quantile', 'n_particles': 128, 'phi_quantile': 0.15623985363427237, 'gp_lengthscale': 0.13133646111417444, 'gp_noise': 0.1152176806594612, 'cfg_weight': 1.4956479219882857}. Best is trial 623 with value: 0.25173625097173163.
[I 2026-09-15 22:27:20,306] Trial 833 pruned. 
[I 2026-09-15 22:28:30,330] Trial 834 pruned. 
[I 2026-09-15 22:29:40,348] Trial 835 pruned. 
[I 2026-09-15 22:30:03,485] Trial 836 pruned. 
[I 2026-09-15 22:33:33,114] Trial 837 finished with value: 0.255596816734621 and parameters: {'phi_model': 'eid', 'kappa': 1.0789268242238916, 'svgd_iters': 0, 'debt_weight': 0.9104113665356871, 'visit_sat': 0.5036761180289764, 'visit_halflife': 2.269369340515249, 'phi_mode': 'quantile', 'n_particles': 128, 'phi_quantile': 0.13343883325247385, 'gp_lengthscale': 0.14944971536394733, 'gp_noise': 0.1278186944496938, 'cfg_weight': 1.5095087774914029}. Best is trial 623 with value: 0.25173625097173163.
[I 2026-09-15 22:34:43,172] Trial 838 pruned. 
[I 2026-09-15 22:38:12,777] Trial 839 finished with value: 0.2593963112116189 and parameters: {'phi_model': 'eid', 'kappa': 1.0494103452389805, 'svgd_iters': 0, 'debt_weight': 0.9692272030675867, 'visit_sat': 0.530269622683889, 'visit_halflife': 2.5742240871985302, 'phi_mode': 'quantile', 'n_particles': 128, 'phi_quantile': 0.1904791432682497, 'gp_lengthscale': 0.15941294065443695, 'gp_noise': 0.10569096775565531, 'cfg_weight': 1.5096489869904208}. Best is trial 623 with value: 0.25173625097173163.
[I 2026-09-15 22:38:35,931] Trial 840 pruned. 
[I 2026-09-15 22:38:59,068] Trial 841 pruned. 
[I 2026-09-15 22:42:28,708] Trial 842 finished with value: 0.25587017624038605 and parameters: {'phi_model': 'eid', 'kappa': 0.9864724598364599, 'svgd_iters': 0, 'debt_weight': 0.8843397995747081, 'visit_sat': 0.5078653483803757, 'visit_halflife': 2.120594957936927, 'phi_mode': 'quantile', 'n_particles': 128, 'phi_quantile': 0.1326640447170892, 'gp_lengthscale': 0.1432810857694101, 'gp_noise': 0.1415700934646642, 'cfg_weight': 1.4385635841968532}. Best is trial 623 with value: 0.25173625097173163.
[I 2026-09-15 22:45:58,319] Trial 843 finished with value: 0.2599685395261286 and parameters: {'phi_model': 'eid', 'kappa': 1.1021079933968563, 'svgd_iters': 0, 'debt_weight': 0.827766430795868, 'visit_sat': 0.4122681424925684, 'visit_halflife': 1.69606198427197, 'phi_mode': 'quantile', 'n_particles': 128, 'phi_quantile': 0.17862531935804382, 'gp_lengthscale': 0.10869872109023967, 'gp_noise': 0.09814957563091335, 'cfg_weight': 1.18125729674313}. Best is trial 623 with value: 0.25173625097173163.
[I 2026-09-15 22:49:27,942] Trial 844 finished with value: 0.2550483963246018 and parameters: {'phi_model': 'eid', 'kappa': 0.8678986553507066, 'svgd_iters': 0, 'debt_weight': 0.90406675506404, 'visit_sat': 0.4861427125631343, 'visit_halflife': 2.5533074017960096, 'phi_mode': 'quantile', 'n_particles': 128, 'phi_quantile': 0.15998921294745036, 'gp_lengthscale': 0.1685532489398826, 'gp_noise': 0.12756724858925358, 'cfg_weight': 1.3463317392180936}. Best is trial 623 with value: 0.25173625097173163.
[I 2026-09-15 22:52:57,550] Trial 845 pruned. 
[I 2026-09-15 22:56:27,167] Trial 846 finished with value: 0.2546830837502083 and parameters: {'phi_model': 'eid', 'kappa': 0.5704793686051559, 'svgd_iters': 0, 'debt_weight': 0.9453709679105268, 'visit_sat': 0.5173481947860326, 'visit_halflife': 2.080334911825019, 'phi_mode': 'quantile', 'n_particles': 128, 'phi_quantile': 0.10127021760997762, 'gp_lengthscale': 0.1424456553379192, 'gp_noise': 0.11325692824513164, 'cfg_weight': 1.5193868420519274}. Best is trial 623 with value: 0.25173625097173163.
[I 2026-09-15 22:57:37,183] Trial 847 pruned. 
[I 2026-09-15 22:58:00,325] Trial 848 pruned. 
[I 2026-09-15 23:01:29,886] Trial 849 finished with value: 0.2598271187231546 and parameters: {'phi_model': 'eid', 'kappa': 0.4272661703016642, 'svgd_iters': 0, 'debt_weight': 0.9447432898035903, 'visit_sat': 0.5127763775573978, 'visit_halflife': 2.178504781182907, 'phi_mode': 'quantile', 'n_particles': 128, 'phi_quantile': 0.10787908412474097, 'gp_lengthscale': 0.13976180180483486, 'gp_noise': 0.11407915873752464, 'cfg_weight': 1.579953560802317}. Best is trial 623 with value: 0.25173625097173163.
[I 2026-09-15 23:01:53,030] Trial 850 pruned. 
[I 2026-09-15 23:02:16,173] Trial 851 pruned. 
[I 2026-09-15 23:03:26,183] Trial 852 pruned. 
[I 2026-09-15 23:06:55,742] Trial 853 pruned. 
[I 2026-09-15 23:07:18,877] Trial 854 pruned. 
[I 2026-09-15 23:08:52,932] Trial 855 pruned. 
[I 2026-09-15 23:09:16,048] Trial 856 pruned. 
[I 2026-09-15 23:10:25,984] Trial 857 pruned. 
[I 2026-09-15 23:10:49,085] Trial 858 pruned. 
[I 2026-09-15 23:14:18,480] Trial 859 finished with value: 0.25600251763899645 and parameters: {'phi_model': 'eid', 'kappa': 1.0930938791552518, 'svgd_iters': 0, 'debt_weight': 0.9186334839838891, 'visit_sat': 0.4322411541124407, 'visit_halflife': 1.9588813778756111, 'phi_mode': 'quantile', 'n_particles': 128, 'phi_quantile': 0.10013092674967868, 'gp_lengthscale': 0.11079778398272774, 'gp_noise': 0.09910276449821412, 'cfg_weight': 1.470927251963199}. Best is trial 623 with value: 0.25173625097173163.
[I 2026-09-15 23:14:41,590] Trial 860 pruned. 
[I 2026-09-15 23:15:51,557] Trial 861 pruned. 
[I 2026-09-15 23:19:20,678] Trial 862 pruned. 
[I 2026-09-15 23:20:30,652] Trial 863 pruned. 
[I 2026-09-15 23:21:40,594] Trial 864 pruned. 
[I 2026-09-15 23:25:56,422] Trial 865 finished with value: 0.2572538516770175 and parameters: {'phi_model': 'eid', 'kappa': 0.37060040395064986, 'svgd_iters': 25, 'debt_weight': 0.7653201444532514, 'visit_sat': 0.47191375375202343, 'visit_halflife': 2.034077822931904, 'phi_mode': 'quantile', 'n_particles': 128, 'phi_quantile': 0.1293250663235065, 'gp_lengthscale': 0.12974542674660042, 'gp_noise': 0.06873843310185021, 'cfg_weight': 1.1144367387417147}. Best is trial 623 with value: 0.25173625097173163.
[I 2026-09-15 23:27:06,087] Trial 866 pruned. 
[I 2026-09-15 23:27:29,121] Trial 867 pruned. 
[I 2026-09-15 23:28:38,842] Trial 868 pruned. 
[I 2026-09-15 23:32:07,502] Trial 869 pruned. 
[I 2026-09-15 23:35:36,203] Trial 870 finished with value: 0.25704542255708557 and parameters: {'phi_model': 'eid', 'kappa': 0.965898296217473, 'svgd_iters': 0, 'debt_weight': 0.8811854312115233, 'visit_sat': 0.5560764751978579, 'visit_halflife': 2.295086636104099, 'phi_mode': 'quantile', 'n_particles': 128, 'phi_quantile': 0.1482443976645405, 'gp_lengthscale': 0.16780190059737912, 'gp_noise': 0.10908508064244335, 'cfg_weight': 1.56763650981487}. Best is trial 623 with value: 0.25173625097173163.
[I 2026-09-15 23:39:04,948] Trial 871 finished with value: 0.25849632955032453 and parameters: {'phi_model': 'eid', 'kappa': 1.2069253851868589, 'svgd_iters': 0, 'debt_weight': 0.9180916357666238, 'visit_sat': 0.5075445691017102, 'visit_halflife': 1.9422384793845553, 'phi_mode': 'quantile', 'n_particles': 128, 'phi_quantile': 0.11579809253894698, 'gp_lengthscale': 0.1437235238429065, 'gp_noise': 0.11808493679847443, 'cfg_weight': 1.3835556348632776}. Best is trial 623 with value: 0.25173625097173163.
[I 2026-09-15 23:40:14,672] Trial 872 pruned. 
[I 2026-09-15 23:40:37,721] Trial 873 pruned. 
[I 2026-09-15 23:41:47,445] Trial 874 pruned. 
[I 2026-09-15 23:42:57,191] Trial 875 pruned. 
[I 2026-09-15 23:43:20,244] Trial 876 pruned. 
[I 2026-09-15 23:46:48,548] Trial 877 pruned. 
[I 2026-09-15 23:50:17,287] Trial 878 pruned. 
[I 2026-09-15 23:50:40,324] Trial 879 pruned. 
[I 2026-09-15 23:54:09,054] Trial 880 finished with value: 0.257776052807003 and parameters: {'phi_model': 'eid', 'kappa': 0.8628766932455125, 'svgd_iters': 0, 'debt_weight': 0.9722533224787286, 'visit_sat': 0.5194051061626295, 'visit_halflife': 2.0944660013749092, 'phi_mode': 'quantile', 'n_particles': 128, 'phi_quantile': 0.1378617016914272, 'gp_lengthscale': 0.15724954120696708, 'gp_noise': 0.1410313263578972, 'cfg_weight': 1.5656743856605766}. Best is trial 623 with value: 0.25173625097173163.
[I 2026-09-15 23:57:37,802] Trial 881 finished with value: 0.259225381767846 and parameters: {'phi_model': 'eid', 'kappa': 1.1325678812821882, 'svgd_iters': 0, 'debt_weight': 0.7926713728115204, 'visit_sat': 0.5397831189727249, 'visit_halflife': 2.772108173256384, 'phi_mode': 'quantile', 'n_particles': 128, 'phi_quantile': 0.1857020478367483, 'gp_lengthscale': 0.11906189162312365, 'gp_noise': 0.12630040206411075, 'cfg_weight': 1.356857191259872}. Best is trial 623 with value: 0.25173625097173163.
[I 2026-09-16 00:01:06,472] Trial 882 pruned. 
[I 2026-09-16 00:04:35,216] Trial 883 finished with value: 0.2513262573574975 and parameters: {'phi_model': 'eid', 'kappa': 0.6080837837539514, 'svgd_iters': 0, 'debt_weight': 0.9002740182042122, 'visit_sat': 0.4696706948278474, 'visit_halflife': 2.2153603772076282, 'phi_mode': 'quantile', 'n_particles': 128, 'phi_quantile': 0.14978348922195622, 'gp_lengthscale': 0.12192310997439061, 'gp_noise': 0.1249491528099695, 'cfg_weight': 1.5987308781507361}. Best is trial 883 with value: 0.2513262573574975.
[I 2026-09-16 00:08:03,899] Trial 884 finished with value: 0.2597625486693337 and parameters: {'phi_model': 'eid', 'kappa': 0.5304742602087064, 'svgd_iters': 0, 'debt_weight': 0.9060585056189517, 'visit_sat': 0.4601113912496076, 'visit_halflife': 2.0454857272912306, 'phi_mode': 'quantile', 'n_particles': 128, 'phi_quantile': 0.15913531621125393, 'gp_lengthscale': 0.1138249978124727, 'gp_noise': 0.1249921916256782, 'cfg_weight': 1.4773424330001108}. Best is trial 883 with value: 0.2513262573574975.
[I 2026-09-16 00:08:26,936] Trial 885 pruned. 
[I 2026-09-16 00:08:49,979] Trial 886 pruned. 
[I 2026-09-16 00:13:05,981] Trial 887 finished with value: 0.2561198751426851 and parameters: {'phi_model': 'eid', 'kappa': 0.6463596495670952, 'svgd_iters': 25, 'debt_weight': 0.8712581550249732, 'visit_sat': 0.4912370151226588, 'visit_halflife': 2.528509552262887, 'phi_mode': 'quantile', 'n_particles': 128, 'phi_quantile': 0.14175606013803363, 'gp_lengthscale': 0.14946711714849428, 'gp_noise': 0.09772394722680285, 'cfg_weight': 1.547100286686008}. Best is trial 883 with value: 0.2513262573574975.
[I 2026-09-16 00:14:15,692] Trial 888 pruned. 
[I 2026-09-16 00:17:44,371] Trial 889 pruned. 
[I 2026-09-16 00:18:07,415] Trial 890 pruned. 
[I 2026-09-16 00:19:17,152] Trial 891 pruned. 
[I 2026-09-16 00:20:26,879] Trial 892 pruned. 
[I 2026-09-16 00:20:49,924] Trial 893 pruned. 
[I 2026-09-16 00:21:59,670] Trial 894 pruned. 
[I 2026-09-16 00:22:22,719] Trial 895 pruned. 
[I 2026-09-16 00:23:32,458] Trial 896 pruned. 
[I 2026-09-16 00:23:55,499] Trial 897 pruned. 
[I 2026-09-16 00:27:24,180] Trial 898 pruned. 
[I 2026-09-16 00:30:52,910] Trial 899 finished with value: 0.25677687167030916 and parameters: {'phi_model': 'eid', 'kappa': 1.005846408875117, 'svgd_iters': 0, 'debt_weight': 0.9428895835832162, 'visit_sat': 0.5677570031230612, 'visit_halflife': 2.247453855908497, 'phi_mode': 'quantile', 'n_particles': 128, 'phi_quantile': 0.10008519317045446, 'gp_lengthscale': 0.1533283747140548, 'gp_noise': 0.1284335291453539, 'cfg_weight': 1.4907914328083396}. Best is trial 883 with value: 0.2513262573574975.
[I 2026-09-16 00:32:02,666] Trial 900 pruned. 
[I 2026-09-16 00:32:25,710] Trial 901 pruned. 
[I 2026-09-16 00:35:55,396] Trial 902 finished with value: 0.2544182763849163 and parameters: {'phi_model': 'eid', 'kappa': 0.48535928780997756, 'svgd_iters': 0, 'debt_weight': 0.9037229748165104, 'visit_sat': 0.509717750146706, 'visit_halflife': 2.736808195833994, 'phi_mode': 'quantile', 'n_particles': 128, 'phi_quantile': 0.17157422510537554, 'gp_lengthscale': 0.15973054765842243, 'gp_noise': 0.12977045812261934, 'cfg_weight': 1.4845610035298415}. Best is trial 883 with value: 0.2513262573574975.
[I 2026-09-16 00:39:26,500] Trial 903 finished with value: 0.2594743488019487 and parameters: {'phi_model': 'eid', 'kappa': 0.504037657191458, 'svgd_iters': 0, 'debt_weight': 0.9398841623811618, 'visit_sat': 0.46387467952554895, 'visit_halflife': 2.7318953694912977, 'phi_mode': 'quantile', 'n_particles': 128, 'phi_quantile': 0.20299729265464142, 'gp_lengthscale': 0.09055267643425711, 'gp_noise': 0.06687509753594495, 'cfg_weight': 1.1029340806053645}. Best is trial 883 with value: 0.2513262573574975.
[I 2026-09-16 00:42:56,258] Trial 904 finished with value: 0.2565526738811284 and parameters: {'phi_model': 'eid', 'kappa': 0.530891636030428, 'svgd_iters': 0, 'debt_weight': 0.909838348196838, 'visit_sat': 0.5215332838602322, 'visit_halflife': 3.007609700741393, 'phi_mode': 'quantile', 'n_particles': 128, 'phi_quantile': 0.18152299158770124, 'gp_lengthscale': 0.165026743062805, 'gp_noise': 0.1251359218001621, 'cfg_weight': 1.4447919903214115}. Best is trial 883 with value: 0.2513262573574975.
[I 2026-09-16 00:43:19,419] Trial 905 pruned. 
[I 2026-09-16 00:44:29,428] Trial 906 pruned. 
[I 2026-09-16 00:45:39,526] Trial 907 pruned. 
[I 2026-09-16 00:49:09,217] Trial 908 pruned. 
[I 2026-09-16 00:50:19,291] Trial 909 pruned. 
[I 2026-09-16 00:53:49,008] Trial 910 finished with value: 0.25725488745922753 and parameters: {'phi_model': 'eid', 'kappa': 0.45748565096337035, 'svgd_iters': 0, 'debt_weight': 0.8598018035703637, 'visit_sat': 0.47969569686836316, 'visit_halflife': 2.804429455966283, 'phi_mode': 'quantile', 'n_particles': 128, 'phi_quantile': 0.17464773931693714, 'gp_lengthscale': 0.1776014174558762, 'gp_noise': 0.12019622888013744, 'cfg_weight': 1.2725460849046581}. Best is trial 883 with value: 0.2513262573574975.
[I 2026-09-16 00:54:59,091] Trial 911 pruned. 
[I 2026-09-16 00:55:22,257] Trial 912 pruned. 
[I 2026-09-16 00:56:32,334] Trial 913 pruned. 
[I 2026-09-16 01:00:01,992] Trial 914 pruned. 
[I 2026-09-16 01:00:25,151] Trial 915 pruned. 
[I 2026-09-16 01:03:54,817] Trial 916 finished with value: 0.25578705788530404 and parameters: {'phi_model': 'eid', 'kappa': 0.45872589024771093, 'svgd_iters': 0, 'debt_weight': 0.8923294426847305, 'visit_sat': 0.523904389620939, 'visit_halflife': 2.6247579170142212, 'phi_mode': 'quantile', 'n_particles': 128, 'phi_quantile': 0.16679756295167225, 'gp_lengthscale': 0.149192777957451, 'gp_noise': 0.16818539344169098, 'cfg_weight': 1.4750899233521864}. Best is trial 883 with value: 0.2513262573574975.
[I 2026-09-16 01:05:04,889] Trial 917 pruned. 
[I 2026-09-16 01:06:14,952] Trial 918 pruned. 
[I 2026-09-16 01:06:38,109] Trial 919 pruned. 
[I 2026-09-16 01:07:48,167] Trial 920 pruned. 
[I 2026-09-16 01:08:58,225] Trial 921 pruned. 
[I 2026-09-16 01:09:21,382] Trial 922 pruned. 
[I 2026-09-16 01:09:44,537] Trial 923 pruned. 
[I 2026-09-16 01:10:07,699] Trial 924 pruned. 
[I 2026-09-16 01:11:17,771] Trial 925 pruned. 
[I 2026-09-16 01:11:40,910] Trial 926 pruned. 
[I 2026-09-16 01:12:50,990] Trial 927 pruned. 
[I 2026-09-16 01:16:20,767] Trial 928 finished with value: 0.2574526561117762 and parameters: {'phi_model': 'eid', 'kappa': 1.2685376041884548, 'svgd_iters': 0, 'debt_weight': 0.8530827292366848, 'visit_sat': 0.5196098052376819, 'visit_halflife': 3.166233683177269, 'phi_mode': 'quantile', 'n_particles': 128, 'phi_quantile': 0.23658294594886947, 'gp_lengthscale': 0.14811600761478316, 'gp_noise': 0.12891138373332023, 'cfg_weight': 1.5765745846210792}. Best is trial 883 with value: 0.2513262573574975.
[I 2026-09-16 01:19:50,473] Trial 929 finished with value: 0.2599081606339792 and parameters: {'phi_model': 'eid', 'kappa': 1.1086965357249972, 'svgd_iters': 0, 'debt_weight': 0.9098763604788781, 'visit_sat': 0.4782656584376283, 'visit_halflife': 2.9609836223496666, 'phi_mode': 'quantile', 'n_particles': 128, 'phi_quantile': 0.18395593371238667, 'gp_lengthscale': 0.12546964960883775, 'gp_noise': 0.1427906469779484, 'cfg_weight': 1.5646188435179413}. Best is trial 883 with value: 0.2513262573574975.
[I 2026-09-16 01:20:13,629] Trial 930 pruned. 
[I 2026-09-16 01:21:23,704] Trial 931 pruned. 
[I 2026-09-16 01:24:53,478] Trial 932 finished with value: 0.2577613600951619 and parameters: {'phi_model': 'eid', 'kappa': 0.8710325248835712, 'svgd_iters': 0, 'debt_weight': 0.7924562114507764, 'visit_sat': 0.5392594967863827, 'visit_halflife': 4.373769714694172, 'phi_mode': 'quantile', 'n_particles': 128, 'phi_quantile': 0.1648827681266511, 'gp_lengthscale': 0.10952282909166819, 'gp_noise': 0.10075658044590852, 'cfg_weight': 1.1870032206891086}. Best is trial 883 with value: 0.2513262573574975.
[I 2026-09-16 01:25:16,640] Trial 933 pruned. 
[I 2026-09-16 01:25:39,806] Trial 934 pruned. 
[I 2026-09-16 01:26:49,891] Trial 935 pruned. 
[I 2026-09-16 01:27:13,051] Trial 936 pruned. 
[I 2026-09-16 01:27:41,434] Trial 937 pruned. 
[I 2026-09-16 01:28:04,594] Trial 938 pruned. 
[I 2026-09-16 01:28:27,730] Trial 939 pruned. 
[I 2026-09-16 01:28:50,871] Trial 940 pruned. 
[I 2026-09-16 01:29:21,966] Trial 941 pruned. 
[I 2026-09-16 01:32:51,511] Trial 942 finished with value: 0.2547530464563064 and parameters: {'phi_model': 'eid', 'kappa': 0.866287340714645, 'svgd_iters': 0, 'debt_weight': 0.886963325657542, 'visit_sat': 0.5454297402406371, 'visit_halflife': 3.1235278848156094, 'phi_mode': 'quantile', 'n_particles': 128, 'phi_quantile': 0.13623593382460425, 'gp_lengthscale': 0.17296049514631087, 'gp_noise': 0.1407206283162686, 'cfg_weight': 1.2767237040349966}. Best is trial 883 with value: 0.2513262573574975.
[I 2026-09-16 01:34:01,545] Trial 943 pruned. 
[I 2026-09-16 01:37:31,059] Trial 944 pruned. 
[I 2026-09-16 01:38:41,080] Trial 945 pruned. 
[I 2026-09-16 01:42:10,687] Trial 946 finished with value: 0.2539761607260372 and parameters: {'phi_model': 'eid', 'kappa': 0.8410677593562255, 'svgd_iters': 0, 'debt_weight': 0.8866702636216381, 'visit_sat': 0.5399172972629013, 'visit_halflife': 2.8536431975013623, 'phi_mode': 'quantile', 'n_particles': 128, 'phi_quantile': 0.2421175313668993, 'gp_lengthscale': 0.17863879261329071, 'gp_noise': 0.14932107775414225, 'cfg_weight': 1.4539910492583525}. Best is trial 883 with value: 0.2513262573574975.
[I 2026-09-16 01:43:20,630] Trial 947 pruned. 
[I 2026-09-16 01:44:30,439] Trial 948 pruned. 
[I 2026-09-16 01:47:59,834] Trial 949 finished with value: 0.2555239309433488 and parameters: {'phi_model': 'eid', 'kappa': 0.7529547014778631, 'svgd_iters': 0, 'debt_weight': 0.9008967450410262, 'visit_sat': 0.5160857490380664, 'visit_halflife': 2.532919834708161, 'phi_mode': 'quantile', 'n_particles': 128, 'phi_quantile': 0.23813901806449894, 'gp_lengthscale': 0.17930710787046497, 'gp_noise': 0.169245438751075, 'cfg_weight': 1.3120190381414634}. Best is trial 883 with value: 0.2513262573574975.

  fertig nach 59509s

  Bester Versuch #883:  J=0.2513
    cfg_weight       1.5987308781507361
    debt_weight      0.9002740182042122
    gp_lengthscale   0.12192310997439061
    gp_noise         0.1249491528099695
    kappa            0.6080837837539514
    n_particles      128
    phi_mode         quantile
    phi_model        eid
    phi_quantile     0.14978348922195622
    svgd_iters       0
    visit_halflife   2.2153603772076282
    visit_sat        0.4696706948278474
    n_exec           6.0000
    q                0.1261
    cov_norm         0.1261
    erg_truth        0.0441
    time_s           1.3165
