[I 2026-09-12 14:07:32,665] Trial 105 finished with value: 0.24845028238113126 and parameters: {'phi_model': 'mass', 'w': 0.34750166769168933, 'svgd_iters': 25, 'debt_weight': 0.9324481892892202, 'visit_sat': 0.21554298387807416, 'visit_halflife': 1.9395236538709895, 'phi_mode': 'density', 'n_particles': 128}. Best is trial 105 with value: 0.24845028238113126.
[I 2026-09-12 14:08:22,915] Trial 106 pruned. 
[I 2026-09-12 14:09:47,952] Trial 107 finished with value: 0.2558279538323173 and parameters: {'phi_model': 'mass', 'w': 0.425326766372471, 'svgd_iters': 25, 'debt_weight': 0.8879692819388628, 'visit_sat': 0.2810718221128018, 'visit_halflife': 2.4662257115716333, 'phi_mode': 'density', 'n_particles': 128}. Best is trial 105 with value: 0.24845028238113126.
[I 2026-09-12 14:10:10,757] Trial 108 pruned. 
[I 2026-09-12 14:11:35,483] Trial 109 finished with value: 0.25233374540290404 and parameters: {'phi_model': 'mass', 'w': 0.43854684678277006, 'svgd_iters': 25, 'debt_weight': 0.9239881165405515, 'visit_sat': 0.2415740968138316, 'visit_halflife': 1.7216651358286787, 'phi_mode': 'density', 'n_particles': 128}. Best is trial 105 with value: 0.24845028238113126.
[I 2026-09-12 14:11:58,281] Trial 110 pruned. 
[I 2026-09-12 14:13:40,094] Trial 111 finished with value: 0.254263669339985 and parameters: {'phi_model': 'mass', 'w': 0.4487119877725151, 'svgd_iters': 50, 'debt_weight': 0.9661061057854452, 'visit_sat': 0.3387669046508146, 'visit_halflife': 2.242047239930493, 'phi_mode': 'density', 'n_particles': 128}. Best is trial 105 with value: 0.24845028238113126.
[I 2026-09-12 14:15:21,556] Trial 112 finished with value: 0.256147895906356 and parameters: {'phi_model': 'mass', 'w': 0.47390721103364514, 'svgd_iters': 50, 'debt_weight': 0.9683608492065625, 'visit_sat': 0.3591446684517506, 'visit_halflife': 2.22293133735206, 'phi_mode': 'density', 'n_particles': 128}. Best is trial 105 with value: 0.24845028238113126.
[I 2026-09-12 14:17:02,638] Trial 113 finished with value: 0.2498340557753278 and parameters: {'phi_model': 'mass', 'w': 0.5302859576458723, 'svgd_iters': 50, 'debt_weight': 0.9632422313993914, 'visit_sat': 0.3038810970503529, 'visit_halflife': 1.257430049091453, 'phi_mode': 'density', 'n_particles': 128}. Best is trial 105 with value: 0.24845028238113126.
[I 2026-09-12 14:18:27,201] Trial 114 finished with value: 0.2544662333093533 and parameters: {'phi_model': 'mass', 'w': 0.5364997406346391, 'svgd_iters': 25, 'debt_weight': 0.9104058892343068, 'visit_sat': 0.22186298841766997, 'visit_halflife': 1.6815009603751154, 'phi_mode': 'density', 'n_particles': 128}. Best is trial 105 with value: 0.24845028238113126.
[I 2026-09-12 14:20:08,286] Trial 115 finished with value: 0.25927923409144527 and parameters: {'phi_model': 'mass', 'w': 0.5256237418478368, 'svgd_iters': 50, 'debt_weight': 0.9949543322327438, 'visit_sat': 0.17627597491363428, 'visit_halflife': 2.2226329217031693, 'phi_mode': 'density', 'n_particles': 128}. Best is trial 105 with value: 0.24845028238113126.
[I 2026-09-12 14:22:04,277] Trial 116 finished with value: 0.2551732270962125 and parameters: {'phi_model': 'mass', 'w': 0.4583068955488619, 'svgd_iters': 75, 'debt_weight': 0.9209768799015797, 'visit_sat': 0.19335121836460994, 'visit_halflife': 2.5996061653560383, 'phi_mode': 'density', 'n_particles': 128}. Best is trial 105 with value: 0.24845028238113126.
[I 2026-09-12 14:23:28,733] Trial 117 finished with value: 0.256957351453562 and parameters: {'phi_model': 'mass', 'w': 0.5651558074627439, 'svgd_iters': 25, 'debt_weight': 0.9776446934551872, 'visit_sat': 0.2537457620791685, 'visit_halflife': 1.8480747013272185, 'phi_mode': 'density', 'n_particles': 128}. Best is trial 105 with value: 0.24845028238113126.
[I 2026-09-12 14:25:09,780] Trial 118 finished with value: 0.24872692383089579 and parameters: {'phi_model': 'mass', 'w': 0.5953634134653036, 'svgd_iters': 50, 'debt_weight': 0.909195956641671, 'visit_sat': 0.19137700243962424, 'visit_halflife': 1.9385883238499666, 'phi_mode': 'density', 'n_particles': 128}. Best is trial 105 with value: 0.24845028238113126.
[I 2026-09-12 14:26:00,095] Trial 119 pruned. 
[I 2026-09-12 14:27:56,340] Trial 120 finished with value: 0.2569730872349122 and parameters: {'phi_model': 'mass', 'w': 0.5344173788293767, 'svgd_iters': 75, 'debt_weight': 0.9305412978406042, 'visit_sat': 0.3240149035652916, 'visit_halflife': 1.4018469981477817, 'phi_mode': 'density', 'n_particles': 128}. Best is trial 105 with value: 0.24845028238113126.
[I 2026-09-12 14:28:24,796] Trial 121 pruned. 
[I 2026-09-12 14:30:06,123] Trial 122 finished with value: 0.2566842424082872 and parameters: {'phi_model': 'mass', 'w': 0.5111600401234161, 'svgd_iters': 50, 'debt_weight': 0.9109006003297461, 'visit_sat': 0.19124228646378283, 'visit_halflife': 1.89133149037065, 'phi_mode': 'density', 'n_particles': 128}. Best is trial 105 with value: 0.24845028238113126.
[I 2026-09-12 14:31:46,986] Trial 123 finished with value: 0.25635979533123227 and parameters: {'phi_model': 'mass', 'w': 0.6854239762261392, 'svgd_iters': 50, 'debt_weight': 0.9976502220331653, 'visit_sat': 0.13754764979154038, 'visit_halflife': 1.7570539041472089, 'phi_mode': 'density', 'n_particles': 128}. Best is trial 105 with value: 0.24845028238113126.
[I 2026-09-12 14:33:11,672] Trial 124 finished with value: 0.25709291844007776 and parameters: {'phi_model': 'mass', 'w': 0.6376254065379053, 'svgd_iters': 25, 'debt_weight': 0.9685375632588076, 'visit_sat': 0.17676512241971393, 'visit_halflife': 1.2206839613802682, 'phi_mode': 'density', 'n_particles': 128}. Best is trial 105 with value: 0.24845028238113126.
[I 2026-09-12 14:33:45,351] Trial 125 pruned. 
[I 2026-09-12 14:35:10,046] Trial 126 finished with value: 0.25467637626526995 and parameters: {'phi_model': 'mass', 'w': 0.549779776710198, 'svgd_iters': 25, 'debt_weight': 0.9276460872132706, 'visit_sat': 0.3983885767086424, 'visit_halflife': 1.6380038127050622, 'phi_mode': 'density', 'n_particles': 128}. Best is trial 105 with value: 0.24845028238113126.
[I 2026-09-12 14:36:51,969] Trial 127 finished with value: 0.25486027754908125 and parameters: {'phi_model': 'mass', 'w': 0.43883782380256287, 'svgd_iters': 50, 'debt_weight': 0.8099198249223454, 'visit_sat': 0.2715634219428185, 'visit_halflife': 2.0729040548773345, 'phi_mode': 'density', 'n_particles': 128}. Best is trial 105 with value: 0.24845028238113126.
[I 2026-09-12 14:37:15,193] Trial 128 pruned. 
[I 2026-09-12 14:37:38,058] Trial 129 pruned. 
[I 2026-09-12 14:38:43,201] Trial 130 pruned. 
[I 2026-09-12 14:40:07,897] Trial 131 finished with value: 0.2564158934170165 and parameters: {'phi_model': 'mass', 'w': 0.41154871908078094, 'svgd_iters': 25, 'debt_weight': 0.9215886998481061, 'visit_sat': 0.1706027717138226, 'visit_halflife': 2.575175092602071, 'phi_mode': 'density', 'n_particles': 128}. Best is trial 105 with value: 0.24845028238113126.
[I 2026-09-12 14:40:56,370] Trial 132 pruned. 
[I 2026-09-12 14:41:48,630] Trial 133 pruned. 
[I 2026-09-12 14:42:16,758] Trial 134 pruned. 
[I 2026-09-12 14:42:50,331] Trial 135 pruned. 
[I 2026-09-12 14:43:48,294] Trial 136 pruned. 
[I 2026-09-12 14:44:22,234] Trial 137 pruned. 
[I 2026-09-12 14:46:03,467] Trial 138 finished with value: 0.2552412696591125 and parameters: {'phi_model': 'mass', 'w': 0.4898871911938608, 'svgd_iters': 50, 'debt_weight': 0.9260476910234436, 'visit_sat': 0.33212689622683067, 'visit_halflife': 2.6428571125825506, 'phi_mode': 'density', 'n_particles': 128}. Best is trial 105 with value: 0.24845028238113126.
[I 2026-09-12 14:46:36,884] Trial 139 pruned. 
[I 2026-09-12 14:47:04,989] Trial 140 pruned. 
[I 2026-09-12 14:47:43,903] Trial 141 pruned. 
[I 2026-09-12 14:48:06,695] Trial 142 pruned. 
[I 2026-09-12 14:48:40,346] Trial 143 pruned. 
[I 2026-09-12 14:49:08,454] Trial 144 pruned. 
[I 2026-09-12 14:49:31,264] Trial 145 pruned. 
[I 2026-09-12 14:50:05,010] Trial 146 pruned. 
[I 2026-09-12 14:51:29,752] Trial 147 finished with value: 0.25175672030692425 and parameters: {'phi_model': 'mass', 'w': 0.4775678514197908, 'svgd_iters': 25, 'debt_weight': 0.8122710570916097, 'visit_sat': 0.2776176980137298, 'visit_halflife': 2.1574564977987594, 'phi_mode': 'density', 'n_particles': 128}. Best is trial 105 with value: 0.24845028238113126.
[I 2026-09-12 14:52:03,251] Trial 148 pruned. 
[I 2026-09-12 14:53:27,984] Trial 149 finished with value: 0.2548951552492037 and parameters: {'phi_model': 'mass', 'w': 0.5479724815361903, 'svgd_iters': 25, 'debt_weight': 0.9606140140850771, 'visit_sat': 0.44254857184971697, 'visit_halflife': 1.2685255376874058, 'phi_mode': 'density', 'n_particles': 128}. Best is trial 105 with value: 0.24845028238113126.
[I 2026-09-12 14:53:56,087] Trial 150 pruned. 
[I 2026-09-12 14:54:18,937] Trial 151 pruned. 
[I 2026-09-12 14:55:01,013] Trial 152 pruned. 
[I 2026-09-12 14:55:39,712] Trial 153 pruned. 
[I 2026-09-12 14:56:13,320] Trial 154 pruned. 
[I 2026-09-12 14:56:47,102] Trial 155 pruned. 
[I 2026-09-12 14:57:15,147] Trial 156 pruned. 
[I 2026-09-12 14:57:48,821] Trial 157 pruned. 
[I 2026-09-12 14:59:14,133] Trial 158 finished with value: 0.2525753656680369 and parameters: {'phi_model': 'mass', 'w': 0.5206026472099587, 'svgd_iters': 25, 'debt_weight': 0.966607233510602, 'visit_sat': 0.19402265060120774, 'visit_halflife': 1.7736900357443584, 'phi_mode': 'density', 'n_particles': 128}. Best is trial 105 with value: 0.24845028238113126.
[I 2026-09-12 14:59:48,450] Trial 159 pruned. 
[I 2026-09-12 15:00:16,415] Trial 160 pruned. 
[I 2026-09-12 15:00:44,681] Trial 161 pruned. 
[I 2026-09-12 15:01:07,720] Trial 162 pruned. 
[I 2026-09-12 15:01:41,623] Trial 163 pruned. 
[I 2026-09-12 15:03:06,557] Trial 164 finished with value: 0.2554555172517399 and parameters: {'phi_model': 'mass', 'w': 0.47294670914456893, 'svgd_iters': 25, 'debt_weight': 0.9941030714992848, 'visit_sat': 0.1810777329177784, 'visit_halflife': 1.6903089071939643, 'phi_mode': 'density', 'n_particles': 128}. Best is trial 105 with value: 0.24845028238113126.
[I 2026-09-12 15:03:57,242] Trial 165 pruned. 
[I 2026-09-12 15:04:32,581] Trial 166 pruned. 
[I 2026-09-12 15:05:11,609] Trial 167 pruned. 
[I 2026-09-12 15:07:08,987] Trial 168 finished with value: 0.2581378758110097 and parameters: {'phi_model': 'mass', 'w': 0.6251568526432398, 'svgd_iters': 75, 'debt_weight': 0.9496569092827376, 'visit_sat': 0.18133333571048635, 'visit_halflife': 1.8407221905016533, 'phi_mode': 'density', 'n_particles': 128}. Best is trial 105 with value: 0.24845028238113126.
[I 2026-09-12 15:07:44,511] Trial 169 pruned. 
[I 2026-09-12 15:08:24,011] Trial 170 pruned. 
[I 2026-09-12 15:08:56,702] Trial 171 pruned. 
[I 2026-09-12 15:10:24,689] Trial 172 finished with value: 0.25666338638761077 and parameters: {'phi_model': 'mass', 'w': 0.5116188838723817, 'svgd_iters': 25, 'debt_weight': 0.847504810027883, 'visit_sat': 0.22570236511615363, 'visit_halflife': 1.5857231067667543, 'phi_mode': 'density', 'n_particles': 128}. Best is trial 105 with value: 0.24845028238113126.
[I 2026-09-12 15:12:06,565] Trial 173 finished with value: 0.25413754456110016 and parameters: {'phi_model': 'mass', 'w': 0.5377171773709709, 'svgd_iters': 50, 'debt_weight': 0.9837785646592022, 'visit_sat': 0.32565125426473496, 'visit_halflife': 2.5866042117643397, 'phi_mode': 'density', 'n_particles': 128}. Best is trial 105 with value: 0.24845028238113126.
[I 2026-09-12 15:14:03,122] Trial 174 finished with value: 0.2569291323458248 and parameters: {'phi_model': 'mass', 'w': 0.5268079653481929, 'svgd_iters': 75, 'debt_weight': 0.9943792226304224, 'visit_sat': 0.3411059826069604, 'visit_halflife': 1.7043052268042211, 'phi_mode': 'density', 'n_particles': 128}. Best is trial 105 with value: 0.24845028238113126.
[I 2026-09-12 15:14:31,137] Trial 175 pruned. 
[I 2026-09-12 15:15:56,106] Trial 176 finished with value: 0.25144429853124317 and parameters: {'phi_model': 'mass', 'w': 0.4967196053801718, 'svgd_iters': 25, 'debt_weight': 0.7942320763335714, 'visit_sat': 0.2543373894047975, 'visit_halflife': 2.3916853618990577, 'phi_mode': 'density', 'n_particles': 128}. Best is trial 105 with value: 0.24845028238113126.
[I 2026-09-12 15:16:19,256] Trial 177 pruned. 
[I 2026-09-12 15:18:04,223] Trial 178 finished with value: 0.2536882146163989 and parameters: {'phi_model': 'mass', 'w': 0.49481317559143995, 'svgd_iters': 50, 'debt_weight': 0.8853911405220021, 'visit_sat': 0.4130627156275035, 'visit_halflife': 3.2794594160060053, 'phi_mode': 'density', 'n_particles': 128}. Best is trial 105 with value: 0.24845028238113126.
[I 2026-09-12 15:19:52,702] Trial 179 finished with value: 0.25456229731778496 and parameters: {'phi_model': 'mass', 'w': 0.4830887553412865, 'svgd_iters': 50, 'debt_weight': 0.997499181796747, 'visit_sat': 0.3503315222584806, 'visit_halflife': 2.7249631962224385, 'phi_mode': 'density', 'n_particles': 128}. Best is trial 105 with value: 0.24845028238113126.
[I 2026-09-12 15:20:24,246] Trial 180 pruned. 
[I 2026-09-12 15:21:54,653] Trial 181 finished with value: 0.2514516174765477 and parameters: {'phi_model': 'mass', 'w': 0.5123680388091699, 'svgd_iters': 25, 'debt_weight': 0.7964565827931166, 'visit_sat': 0.24205825676122414, 'visit_halflife': 2.4783335605819836, 'phi_mode': 'density', 'n_particles': 128}. Best is trial 105 with value: 0.24845028238113126.
[I 2026-09-12 15:22:37,292] Trial 182 pruned. 
[I 2026-09-12 15:23:00,416] Trial 183 pruned. 
[I 2026-09-12 15:23:34,271] Trial 184 pruned. 
[I 2026-09-12 15:24:02,572] Trial 185 pruned. 
[I 2026-09-12 15:24:41,066] Trial 186 pruned. 
[I 2026-09-12 15:25:03,876] Trial 187 pruned. 
[I 2026-09-12 15:26:28,790] Trial 188 finished with value: 0.24900441738495468 and parameters: {'phi_model': 'mass', 'w': 0.5315753513755451, 'svgd_iters': 25, 'debt_weight': 0.8747417365433355, 'visit_sat': 0.33762667219425796, 'visit_halflife': 2.6413056505972716, 'phi_mode': 'density', 'n_particles': 128}. Best is trial 105 with value: 0.24845028238113126.
[I 2026-09-12 15:27:02,519] Trial 189 pruned. 
[I 2026-09-12 15:27:30,717] Trial 190 pruned. 
[I 2026-09-12 15:28:22,582] Trial 191 pruned. 
[I 2026-09-12 15:28:45,513] Trial 192 pruned. 
[I 2026-09-12 15:29:20,525] Trial 193 pruned. 
[I 2026-09-12 15:30:02,720] Trial 194 pruned. 
[I 2026-09-12 15:31:44,339] Trial 195 finished with value: 0.2568699175359678 and parameters: {'phi_model': 'mass', 'w': 0.5196790587081719, 'svgd_iters': 50, 'debt_weight': 0.9882602129788088, 'visit_sat': 0.321263290518444, 'visit_halflife': 2.584351147329759, 'phi_mode': 'density', 'n_particles': 128}. Best is trial 105 with value: 0.24845028238113126.
[I 2026-09-12 15:32:19,407] Trial 196 pruned. 
[I 2026-09-12 15:32:42,222] Trial 197 pruned. 
[I 2026-09-12 15:33:05,016] Trial 198 pruned. 
[I 2026-09-12 15:34:30,174] Trial 199 finished with value: 0.2567585192180871 and parameters: {'phi_model': 'mass', 'w': 0.4209703881748187, 'svgd_iters': 25, 'debt_weight': 0.9665704330816864, 'visit_sat': 0.3466714984163336, 'visit_halflife': 0.7891983701793792, 'phi_mode': 'density', 'n_particles': 128}. Best is trial 105 with value: 0.24845028238113126.

======================================================================
  Optuna-Suche  study=tuning_v1  trials=200  timeout=8.0h
  n_max=12  n_shapes=25  quality=cov  seed=0
  fest: {'sensor_radius': 0.06, 'gp_noise': 0.05, 'meas_noise': 0.02, 'max_obs': 64}
======================================================================

  25 Formen geladen, Planer bereit

  SVGD-Pool mit 10 Prozessen


  fertig nach 14530s

  Bester Versuch #105:  J=0.2485
    debt_weight      0.9324481892892202
    n_particles      128
    phi_mode         density
    phi_model        mass
    svgd_iters       25
    visit_halflife   1.9395236538709895
    visit_sat        0.21554298387807416
    w                0.34750166769168933
    n_exec           6.0000
    q                0.1220
    cov_norm         0.1220
    erg_truth        0.0398
    time_s           1.6194
