[I 2026-09-14 16:02:14,820] Trial 216 finished with value: 0.258667663567505 and parameters: {'phi_model': 'eid', 'kappa': 1.1114892474270042, 'svgd_iters': 0, 'debt_weight': 0.81493759410664, 'visit_sat': 0.3764036971916031, 'visit_halflife': 3.5668979326688146, 'phi_mode': 'quantile', 'n_particles': 128, 'phi_quantile': 0.3845875648932208, 'gp_lengthscale': 0.09062557648524168, 'gp_noise': 0.03712572822370649, 'cfg_weight': 1.1303252824133994}. Best is trial 168 with value: 0.2569257235052576.
[I 2026-09-14 16:03:35,535] Trial 217 pruned. 
[I 2026-09-14 16:07:21,127] Trial 218 pruned. 
[I 2026-09-14 16:11:11,975] Trial 219 finished with value: 0.2603294642383687 and parameters: {'phi_model': 'eid', 'kappa': 0.9601625906102279, 'svgd_iters': 0, 'debt_weight': 0.9477497101689684, 'visit_sat': 0.35071779335949416, 'visit_halflife': 3.3658905222258504, 'phi_mode': 'quantile', 'n_particles': 128, 'phi_quantile': 0.34957869820113086, 'gp_lengthscale': 0.11712279540054896, 'gp_noise': 0.03419071850070309, 'cfg_weight': 1.014396899222775}. Best is trial 168 with value: 0.2569257235052576.
[I 2026-09-14 16:15:15,952] Trial 220 finished with value: 0.2597002866449949 and parameters: {'phi_model': 'eid', 'kappa': 1.0859719350645611, 'svgd_iters': 0, 'debt_weight': 0.832154354209422, 'visit_sat': 0.40602089587661255, 'visit_halflife': 3.9548727852556533, 'phi_mode': 'quantile', 'n_particles': 128, 'phi_quantile': 0.3422987433020534, 'gp_lengthscale': 0.08133311023685005, 'gp_noise': 0.04207705529753463, 'cfg_weight': 1.1304726084399215}. Best is trial 168 with value: 0.2569257235052576.
[I 2026-09-14 16:16:37,026] Trial 221 pruned. 
[I 2026-09-14 16:17:03,863] Trial 222 pruned. 
[I 2026-09-14 16:20:57,521] Trial 223 pruned. 
[I 2026-09-14 16:21:21,666] Trial 224 pruned. 
[I 2026-09-14 16:25:05,043] Trial 225 finished with value: 0.2598719551245975 and parameters: {'phi_model': 'eid', 'kappa': 1.3809523140718998, 'svgd_iters': 0, 'debt_weight': 0.8857878776822197, 'visit_sat': 0.4275815408093339, 'visit_halflife': 2.9263400608388666, 'phi_mode': 'quantile', 'n_particles': 128, 'phi_quantile': 0.3437272653440291, 'gp_lengthscale': 0.11679966035468607, 'gp_noise': 0.043065906399373785, 'cfg_weight': 1.2066470946570431}. Best is trial 168 with value: 0.2569257235052576.
[I 2026-09-14 16:25:29,136] Trial 226 pruned. 
[I 2026-09-14 16:26:46,182] Trial 227 pruned. 
[I 2026-09-14 16:30:33,804] Trial 228 finished with value: 0.2569052493651794 and parameters: {'phi_model': 'eid', 'kappa': 1.427260024292013, 'svgd_iters': 0, 'debt_weight': 0.7862657180675126, 'visit_sat': 0.4237970828215288, 'visit_halflife': 4.048646912537662, 'phi_mode': 'quantile', 'n_particles': 128, 'phi_quantile': 0.3087689799040097, 'gp_lengthscale': 0.11840197184695143, 'gp_noise': 0.040670774838315014, 'cfg_weight': 1.3121813325734493}. Best is trial 228 with value: 0.2569052493651794.
[I 2026-09-14 16:34:18,158] Trial 229 finished with value: 0.2591083205114301 and parameters: {'phi_model': 'eid', 'kappa': 1.5085613484960285, 'svgd_iters': 0, 'debt_weight': 0.8572793293563689, 'visit_sat': 0.45303105951791256, 'visit_halflife': 3.016874488976856, 'phi_mode': 'quantile', 'n_particles': 128, 'phi_quantile': 0.3308373805182209, 'gp_lengthscale': 0.12309948329863593, 'gp_noise': 0.04362066488444538, 'cfg_weight': 1.162802859104128}. Best is trial 228 with value: 0.2569052493651794.
[I 2026-09-14 16:37:58,071] Trial 230 pruned. 
[I 2026-09-14 16:41:36,896] Trial 231 finished with value: 0.2619562635942076 and parameters: {'phi_model': 'eid', 'kappa': 1.509368932646978, 'svgd_iters': 0, 'debt_weight': 0.7383048171627316, 'visit_sat': 0.4675457826790632, 'visit_halflife': 3.336076754961328, 'phi_mode': 'quantile', 'n_particles': 128, 'phi_quantile': 0.28297075860636106, 'gp_lengthscale': 0.1523445875991578, 'gp_noise': 0.019660061020024412, 'cfg_weight': 1.1350754414308193}. Best is trial 228 with value: 0.2569052493651794.
[I 2026-09-14 16:45:18,262] Trial 232 finished with value: 0.2580098818587759 and parameters: {'phi_model': 'eid', 'kappa': 1.4210319549680652, 'svgd_iters': 0, 'debt_weight': 0.8935813454963268, 'visit_sat': 0.4550285755689106, 'visit_halflife': 3.248107258174472, 'phi_mode': 'quantile', 'n_particles': 128, 'phi_quantile': 0.32364329626038196, 'gp_lengthscale': 0.11356663221694994, 'gp_noise': 0.04777495386594624, 'cfg_weight': 1.3263880695719459}. Best is trial 228 with value: 0.2569052493651794.
[I 2026-09-14 16:48:47,552] Trial 233 finished with value: 0.25902205768108644 and parameters: {'phi_model': 'eid', 'kappa': 1.4131819986264686, 'svgd_iters': 0, 'debt_weight': 0.8954829413426935, 'visit_sat': 0.4233137092354283, 'visit_halflife': 2.9448143116506498, 'phi_mode': 'quantile', 'n_particles': 128, 'phi_quantile': 0.3083552291100795, 'gp_lengthscale': 0.10596512193382598, 'gp_noise': 0.046786127749341495, 'cfg_weight': 1.1987164001163557}. Best is trial 228 with value: 0.2569052493651794.
[I 2026-09-14 16:52:16,930] Trial 234 finished with value: 0.26213479992782573 and parameters: {'phi_model': 'eid', 'kappa': 1.7728454251498234, 'svgd_iters': 0, 'debt_weight': 0.834001452998866, 'visit_sat': 0.39905690139729855, 'visit_halflife': 3.933515020136778, 'phi_mode': 'quantile', 'n_particles': 128, 'phi_quantile': 0.31120504220668943, 'gp_lengthscale': 0.09138163964148968, 'gp_noise': 0.03969618534552071, 'cfg_weight': 1.0227689418467083}. Best is trial 228 with value: 0.2569052493651794.
[I 2026-09-14 16:55:46,693] Trial 235 finished with value: 0.2581964572250509 and parameters: {'phi_model': 'eid', 'kappa': 1.4831627854443885, 'svgd_iters': 0, 'debt_weight': 0.9344102464341889, 'visit_sat': 0.4539059480095979, 'visit_halflife': 3.2869313267651754, 'phi_mode': 'quantile', 'n_particles': 128, 'phi_quantile': 0.33023557443872315, 'gp_lengthscale': 0.10804194425802648, 'gp_noise': 0.04643616653149701, 'cfg_weight': 1.2262702507906422}. Best is trial 228 with value: 0.2569052493651794.
[I 2026-09-14 16:56:11,049] Trial 236 pruned. 
[I 2026-09-14 16:56:37,044] Trial 237 pruned. 
[I 2026-09-14 16:57:04,425] Trial 238 pruned. 
[I 2026-09-14 17:01:09,015] Trial 239 pruned. 
[I 2026-09-14 17:02:31,490] Trial 240 pruned. 
[I 2026-09-14 17:02:55,058] Trial 241 pruned. 
[I 2026-09-14 17:03:18,132] Trial 242 pruned. 
[I 2026-09-14 17:07:11,092] Trial 243 finished with value: 0.2600264714354065 and parameters: {'phi_model': 'eid', 'kappa': 1.2636806051722431, 'svgd_iters': 0, 'debt_weight': 0.8475999706791543, 'visit_sat': 0.42334263239049047, 'visit_halflife': 3.3451861219518433, 'phi_mode': 'quantile', 'n_particles': 128, 'phi_quantile': 0.3392706030194074, 'gp_lengthscale': 0.09797076777045319, 'gp_noise': 0.04556536512998109, 'cfg_weight': 1.2578170869461562}. Best is trial 228 with value: 0.2569052493651794.
[I 2026-09-14 17:11:06,725] Trial 244 pruned. 
[I 2026-09-14 17:14:51,506] Trial 245 finished with value: 0.2623479743632254 and parameters: {'phi_model': 'eid', 'kappa': 1.280412036676545, 'svgd_iters': 0, 'debt_weight': 0.8782608116759897, 'visit_sat': 0.38159513960960684, 'visit_halflife': 3.2572836609095126, 'phi_mode': 'quantile', 'n_particles': 128, 'phi_quantile': 0.2959773155460693, 'gp_lengthscale': 0.09738053463626506, 'gp_noise': 0.046148090538047803, 'cfg_weight': 1.2667879246489129}. Best is trial 228 with value: 0.2569052493651794.
[I 2026-09-14 17:16:04,246] Trial 246 pruned. 
[I 2026-09-14 17:16:28,322] Trial 247 pruned. 
[I 2026-09-14 17:20:03,231] Trial 248 finished with value: 0.2595268861564595 and parameters: {'phi_model': 'eid', 'kappa': 1.646386548597817, 'svgd_iters': 0, 'debt_weight': 0.8467088258048443, 'visit_sat': 0.4092281191023983, 'visit_halflife': 3.3358748635424647, 'phi_mode': 'quantile', 'n_particles': 128, 'phi_quantile': 0.3191077455290482, 'gp_lengthscale': 0.1410727354908307, 'gp_noise': 0.03941690033599547, 'cfg_weight': 1.2824212878670485}. Best is trial 228 with value: 0.2569052493651794.
[I 2026-09-14 17:20:27,182] Trial 249 pruned. 
[I 2026-09-14 17:24:00,526] Trial 250 finished with value: 0.2584240093948544 and parameters: {'phi_model': 'eid', 'kappa': 1.7176056579195838, 'svgd_iters': 0, 'debt_weight': 0.8299150538214795, 'visit_sat': 0.33787457972403834, 'visit_halflife': 4.016456012941807, 'phi_mode': 'quantile', 'n_particles': 128, 'phi_quantile': 0.30693082344877476, 'gp_lengthscale': 0.09302328564759933, 'gp_noise': 0.04445815961383383, 'cfg_weight': 1.1882681699214324}. Best is trial 228 with value: 0.2569052493651794.
[I 2026-09-14 17:25:10,172] Trial 251 pruned. 
[I 2026-09-14 17:25:33,150] Trial 252 pruned. 
[I 2026-09-14 17:26:42,751] Trial 253 pruned. 
[I 2026-09-14 17:30:11,250] Trial 254 finished with value: 0.2574489400016728 and parameters: {'phi_model': 'eid', 'kappa': 1.203899699558494, 'svgd_iters': 0, 'debt_weight': 0.8295995036917349, 'visit_sat': 0.42159211493264925, 'visit_halflife': 3.3284687595022255, 'phi_mode': 'quantile', 'n_particles': 128, 'phi_quantile': 0.30949416919574246, 'gp_lengthscale': 0.1505133303322777, 'gp_noise': 0.039303278811794226, 'cfg_weight': 1.3288741978159706}. Best is trial 228 with value: 0.2569052493651794.
[I 2026-09-14 17:33:39,843] Trial 255 finished with value: 0.2595662900289226 and parameters: {'phi_model': 'eid', 'kappa': 1.2317830749890963, 'svgd_iters': 0, 'debt_weight': 0.9032694457398268, 'visit_sat': 0.4724945415936012, 'visit_halflife': 2.8371975775835017, 'phi_mode': 'quantile', 'n_particles': 128, 'phi_quantile': 0.302022949837501, 'gp_lengthscale': 0.1217923098170909, 'gp_noise': 0.0505534016705668, 'cfg_weight': 1.2278725887430832}. Best is trial 228 with value: 0.2569052493651794.
[I 2026-09-14 17:37:08,452] Trial 256 finished with value: 0.25708265527190993 and parameters: {'phi_model': 'eid', 'kappa': 1.7082522876563808, 'svgd_iters': 0, 'debt_weight': 0.9234102322542547, 'visit_sat': 0.43449943138667024, 'visit_halflife': 3.3430945487947707, 'phi_mode': 'quantile', 'n_particles': 128, 'phi_quantile': 0.30263166560986726, 'gp_lengthscale': 0.1185967778215856, 'gp_noise': 0.05146668857573348, 'cfg_weight': 1.1010954125064158}. Best is trial 228 with value: 0.2569052493651794.
[I 2026-09-14 17:40:37,304] Trial 257 finished with value: 0.26026204642315315 and parameters: {'phi_model': 'eid', 'kappa': 1.7357879856857525, 'svgd_iters': 0, 'debt_weight': 0.8127559187349098, 'visit_sat': 0.43713944165656365, 'visit_halflife': 4.250864238189053, 'phi_mode': 'quantile', 'n_particles': 128, 'phi_quantile': 0.3087290502358572, 'gp_lengthscale': 0.11693148741957402, 'gp_noise': 0.041533409973993504, 'cfg_weight': 1.3387622294777668}. Best is trial 228 with value: 0.2569052493651794.
[I 2026-09-14 17:44:22,382] Trial 258 pruned. 
[I 2026-09-14 17:45:37,972] Trial 259 pruned. 
[I 2026-09-14 17:49:28,628] Trial 260 pruned. 
[I 2026-09-14 17:53:21,534] Trial 261 finished with value: 0.259608078115329 and parameters: {'phi_model': 'eid', 'kappa': 1.3949886665448021, 'svgd_iters': 0, 'debt_weight': 0.9172461407097074, 'visit_sat': 0.3662157127293047, 'visit_halflife': 3.74574734660826, 'phi_mode': 'quantile', 'n_particles': 128, 'phi_quantile': 0.26528142738325944, 'gp_lengthscale': 0.08113764515801944, 'gp_noise': 0.03685338896389677, 'cfg_weight': 1.2127070836650125}. Best is trial 228 with value: 0.2569052493651794.
[I 2026-09-14 17:57:07,280] Trial 262 pruned. 
[I 2026-09-14 17:57:31,866] Trial 263 pruned. 
[I 2026-09-14 18:01:15,292] Trial 264 finished with value: 0.2574573124859494 and parameters: {'phi_model': 'eid', 'kappa': 1.2076212124697976, 'svgd_iters': 0, 'debt_weight': 0.8735851200839273, 'visit_sat': 0.4894691960715785, 'visit_halflife': 2.608635286788463, 'phi_mode': 'quantile', 'n_particles': 128, 'phi_quantile': 0.3127287229837143, 'gp_lengthscale': 0.11928113888365557, 'gp_noise': 0.046302785234966844, 'cfg_weight': 1.099471669573665}. Best is trial 228 with value: 0.2569052493651794.
[I 2026-09-14 18:04:53,311] Trial 265 finished with value: 0.25947237762136766 and parameters: {'phi_model': 'eid', 'kappa': 1.1845163062705162, 'svgd_iters': 0, 'debt_weight': 0.9205463935829544, 'visit_sat': 0.48208215883979777, 'visit_halflife': 2.3657347037781995, 'phi_mode': 'quantile', 'n_particles': 128, 'phi_quantile': 0.26871573384444764, 'gp_lengthscale': 0.11890882911822528, 'gp_noise': 0.05121287081431157, 'cfg_weight': 1.0324191803434737}. Best is trial 228 with value: 0.2569052493651794.
[I 2026-09-14 18:05:17,350] Trial 266 pruned. 
[I 2026-09-14 18:08:55,102] Trial 267 pruned. 
[I 2026-09-14 18:12:33,583] Trial 268 finished with value: 0.2604718060523377 and parameters: {'phi_model': 'eid', 'kappa': 1.3085163162828137, 'svgd_iters': 0, 'debt_weight': 0.9362262689901084, 'visit_sat': 0.4857852523266904, 'visit_halflife': 2.802261072524299, 'phi_mode': 'quantile', 'n_particles': 128, 'phi_quantile': 0.27345697439294303, 'gp_lengthscale': 0.11081525817937685, 'gp_noise': 0.04906688184349437, 'cfg_weight': 1.2813266442421916}. Best is trial 228 with value: 0.2569052493651794.
[I 2026-09-14 18:13:46,664] Trial 269 pruned. 
[I 2026-09-14 18:14:10,252] Trial 270 pruned. 
[I 2026-09-14 18:17:40,875] Trial 271 finished with value: 0.26144202611952105 and parameters: {'phi_model': 'eid', 'kappa': 1.3472801817735645, 'svgd_iters': 0, 'debt_weight': 0.9726504087152796, 'visit_sat': 0.4437470189850082, 'visit_halflife': 3.23549447236295, 'phi_mode': 'quantile', 'n_particles': 128, 'phi_quantile': 0.24789939510992995, 'gp_lengthscale': 0.13123996911653768, 'gp_noise': 0.046326022022577996, 'cfg_weight': 1.0164297350303828}. Best is trial 228 with value: 0.2569052493651794.
[I 2026-09-14 18:21:23,036] Trial 272 pruned. 
[I 2026-09-14 18:21:46,944] Trial 273 pruned. 
[I 2026-09-14 18:22:11,216] Trial 274 pruned. 
[I 2026-09-14 18:23:22,556] Trial 275 pruned. 
[I 2026-09-14 18:27:04,704] Trial 276 finished with value: 0.25683753145087285 and parameters: {'phi_model': 'eid', 'kappa': 1.2597506527089737, 'svgd_iters': 0, 'debt_weight': 0.9064488614532938, 'visit_sat': 0.4752063000489003, 'visit_halflife': 2.5209103005287408, 'phi_mode': 'quantile', 'n_particles': 128, 'phi_quantile': 0.3269543384157825, 'gp_lengthscale': 0.1329270364438801, 'gp_noise': 0.05040955893990273, 'cfg_weight': 1.0510538575320596}. Best is trial 276 with value: 0.25683753145087285.
[I 2026-09-14 18:30:40,789] Trial 277 finished with value: 0.2581254859780832 and parameters: {'phi_model': 'eid', 'kappa': 1.2592844654948545, 'svgd_iters': 0, 'debt_weight': 0.8946104859013497, 'visit_sat': 0.4569531809685437, 'visit_halflife': 2.475846518610027, 'phi_mode': 'quantile', 'n_particles': 128, 'phi_quantile': 0.32094866073711936, 'gp_lengthscale': 0.14183449066111442, 'gp_noise': 0.044019240557949736, 'cfg_weight': 1.2334622737558198}. Best is trial 276 with value: 0.25683753145087285.
[I 2026-09-14 18:34:15,034] Trial 278 finished with value: 0.2602921141154166 and parameters: {'phi_model': 'eid', 'kappa': 1.3526230996787143, 'svgd_iters': 0, 'debt_weight': 0.8627037052463051, 'visit_sat': 0.45562012349997166, 'visit_halflife': 2.084809709684442, 'phi_mode': 'quantile', 'n_particles': 128, 'phi_quantile': 0.3200447147894473, 'gp_lengthscale': 0.14064704185202406, 'gp_noise': 0.04410613158816784, 'cfg_weight': 1.2667597249047096}. Best is trial 276 with value: 0.25683753145087285.
[I 2026-09-14 18:37:48,460] Trial 279 pruned. 
[I 2026-09-14 18:41:24,360] Trial 280 finished with value: 0.256996680460514 and parameters: {'phi_model': 'eid', 'kappa': 1.252767410315886, 'svgd_iters': 0, 'debt_weight': 0.9400531668115674, 'visit_sat': 0.47267287151074133, 'visit_halflife': 2.264442062933658, 'phi_mode': 'quantile', 'n_particles': 128, 'phi_quantile': 0.8853487421374069, 'gp_lengthscale': 0.12611236520243685, 'gp_noise': 0.05288786144157607, 'cfg_weight': 1.110063773312682}. Best is trial 276 with value: 0.25683753145087285.
[I 2026-09-14 18:44:57,783] Trial 281 finished with value: 0.2587334171870043 and parameters: {'phi_model': 'eid', 'kappa': 1.228012502261015, 'svgd_iters': 0, 'debt_weight': 0.9032857161379062, 'visit_sat': 0.4632731666539215, 'visit_halflife': 2.4712893797215885, 'phi_mode': 'quantile', 'n_particles': 128, 'phi_quantile': 0.3036051942368593, 'gp_lengthscale': 0.12650316433430805, 'gp_noise': 0.05015946587739446, 'cfg_weight': 1.1379419199998067}. Best is trial 276 with value: 0.25683753145087285.
[I 2026-09-14 18:48:31,699] Trial 282 finished with value: 0.2594390635576796 and parameters: {'phi_model': 'eid', 'kappa': 1.2669685371098776, 'svgd_iters': 0, 'debt_weight': 0.9009104750654112, 'visit_sat': 0.4824885208887989, 'visit_halflife': 2.090944344371668, 'phi_mode': 'quantile', 'n_particles': 128, 'phi_quantile': 0.3219761250599614, 'gp_lengthscale': 0.13772588946101944, 'gp_noise': 0.052252928965123846, 'cfg_weight': 1.247567125378246}. Best is trial 276 with value: 0.25683753145087285.
[I 2026-09-14 18:52:05,238] Trial 283 finished with value: 0.25817146305956923 and parameters: {'phi_model': 'eid', 'kappa': 1.2456502502530635, 'svgd_iters': 0, 'debt_weight': 0.8622532783801257, 'visit_sat': 0.4732645478273348, 'visit_halflife': 2.3737340055334326, 'phi_mode': 'quantile', 'n_particles': 128, 'phi_quantile': 0.3273279998995766, 'gp_lengthscale': 0.11652552261898912, 'gp_noise': 0.042438414719819635, 'cfg_weight': 1.3363819293560122}. Best is trial 276 with value: 0.25683753145087285.
[I 2026-09-14 18:55:42,265] Trial 284 pruned. 
[I 2026-09-14 18:59:15,797] Trial 285 finished with value: 0.25855342294500283 and parameters: {'phi_model': 'eid', 'kappa': 1.2955026304404502, 'svgd_iters': 0, 'debt_weight': 0.9303457178850588, 'visit_sat': 0.4655315326415766, 'visit_halflife': 2.2502652163067696, 'phi_mode': 'quantile', 'n_particles': 128, 'phi_quantile': 0.328028867688041, 'gp_lengthscale': 0.13782518498554264, 'gp_noise': 0.052976022031886345, 'cfg_weight': 1.2870655651647966}. Best is trial 276 with value: 0.25683753145087285.
[I 2026-09-14 18:59:41,426] Trial 286 pruned. 
[I 2026-09-14 19:00:06,530] Trial 287 pruned. 
[I 2026-09-14 19:02:35,476] Trial 288 pruned. 
[I 2026-09-14 19:06:14,013] Trial 289 finished with value: 0.2607354436407224 and parameters: {'phi_model': 'eid', 'kappa': 1.3772739013988877, 'svgd_iters': 0, 'debt_weight': 0.9598225686292022, 'visit_sat': 0.4407084056344927, 'visit_halflife': 2.63285276215248, 'phi_mode': 'quantile', 'n_particles': 128, 'phi_quantile': 0.2903105994794405, 'gp_lengthscale': 0.1333026360839836, 'gp_noise': 0.05472325180873162, 'cfg_weight': 1.2367982562215059}. Best is trial 276 with value: 0.25683753145087285.
[I 2026-09-14 19:07:28,382] Trial 290 pruned. 
[I 2026-09-14 19:11:13,335] Trial 291 finished with value: 0.26015302496967735 and parameters: {'phi_model': 'eid', 'kappa': 1.2268383375702252, 'svgd_iters': 0, 'debt_weight': 0.8333467272081166, 'visit_sat': 0.47772524897568025, 'visit_halflife': 2.236799342979562, 'phi_mode': 'quantile', 'n_particles': 128, 'phi_quantile': 0.761227713227191, 'gp_lengthscale': 0.11532262110130431, 'gp_noise': 0.04263201465919482, 'cfg_weight': 1.4006550630328398}. Best is trial 276 with value: 0.25683753145087285.
[I 2026-09-14 19:14:42,054] Trial 292 finished with value: 0.2600694769424412 and parameters: {'phi_model': 'eid', 'kappa': 1.4481791005279958, 'svgd_iters': 0, 'debt_weight': 0.89650154103543, 'visit_sat': 0.46198746890747844, 'visit_halflife': 2.335628129201719, 'phi_mode': 'quantile', 'n_particles': 128, 'phi_quantile': 0.6075612069830232, 'gp_lengthscale': 0.11463094716849434, 'gp_noise': 0.04680225441256876, 'cfg_weight': 1.2593112771815427}. Best is trial 276 with value: 0.25683753145087285.
[I 2026-09-14 19:15:05,051] Trial 293 pruned. 
[I 2026-09-14 19:18:33,441] Trial 294 pruned. 
[I 2026-09-14 19:22:01,816] Trial 295 pruned. 
[I 2026-09-14 19:23:11,425] Trial 296 pruned. 
[I 2026-09-14 19:23:34,402] Trial 297 pruned. 
[I 2026-09-14 19:24:44,144] Trial 298 pruned. 
[I 2026-09-14 19:25:07,928] Trial 299 pruned. 
[I 2026-09-14 19:28:37,137] Trial 300 finished with value: 0.25708965912211884 and parameters: {'phi_model': 'eid', 'kappa': 1.4725130656592098, 'svgd_iters': 0, 'debt_weight': 0.8469756104775661, 'visit_sat': 0.4867973286849863, 'visit_halflife': 2.376099093066795, 'phi_mode': 'quantile', 'n_particles': 128, 'phi_quantile': 0.5280480316399496, 'gp_lengthscale': 0.12103105098079743, 'gp_noise': 0.05110133092997116, 'cfg_weight': 1.1387802157965672}. Best is trial 276 with value: 0.25683753145087285.
[I 2026-09-14 19:32:05,627] Trial 301 finished with value: 0.25926090457616263 and parameters: {'phi_model': 'eid', 'kappa': 1.6305001711300706, 'svgd_iters': 0, 'debt_weight': 0.9108551988826695, 'visit_sat': 0.44294798574101185, 'visit_halflife': 2.340070119208564, 'phi_mode': 'quantile', 'n_particles': 128, 'phi_quantile': 0.6745335455753001, 'gp_lengthscale': 0.15870043934683414, 'gp_noise': 0.03905312221509782, 'cfg_weight': 1.1990787268045953}. Best is trial 276 with value: 0.25683753145087285.
[I 2026-09-14 19:33:15,240] Trial 302 pruned. 
[I 2026-09-14 19:33:38,221] Trial 303 pruned. 
[I 2026-09-14 19:34:01,200] Trial 304 pruned. 
[I 2026-09-14 19:34:24,180] Trial 305 pruned. 
[I 2026-09-14 19:35:33,797] Trial 306 pruned. 
[I 2026-09-14 19:36:43,407] Trial 307 pruned. 
[I 2026-09-14 19:37:53,054] Trial 308 pruned. 
[I 2026-09-14 19:41:21,506] Trial 309 finished with value: 0.2575482818315054 and parameters: {'phi_model': 'eid', 'kappa': 1.7687178256761582, 'svgd_iters': 0, 'debt_weight': 0.8794102671534446, 'visit_sat': 0.431993080300711, 'visit_halflife': 2.4380673061117317, 'phi_mode': 'quantile', 'n_particles': 128, 'phi_quantile': 0.3199164830446779, 'gp_lengthscale': 0.12473276068637412, 'gp_noise': 0.05449440485994168, 'cfg_weight': 1.126497437541231}. Best is trial 276 with value: 0.25683753145087285.
[I 2026-09-14 19:44:49,906] Trial 310 pruned. 
[I 2026-09-14 19:45:59,517] Trial 311 pruned. 
[I 2026-09-14 19:47:09,134] Trial 312 pruned. 
[I 2026-09-14 19:50:37,512] Trial 313 pruned. 
