[I 2026-09-15 09:17:19,722] Trial 408 pruned. 
[I 2026-09-15 09:17:42,435] Trial 409 pruned. 
[I 2026-09-15 09:18:51,315] Trial 410 pruned. 
[I 2026-09-15 09:22:18,744] Trial 411 pruned. 
[I 2026-09-15 09:23:27,974] Trial 412 pruned. 
[I 2026-09-15 09:24:37,405] Trial 413 pruned. 
[I 2026-09-15 09:28:05,400] Trial 414 pruned. 
[I 2026-09-15 09:31:33,630] Trial 415 finished with value: 0.2586095898067902 and parameters: {'phi_model': 'eid', 'kappa': 1.836069233260797, 'svgd_iters': 0, 'debt_weight': 0.816282447993462, 'visit_sat': 0.5246719803679497, 'visit_halflife': 2.583136881634986, 'phi_mode': 'quantile', 'n_particles': 128, 'phi_quantile': 0.493989596419336, 'gp_lengthscale': 0.13183088299382456, 'gp_noise': 0.05992038776866693, 'cfg_weight': 1.0464299952789817}. Best is trial 364 with value: 0.25601826709156156.
[I 2026-09-15 09:35:01,786] Trial 416 finished with value: 0.25922151433840007 and parameters: {'phi_model': 'eid', 'kappa': 1.3514821400424901, 'svgd_iters': 0, 'debt_weight': 0.9877108573913315, 'visit_sat': 0.5346443334118534, 'visit_halflife': 2.75721468258453, 'phi_mode': 'quantile', 'n_particles': 128, 'phi_quantile': 0.2860396466979657, 'gp_lengthscale': 0.13498846824059035, 'gp_noise': 0.0737052357815304, 'cfg_weight': 1.1669069605756828}. Best is trial 364 with value: 0.25601826709156156.
[I 2026-09-15 09:35:24,757] Trial 417 pruned. 
[I 2026-09-15 09:36:34,291] Trial 418 pruned. 
[I 2026-09-15 09:40:02,487] Trial 419 finished with value: 0.25835606964782104 and parameters: {'phi_model': 'eid', 'kappa': 1.8202935121976782, 'svgd_iters': 0, 'debt_weight': 0.9228576894506182, 'visit_sat': 0.39715737121088324, 'visit_halflife': 2.4276500653843196, 'phi_mode': 'quantile', 'n_particles': 128, 'phi_quantile': 0.8750080952613973, 'gp_lengthscale': 0.13367548637274265, 'gp_noise': 0.05323284112531442, 'cfg_weight': 1.0967557894388396}. Best is trial 364 with value: 0.25601826709156156.
[I 2026-09-15 09:41:12,019] Trial 420 pruned. 
[I 2026-09-15 09:42:21,561] Trial 421 pruned. 
[I 2026-09-15 09:42:44,519] Trial 422 pruned. 
[I 2026-09-15 09:46:12,750] Trial 423 finished with value: 0.2596343100112556 and parameters: {'phi_model': 'eid', 'kappa': 2.5165958534362525, 'svgd_iters': 0, 'debt_weight': 0.9687993527135098, 'visit_sat': 0.4358947906755745, 'visit_halflife': 2.623437906715729, 'phi_mode': 'quantile', 'n_particles': 128, 'phi_quantile': 0.3269918620669214, 'gp_lengthscale': 0.11366294142047227, 'gp_noise': 0.053564897182432646, 'cfg_weight': 1.4874219723279005}. Best is trial 364 with value: 0.25601826709156156.
[I 2026-09-15 09:49:40,982] Trial 424 finished with value: 0.2539690003117714 and parameters: {'phi_model': 'eid', 'kappa': 1.2568900819728759, 'svgd_iters': 0, 'debt_weight': 0.9627599488507499, 'visit_sat': 0.5636618470679305, 'visit_halflife': 1.3856376434165998, 'phi_mode': 'quantile', 'n_particles': 128, 'phi_quantile': 0.2838052319641445, 'gp_lengthscale': 0.12191278618915997, 'gp_noise': 0.06674515076991905, 'cfg_weight': 1.1702637501197852}. Best is trial 424 with value: 0.2539690003117714.
[I 2026-09-15 09:53:09,144] Trial 425 pruned. 
[I 2026-09-15 09:54:18,563] Trial 426 pruned. 
[I 2026-09-15 09:57:46,802] Trial 427 finished with value: 0.25948964235680155 and parameters: {'phi_model': 'eid', 'kappa': 1.3689834264917253, 'svgd_iters': 0, 'debt_weight': 0.9813368569970342, 'visit_sat': 0.5439569313190199, 'visit_halflife': 2.732670725802883, 'phi_mode': 'quantile', 'n_particles': 128, 'phi_quantile': 0.27625138685274137, 'gp_lengthscale': 0.14093741806302354, 'gp_noise': 0.06261080574849862, 'cfg_weight': 1.3418469861304576}. Best is trial 424 with value: 0.2539690003117714.
[I 2026-09-15 10:01:15,496] Trial 428 finished with value: 0.25820819373325227 and parameters: {'phi_model': 'eid', 'kappa': 1.1902422638582877, 'svgd_iters': 0, 'debt_weight': 0.9771952787970509, 'visit_sat': 0.4724191448606371, 'visit_halflife': 2.1658948239522395, 'phi_mode': 'quantile', 'n_particles': 128, 'phi_quantile': 0.25767071485370036, 'gp_lengthscale': 0.12663416743841244, 'gp_noise': 0.0584853176624903, 'cfg_weight': 1.065423204467853}. Best is trial 424 with value: 0.2539690003117714.
[I 2026-09-15 10:04:43,878] Trial 429 pruned. 
[I 2026-09-15 10:08:12,324] Trial 430 finished with value: 0.26005681890758076 and parameters: {'phi_model': 'eid', 'kappa': 2.3166733965065975, 'svgd_iters': 0, 'debt_weight': 0.899529758816667, 'visit_sat': 0.559033332579565, 'visit_halflife': 1.1212610131050662, 'phi_mode': 'quantile', 'n_particles': 128, 'phi_quantile': 0.23088778256795478, 'gp_lengthscale': 0.11386040294586233, 'gp_noise': 0.06165127052948056, 'cfg_weight': 1.2478278690043447}. Best is trial 424 with value: 0.2539690003117714.
[I 2026-09-15 10:09:24,084] Trial 431 pruned. 
[I 2026-09-15 10:10:33,676] Trial 432 pruned. 
[I 2026-09-15 10:14:02,073] Trial 433 finished with value: 0.2579796474683975 and parameters: {'phi_model': 'eid', 'kappa': 4.261296296627746, 'svgd_iters': 0, 'debt_weight': 0.9611209714415301, 'visit_sat': 0.5765848365455106, 'visit_halflife': 1.3371070375476182, 'phi_mode': 'quantile', 'n_particles': 128, 'phi_quantile': 0.30921075787632313, 'gp_lengthscale': 0.12658096864783963, 'gp_noise': 0.07511127077442041, 'cfg_weight': 1.1552718263264703}. Best is trial 424 with value: 0.2539690003117714.
[I 2026-09-15 10:15:11,725] Trial 434 pruned. 
[I 2026-09-15 10:15:34,726] Trial 435 pruned. 
[I 2026-09-15 10:19:03,384] Trial 436 finished with value: 0.25715043562552004 and parameters: {'phi_model': 'eid', 'kappa': 3.3359131651185576, 'svgd_iters': 0, 'debt_weight': 0.9621946991593276, 'visit_sat': 0.44894120185729397, 'visit_halflife': 1.9922113936455688, 'phi_mode': 'quantile', 'n_particles': 128, 'phi_quantile': 0.3028897707565673, 'gp_lengthscale': 0.11938668784524681, 'gp_noise': 0.05633443938071412, 'cfg_weight': 1.364890008001822}. Best is trial 424 with value: 0.2539690003117714.
[I 2026-09-15 10:20:12,873] Trial 437 pruned. 
[I 2026-09-15 10:20:35,818] Trial 438 pruned. 
[I 2026-09-15 10:24:03,859] Trial 439 finished with value: 0.258922697612704 and parameters: {'phi_model': 'eid', 'kappa': 3.3423582955982774, 'svgd_iters': 0, 'debt_weight': 0.9650219929666204, 'visit_sat': 0.6435271899498396, 'visit_halflife': 1.7227512175919037, 'phi_mode': 'quantile', 'n_particles': 128, 'phi_quantile': 0.39788837870235516, 'gp_lengthscale': 0.1431995766206771, 'gp_noise': 0.06808140239131671, 'cfg_weight': 1.1372901242148492}. Best is trial 424 with value: 0.2539690003117714.
[I 2026-09-15 10:25:13,334] Trial 440 pruned. 
[I 2026-09-15 10:26:22,823] Trial 441 pruned. 
[I 2026-09-15 10:29:50,943] Trial 442 pruned. 
[I 2026-09-15 10:33:18,989] Trial 443 finished with value: 0.2600797997096271 and parameters: {'phi_model': 'eid', 'kappa': 3.6919135279051165, 'svgd_iters': 0, 'debt_weight': 0.9570210808209951, 'visit_sat': 0.476100794416743, 'visit_halflife': 1.886853668318192, 'phi_mode': 'quantile', 'n_particles': 128, 'phi_quantile': 0.3097684524305924, 'gp_lengthscale': 0.10188905241147762, 'gp_noise': 0.07020963282608794, 'cfg_weight': 1.2726727981198929}. Best is trial 424 with value: 0.2539690003117714.
[I 2026-09-15 10:33:41,934] Trial 444 pruned. 
[I 2026-09-15 10:34:51,420] Trial 445 pruned. 
[I 2026-09-15 10:36:00,926] Trial 446 pruned. 
[I 2026-09-15 10:36:23,875] Trial 447 pruned. 
[I 2026-09-15 10:37:33,372] Trial 448 pruned. 
[I 2026-09-15 10:38:42,866] Trial 449 pruned. 
[I 2026-09-15 10:39:52,357] Trial 450 pruned. 
[I 2026-09-15 10:41:01,949] Trial 451 pruned. 
[I 2026-09-15 10:42:11,516] Trial 452 pruned. 
[I 2026-09-15 10:42:34,463] Trial 453 pruned. 
[I 2026-09-15 10:42:57,415] Trial 454 pruned. 
[I 2026-09-15 10:43:20,373] Trial 455 pruned. 
[I 2026-09-15 10:46:48,383] Trial 456 pruned. 
[I 2026-09-15 10:47:11,329] Trial 457 pruned. 
[I 2026-09-15 10:50:39,494] Trial 458 finished with value: 0.2540328991918958 and parameters: {'phi_model': 'eid', 'kappa': 1.5369547805729196, 'svgd_iters': 0, 'debt_weight': 0.8608302171702665, 'visit_sat': 0.4574149395899092, 'visit_halflife': 1.825574094245331, 'phi_mode': 'quantile', 'n_particles': 128, 'phi_quantile': 0.3859238626990238, 'gp_lengthscale': 0.12553300231756692, 'gp_noise': 0.05836879867264605, 'cfg_weight': 1.2987077158729685}. Best is trial 424 with value: 0.2539690003117714.
[I 2026-09-15 10:54:07,648] Trial 459 finished with value: 0.2577074259860101 and parameters: {'phi_model': 'eid', 'kappa': 1.7424504992022523, 'svgd_iters': 0, 'debt_weight': 0.8975014790341698, 'visit_sat': 0.5070084642440177, 'visit_halflife': 2.196610964288167, 'phi_mode': 'quantile', 'n_particles': 128, 'phi_quantile': 0.39179802294141364, 'gp_lengthscale': 0.13978632814767858, 'gp_noise': 0.06302082614266304, 'cfg_weight': 1.0788773421457318}. Best is trial 424 with value: 0.2539690003117714.
[I 2026-09-15 10:57:35,653] Trial 460 pruned. 
[I 2026-09-15 10:58:45,146] Trial 461 pruned. 
[I 2026-09-15 10:59:54,657] Trial 462 pruned. 
[I 2026-09-15 11:03:22,740] Trial 463 finished with value: 0.25898963871523223 and parameters: {'phi_model': 'eid', 'kappa': 1.532097288171585, 'svgd_iters': 0, 'debt_weight': 0.9304399005718537, 'visit_sat': 0.4133730775433436, 'visit_halflife': 1.968253456484681, 'phi_mode': 'quantile', 'n_particles': 128, 'phi_quantile': 0.3994325562580426, 'gp_lengthscale': 0.12418797203073306, 'gp_noise': 0.06697425811113812, 'cfg_weight': 1.0485973072791588}. Best is trial 424 with value: 0.2539690003117714.
[I 2026-09-15 11:04:32,267] Trial 464 pruned. 
[I 2026-09-15 11:05:41,782] Trial 465 pruned. 
[I 2026-09-15 11:09:09,889] Trial 466 finished with value: 0.260074104802683 and parameters: {'phi_model': 'eid', 'kappa': 1.4880831929208507, 'svgd_iters': 0, 'debt_weight': 0.7753500937321927, 'visit_sat': 0.3572249783395291, 'visit_halflife': 3.7044369714772536, 'phi_mode': 'quantile', 'n_particles': 128, 'phi_quantile': 0.406859937096698, 'gp_lengthscale': 0.09316579662688897, 'gp_noise': 0.05320977084886366, 'cfg_weight': 1.2679332522474673}. Best is trial 424 with value: 0.2539690003117714.
[I 2026-09-15 11:09:32,849] Trial 467 pruned. 
[I 2026-09-15 11:13:01,008] Trial 468 finished with value: 0.2583881852368964 and parameters: {'phi_model': 'eid', 'kappa': 1.9489671823803925, 'svgd_iters': 0, 'debt_weight': 0.9881195675518114, 'visit_sat': 0.5646218474703324, 'visit_halflife': 1.768252012491949, 'phi_mode': 'quantile', 'n_particles': 128, 'phi_quantile': 0.43579140524180066, 'gp_lengthscale': 0.12076805451611738, 'gp_noise': 0.08280419311287615, 'cfg_weight': 1.0563900753459143}. Best is trial 424 with value: 0.2539690003117714.
[I 2026-09-15 11:14:10,533] Trial 469 pruned. 
[I 2026-09-15 11:17:38,722] Trial 470 finished with value: 0.25573814888272584 and parameters: {'phi_model': 'eid', 'kappa': 3.5178510750876635, 'svgd_iters': 0, 'debt_weight': 0.7996179910070558, 'visit_sat': 0.4868755088991639, 'visit_halflife': 2.0793277423128824, 'phi_mode': 'quantile', 'n_particles': 128, 'phi_quantile': 0.37510363996932206, 'gp_lengthscale': 0.11899450865024033, 'gp_noise': 0.06676445083715181, 'cfg_weight': 1.004929564134828}. Best is trial 424 with value: 0.2539690003117714.
[I 2026-09-15 11:21:06,815] Trial 471 pruned. 
[I 2026-09-15 11:22:16,338] Trial 472 pruned. 
[I 2026-09-15 11:25:44,440] Trial 473 pruned. 
[I 2026-09-15 11:26:53,996] Trial 474 pruned. 
[I 2026-09-15 11:28:03,512] Trial 475 pruned. 
[I 2026-09-15 11:28:26,489] Trial 476 pruned. 
[I 2026-09-15 11:28:49,409] Trial 477 pruned. 
[I 2026-09-15 11:29:12,377] Trial 478 pruned. 
[I 2026-09-15 11:29:35,328] Trial 479 pruned. 
[I 2026-09-15 11:30:44,851] Trial 480 pruned. 
[I 2026-09-15 11:31:07,821] Trial 481 pruned. 
[I 2026-09-15 11:31:30,777] Trial 482 pruned. 
[I 2026-09-15 11:34:58,859] Trial 483 pruned. 
[I 2026-09-15 11:35:21,821] Trial 484 pruned. 
[I 2026-09-15 11:35:44,780] Trial 485 pruned. 
[I 2026-09-15 11:39:12,876] Trial 486 pruned. 
[I 2026-09-15 11:42:40,948] Trial 487 pruned. 
[I 2026-09-15 11:43:50,567] Trial 488 pruned. 
[I 2026-09-15 11:44:37,567] Trial 489 pruned. 
[I 2026-09-15 11:48:06,094] Trial 490 finished with value: 0.25941764393851147 and parameters: {'phi_model': 'eid', 'kappa': 3.1536675093436792, 'svgd_iters': 0, 'debt_weight': 0.924250905165153, 'visit_sat': 0.45115384337695524, 'visit_halflife': 2.3117075250304646, 'phi_mode': 'quantile', 'n_particles': 128, 'phi_quantile': 0.359470034534106, 'gp_lengthscale': 0.14931588004156598, 'gp_noise': 0.06946564003167195, 'cfg_weight': 1.258683721067505}. Best is trial 424 with value: 0.2539690003117714.
[I 2026-09-15 11:51:34,261] Trial 491 pruned. 
[I 2026-09-15 11:52:43,883] Trial 492 pruned. 
[I 2026-09-15 11:56:12,168] Trial 493 finished with value: 0.26011461739568326 and parameters: {'phi_model': 'eid', 'kappa': 3.4797290167860595, 'svgd_iters': 0, 'debt_weight': 0.9868381466918192, 'visit_sat': 0.4834347967097731, 'visit_halflife': 2.2927789259725304, 'phi_mode': 'quantile', 'n_particles': 128, 'phi_quantile': 0.34478970783142704, 'gp_lengthscale': 0.11097160208257406, 'gp_noise': 0.0477400709926081, 'cfg_weight': 1.3456516730124117}. Best is trial 424 with value: 0.2539690003117714.
[I 2026-09-15 11:59:40,376] Trial 494 pruned. 
[I 2026-09-15 12:00:49,971] Trial 495 pruned. 
[I 2026-09-15 12:04:18,232] Trial 496 finished with value: 0.25752372019210407 and parameters: {'phi_model': 'eid', 'kappa': 1.5146724687208515, 'svgd_iters': 0, 'debt_weight': 0.9352200873986083, 'visit_sat': 0.5564274026202687, 'visit_halflife': 1.5866047260469933, 'phi_mode': 'quantile', 'n_particles': 128, 'phi_quantile': 0.310956029031097, 'gp_lengthscale': 0.10518375196708463, 'gp_noise': 0.06386346609038902, 'cfg_weight': 1.0203440596788336}. Best is trial 424 with value: 0.2539690003117714.
[I 2026-09-15 12:04:41,209] Trial 497 pruned. 
[I 2026-09-15 12:05:04,182] Trial 498 pruned. 
[I 2026-09-15 12:06:13,745] Trial 499 pruned. 
[I 2026-09-15 12:07:23,283] Trial 500 pruned. 
[I 2026-09-15 12:07:46,346] Trial 501 pruned. 
[I 2026-09-15 12:11:14,517] Trial 502 pruned. 
[I 2026-09-15 12:14:42,746] Trial 503 pruned. 
[I 2026-09-15 12:18:10,976] Trial 504 pruned. 
[I 2026-09-15 12:21:39,413] Trial 505 pruned. 
[I 2026-09-15 12:25:08,105] Trial 506 finished with value: 0.25642830475470085 and parameters: {'phi_model': 'eid', 'kappa': 3.598328686400144, 'svgd_iters': 0, 'debt_weight': 0.8242500077075765, 'visit_sat': 0.46246537697626944, 'visit_halflife': 1.5869632295527014, 'phi_mode': 'quantile', 'n_particles': 128, 'phi_quantile': 0.2761176358117773, 'gp_lengthscale': 0.10663306087755084, 'gp_noise': 0.0690706507345913, 'cfg_weight': 1.0655625752819144}. Best is trial 424 with value: 0.2539690003117714.
[I 2026-09-15 12:26:17,805] Trial 507 pruned. 
[I 2026-09-15 12:29:46,404] Trial 508 pruned. 
[I 2026-09-15 12:33:15,005] Trial 509 pruned. 
[I 2026-09-15 12:36:43,664] Trial 510 finished with value: 0.25457446350572915 and parameters: {'phi_model': 'eid', 'kappa': 3.7117028413720505, 'svgd_iters': 0, 'debt_weight': 0.8406507115127576, 'visit_sat': 0.5323704655695759, 'visit_halflife': 2.026834520100055, 'phi_mode': 'quantile', 'n_particles': 128, 'phi_quantile': 0.260231112059404, 'gp_lengthscale': 0.12452493547410734, 'gp_noise': 0.06890945326526215, 'cfg_weight': 1.3843598507251804}. Best is trial 424 with value: 0.2539690003117714.
[I 2026-09-15 12:37:06,693] Trial 511 pruned. 
[I 2026-09-15 12:40:35,342] Trial 512 finished with value: 0.25875649504468834 and parameters: {'phi_model': 'eid', 'kappa': 3.644768817578147, 'svgd_iters': 0, 'debt_weight': 0.9153805238712562, 'visit_sat': 0.44186659217247043, 'visit_halflife': 1.7854478858104246, 'phi_mode': 'quantile', 'n_particles': 128, 'phi_quantile': 0.2560258739715849, 'gp_lengthscale': 0.12073992640306398, 'gp_noise': 0.06066975815854882, 'cfg_weight': 1.5154410943188634}. Best is trial 424 with value: 0.2539690003117714.
[I 2026-09-15 12:44:04,020] Trial 513 finished with value: 0.2601942893398723 and parameters: {'phi_model': 'eid', 'kappa': 3.885317238776053, 'svgd_iters': 0, 'debt_weight': 0.942056650892141, 'visit_sat': 0.4432490028620105, 'visit_halflife': 3.6455541712164674, 'phi_mode': 'quantile', 'n_particles': 128, 'phi_quantile': 0.21614245429476237, 'gp_lengthscale': 0.12052935920483403, 'gp_noise': 0.059988378387245474, 'cfg_weight': 1.0136109707436458}. Best is trial 424 with value: 0.2539690003117714.
[I 2026-09-15 12:44:27,033] Trial 514 pruned. 
[I 2026-09-15 12:44:50,055] Trial 515 pruned. 
[I 2026-09-15 12:48:19,311] Trial 516 pruned. 
[I 2026-09-15 12:51:47,987] Trial 517 finished with value: 0.25826237804257296 and parameters: {'phi_model': 'eid', 'kappa': 3.3143067352068054, 'svgd_iters': 0, 'debt_weight': 0.8639649175382544, 'visit_sat': 0.4613843282154498, 'visit_halflife': 1.624363663516862, 'phi_mode': 'quantile', 'n_particles': 128, 'phi_quantile': 0.26746592561240135, 'gp_lengthscale': 0.10161631317204321, 'gp_noise': 0.06720580900678828, 'cfg_weight': 1.041843445265922}. Best is trial 424 with value: 0.2539690003117714.
[I 2026-09-15 12:52:11,010] Trial 518 pruned. 
[I 2026-09-15 12:52:34,030] Trial 519 pruned. 
[I 2026-09-15 12:52:57,062] Trial 520 pruned. 
[I 2026-09-15 12:54:06,797] Trial 521 pruned. 
[I 2026-09-15 12:57:34,970] Trial 522 pruned. 
[I 2026-09-15 13:01:03,631] Trial 523 pruned. 
[I 2026-09-15 13:04:32,365] Trial 524 finished with value: 0.25714302886933166 and parameters: {'phi_model': 'eid', 'kappa': 1.4338919929111253, 'svgd_iters': 0, 'debt_weight': 0.8293603165857844, 'visit_sat': 0.4828926584045154, 'visit_halflife': 2.2796493119192207, 'phi_mode': 'quantile', 'n_particles': 128, 'phi_quantile': 0.2583994079277877, 'gp_lengthscale': 0.14498425883677288, 'gp_noise': 0.0794615494291264, 'cfg_weight': 1.0829699979566683}. Best is trial 424 with value: 0.2539690003117714.
[I 2026-09-15 13:04:55,405] Trial 525 pruned. 
[I 2026-09-15 13:05:18,422] Trial 526 pruned. 
[I 2026-09-15 13:06:28,145] Trial 527 pruned. 
[I 2026-09-15 13:06:51,158] Trial 528 pruned. 
[I 2026-09-15 13:08:00,875] Trial 529 pruned. 
[I 2026-09-15 13:11:29,585] Trial 530 finished with value: 0.25587811052371695 and parameters: {'phi_model': 'eid', 'kappa': 1.046235769206332, 'svgd_iters': 0, 'debt_weight': 0.8740288797288706, 'visit_sat': 0.5129145271656765, 'visit_halflife': 2.0821247700364824, 'phi_mode': 'quantile', 'n_particles': 128, 'phi_quantile': 0.25997124994886356, 'gp_lengthscale': 0.10754095545683001, 'gp_noise': 0.07605125610813458, 'cfg_weight': 1.0433368621613563}. Best is trial 424 with value: 0.2539690003117714.
[I 2026-09-15 13:12:39,310] Trial 531 pruned. 
[I 2026-09-15 13:13:02,325] Trial 532 pruned. 
[I 2026-09-15 13:16:31,036] Trial 533 finished with value: 0.25983930744961653 and parameters: {'phi_model': 'eid', 'kappa': 1.1154562013535043, 'svgd_iters': 0, 'debt_weight': 0.8687970730742046, 'visit_sat': 0.5450703251759146, 'visit_halflife': 1.5788564021530707, 'phi_mode': 'quantile', 'n_particles': 128, 'phi_quantile': 0.26196147032246053, 'gp_lengthscale': 0.11126251955233707, 'gp_noise': 0.07741937158686552, 'cfg_weight': 1.0115916385714556}. Best is trial 424 with value: 0.2539690003117714.
[I 2026-09-15 13:17:40,621] Trial 534 pruned. 
[I 2026-09-15 13:18:50,325] Trial 535 pruned. 
[I 2026-09-15 13:20:00,035] Trial 536 pruned. 
[I 2026-09-15 13:20:23,054] Trial 537 pruned. 
[I 2026-09-15 13:20:46,074] Trial 538 pruned. 
[I 2026-09-15 13:21:09,097] Trial 539 pruned. 
[I 2026-09-15 13:21:32,118] Trial 540 pruned. 
[I 2026-09-15 13:25:00,754] Trial 541 pruned. 
[I 2026-09-15 13:25:23,777] Trial 542 pruned. 
[I 2026-09-15 13:25:46,806] Trial 543 pruned. 
[I 2026-09-15 13:29:15,479] Trial 544 finished with value: 0.26009717952776423 and parameters: {'phi_model': 'eid', 'kappa': 1.946783145936122, 'svgd_iters': 0, 'debt_weight': 0.8578803675556623, 'visit_sat': 0.5274132225382047, 'visit_halflife': 2.225019503845081, 'phi_mode': 'quantile', 'n_particles': 128, 'phi_quantile': 0.24823916937253482, 'gp_lengthscale': 0.13042594204100286, 'gp_noise': 0.07350005662710324, 'cfg_weight': 1.4827131327888625}. Best is trial 424 with value: 0.2539690003117714.
[I 2026-09-15 13:29:38,505] Trial 545 pruned. 
[I 2026-09-15 13:33:07,174] Trial 546 finished with value: 0.2587815629330343 and parameters: {'phi_model': 'eid', 'kappa': 1.4580322704275632, 'svgd_iters': 0, 'debt_weight': 0.8950116544117573, 'visit_sat': 0.49234565448990586, 'visit_halflife': 4.168490489201993, 'phi_mode': 'quantile', 'n_particles': 128, 'phi_quantile': 0.3790713953300294, 'gp_lengthscale': 0.09428126931826926, 'gp_noise': 0.04221908694314452, 'cfg_weight': 1.1662647982181618}. Best is trial 424 with value: 0.2539690003117714.
[I 2026-09-15 13:36:35,836] Trial 547 finished with value: 0.25594677525686077 and parameters: {'phi_model': 'eid', 'kappa': 1.7219182220889533, 'svgd_iters': 0, 'debt_weight': 0.9209874703400794, 'visit_sat': 0.5055274899338957, 'visit_halflife': 1.839224192100131, 'phi_mode': 'quantile', 'n_particles': 128, 'phi_quantile': 0.10633192738067654, 'gp_lengthscale': 0.10720529008445849, 'gp_noise': 0.08411595835040073, 'cfg_weight': 1.0204698932534055}. Best is trial 424 with value: 0.2539690003117714.
[I 2026-09-15 13:40:04,458] Trial 548 pruned. 
[I 2026-09-15 13:41:14,154] Trial 549 pruned. 
[I 2026-09-15 13:42:23,860] Trial 550 pruned. 
[I 2026-09-15 13:42:46,876] Trial 551 pruned. 
[I 2026-09-15 13:43:09,893] Trial 552 pruned. 
[I 2026-09-15 13:44:19,601] Trial 553 pruned. 
[I 2026-09-15 13:44:42,621] Trial 554 pruned. 
[I 2026-09-15 13:45:05,642] Trial 555 pruned. 
[I 2026-09-15 13:48:34,261] Trial 556 pruned. 
[I 2026-09-15 13:48:57,284] Trial 557 pruned. 
