C:\Users\Philipp\Documents\Uni\Master_Thesis\Master_thesis_ergodic_learning\thesis_architecture\exploration_optimierung\optuna_search.py:280: ExperimentalWarning: Argument ``group`` is an experimental feature. The interface can change in the future.
  sampler=optuna.samplers.TPESampler(seed=a.seed, multivariate=True,
[I 2026-09-12 11:32:10,175] A new study created in RDB with name: tuning_v1
[I 2026-09-12 11:36:29,118] Trial 0 finished with value: 0.31381291312249343 and parameters: {'phi_model': 'eid', 'kappa': 0.8887895725019269, 'svgd_iters': 250, 'debt_weight': 0.4375872112626925, 'visit_sat': 0.9025957007038717, 'visit_halflife': 7.72747070375772, 'phi_mode': 'density', 'n_particles': 256}. Best is trial 0 with value: 0.31381291312249343.
[I 2026-09-12 11:41:29,411] Trial 1 finished with value: 0.28815554108958275 and parameters: {'phi_model': 'mass', 'w': 0.8330109334221372, 'svgd_iters': 400, 'debt_weight': 0.7991585642167236, 'visit_sat': 0.5153314260276387, 'visit_halflife': 6.353968822148416, 'phi_mode': 'density', 'n_particles': 128}. Best is trial 1 with value: 0.28815554108958275.
[I 2026-09-12 11:45:05,642] Trial 2 finished with value: 0.30711230959540187 and parameters: {'phi_model': 'eid', 'kappa': 0.16231630221130722, 'svgd_iters': 250, 'debt_weight': 0.6120957227224214, 'visit_sat': 0.6552405971872812, 'visit_halflife': 7.578110588859682, 'phi_mode': 'uniform', 'n_particles': 128}. Best is trial 1 with value: 0.28815554108958275.
[I 2026-09-12 11:48:50,556] Trial 3 finished with value: 0.29251608707186727 and parameters: {'phi_model': 'ucb', 'kappa': 0.6909816486214249, 'svgd_iters': 225, 'debt_weight': 0.43860151346232035, 'visit_sat': 0.9895364542533036, 'visit_halflife': 1.2653360806102105, 'phi_mode': 'quantile', 'n_particles': 256, 'phi_quantile': 0.22717566691641577}. Best is trial 1 with value: 0.28815554108958275.
[I 2026-09-12 11:53:35,309] Trial 4 finished with value: 0.32034057797396537 and parameters: {'phi_model': 'eid', 'kappa': 0.7056873311448854, 'svgd_iters': 325, 'debt_weight': 0.09710127579306127, 'visit_sat': 0.8541504167489236, 'visit_halflife': 1.220738059204723, 'phi_mode': 'quantile', 'n_particles': 256, 'phi_quantile': 0.32624557006112764}. Best is trial 1 with value: 0.28815554108958275.
[I 2026-09-12 11:54:59,674] Trial 5 finished with value: 0.27470878113333064 and parameters: {'phi_model': 'niveau', 'tau': 0.3845514351729096, 'svgd_iters': 25, 'debt_weight': 0.6924721193700198, 'visit_sat': 0.6099413087859177, 'visit_halflife': 2.4904211820458406, 'phi_mode': 'quantile', 'n_particles': 128, 'phi_quantile': 0.20543828992351376}. Best is trial 5 with value: 0.27470878113333064.
[I 2026-09-12 11:59:57,193] Trial 6 finished with value: 0.3067943350332454 and parameters: {'phi_model': 'ucb', 'kappa': 0.1632170741253234, 'svgd_iters': 350, 'debt_weight': 0.004695476192547066, 'visit_sat': 0.7100348831166071, 'visit_halflife': 2.5250597989412364, 'phi_mode': 'density', 'n_particles': 256}. Best is trial 5 with value: 0.27470878113333064.
[I 2026-09-12 12:03:32,506] Trial 7 finished with value: 0.29286741819893714 and parameters: {'phi_model': 'eid', 'kappa': 2.830594271491897, 'svgd_iters': 125, 'debt_weight': 0.8137978197024772, 'visit_sat': 0.4568551667622862, 'visit_halflife': 7.108273978333711, 'phi_mode': 'density', 'n_particles': 512}. Best is trial 5 with value: 0.27470878113333064.
[I 2026-09-12 12:08:35,120] Trial 8 finished with value: 0.29128385978479576 and parameters: {'phi_model': 'ucb', 'kappa': 0.5322751649871316, 'svgd_iters': 275, 'debt_weight': 0.29007760721044407, 'visit_sat': 0.6562138860989574, 'visit_halflife': 3.715765257093246, 'phi_mode': 'quantile', 'n_particles': 512, 'phi_quantile': 0.6216826160013511}. Best is trial 5 with value: 0.27470878113333064.
[I 2026-09-12 12:10:02,695] Trial 9 pruned. 
[I 2026-09-12 12:10:55,579] Trial 10 pruned. 
[I 2026-09-12 12:15:40,387] Trial 11 finished with value: 0.2851544664796853 and parameters: {'phi_model': 'mass', 'w': 0.9304899436186198, 'svgd_iters': 375, 'debt_weight': 0.8576419202183756, 'visit_sat': 0.40887637153521605, 'visit_halflife': 1.8759392664671513, 'phi_mode': 'density', 'n_particles': 128}. Best is trial 5 with value: 0.27470878113333064.
[I 2026-09-12 12:17:34,973] Trial 12 pruned. 
[I 2026-09-12 12:19:45,364] Trial 13 finished with value: 0.2911872602553551 and parameters: {'phi_model': 'niveau', 'tau': 0.36288156061125526, 'svgd_iters': 100, 'debt_weight': 0.8753636603265345, 'visit_sat': 0.44855150675427047, 'visit_halflife': 4.403690257356511, 'phi_mode': 'quantile', 'n_particles': 128, 'phi_quantile': 0.47899857408171626}. Best is trial 5 with value: 0.27470878113333064.
[I 2026-09-12 12:24:32,440] Trial 14 finished with value: 0.28617672283184437 and parameters: {'phi_model': 'niveau', 'tau': 0.6158939597610968, 'svgd_iters': 375, 'debt_weight': 0.49286803162343074, 'visit_sat': 0.34683134609019267, 'visit_halflife': 2.505241663666165, 'phi_mode': 'density', 'n_particles': 128}. Best is trial 5 with value: 0.27470878113333064.
[I 2026-09-12 12:25:14,216] Trial 15 pruned. 
[I 2026-09-12 12:28:49,583] Trial 16 finished with value: 0.2783424297959062 and parameters: {'phi_model': 'mass', 'w': 0.4139233864597057, 'svgd_iters': 250, 'debt_weight': 0.9471124498594852, 'visit_sat': 0.41705308567514265, 'visit_halflife': 2.2796155819898885, 'phi_mode': 'density', 'n_particles': 128}. Best is trial 5 with value: 0.27470878113333064.
[I 2026-09-12 12:30:30,109] Trial 17 finished with value: 0.25338444922501435 and parameters: {'phi_model': 'mass', 'w': 0.3555997475607703, 'svgd_iters': 50, 'debt_weight': 0.9500746326229913, 'visit_sat': 0.36822856145039046, 'visit_halflife': 2.5154632070654994, 'phi_mode': 'density', 'n_particles': 128}. Best is trial 17 with value: 0.25338444922501435.
[I 2026-09-12 12:30:52,807] Trial 18 pruned. 
[I 2026-09-12 12:32:02,012] Trial 19 finished with value: 0.2721892888419405 and parameters: {'phi_model': 'niveau', 'tau': 0.8354578158660827, 'svgd_iters': 0, 'debt_weight': 0.9016564556731148, 'visit_sat': 0.7062788388309176, 'visit_halflife': 1.5911332923089376, 'phi_mode': 'quantile', 'n_particles': 128, 'phi_quantile': 0.48169120541639077}. Best is trial 17 with value: 0.25338444922501435.
[I 2026-09-12 12:33:42,647] Trial 20 finished with value: 0.2619312404197811 and parameters: {'phi_model': 'niveau', 'tau': 0.8801647754900823, 'svgd_iters': 50, 'debt_weight': 0.5808958117453087, 'visit_sat': 0.7903938874485998, 'visit_halflife': 1.8409595611443996, 'phi_mode': 'uniform', 'n_particles': 128}. Best is trial 17 with value: 0.25338444922501435.
[I 2026-09-12 12:35:39,415] Trial 21 finished with value: 0.26173465375673244 and parameters: {'phi_model': 'mass', 'w': 0.4810888824141261, 'svgd_iters': 75, 'debt_weight': 0.8601307143040046, 'visit_sat': 0.5788760471067274, 'visit_halflife': 2.4189654342571743, 'phi_mode': 'density', 'n_particles': 128}. Best is trial 17 with value: 0.25338444922501435.
[I 2026-09-12 12:37:35,170] Trial 22 finished with value: 0.25788630230948856 and parameters: {'phi_model': 'mass', 'w': 0.44091149720356393, 'svgd_iters': 75, 'debt_weight': 0.883241534211873, 'visit_sat': 0.16582879718577556, 'visit_halflife': 4.202778611212754, 'phi_mode': 'density', 'n_particles': 128}. Best is trial 17 with value: 0.25338444922501435.
[I 2026-09-12 12:39:45,803] Trial 23 finished with value: 0.26845030017362753 and parameters: {'phi_model': 'mass', 'w': 0.43026038402671385, 'svgd_iters': 100, 'debt_weight': 0.9187081138279981, 'visit_sat': 0.32600053086174063, 'visit_halflife': 2.696203783208235, 'phi_mode': 'density', 'n_particles': 128}. Best is trial 17 with value: 0.25338444922501435.
[I 2026-09-12 12:40:08,458] Trial 24 pruned. 
[I 2026-09-12 12:42:18,334] Trial 25 finished with value: 0.2677823642007414 and parameters: {'phi_model': 'mass', 'w': 0.5427374017284285, 'svgd_iters': 100, 'debt_weight': 0.8733897926713095, 'visit_sat': 0.10270385840155928, 'visit_halflife': 2.960362375676948, 'phi_mode': 'density', 'n_particles': 128}. Best is trial 17 with value: 0.25338444922501435.
[I 2026-09-12 12:43:01,399] Trial 26 pruned. 
[I 2026-09-12 12:45:25,116] Trial 27 finished with value: 0.2713620197787874 and parameters: {'phi_model': 'mass', 'w': 0.6417867514733684, 'svgd_iters': 125, 'debt_weight': 0.7725627286265249, 'visit_sat': 0.7316013847486544, 'visit_halflife': 3.8141542026550956, 'phi_mode': 'density', 'n_particles': 128}. Best is trial 17 with value: 0.25338444922501435.
[I 2026-09-12 12:45:47,759] Trial 28 pruned. 
[I 2026-09-12 12:46:56,785] Trial 29 finished with value: 0.26623309046887056 and parameters: {'phi_model': 'mass', 'w': 0.6147470377683817, 'svgd_iters': 0, 'debt_weight': 0.9545078143049823, 'visit_sat': 0.6429333697261818, 'visit_halflife': 2.9379518108050235, 'phi_mode': 'density', 'n_particles': 128}. Best is trial 17 with value: 0.25338444922501435.
[I 2026-09-12 12:47:19,559] Trial 30 pruned. 
[I 2026-09-12 12:49:00,702] Trial 31 finished with value: 0.2627249504759791 and parameters: {'phi_model': 'mass', 'w': 0.3725901023520067, 'svgd_iters': 50, 'debt_weight': 0.9999940488486739, 'visit_sat': 0.28135448367934424, 'visit_halflife': 3.8509026969128106, 'phi_mode': 'density', 'n_particles': 128}. Best is trial 17 with value: 0.25338444922501435.
[I 2026-09-12 12:49:48,836] Trial 32 pruned. 
[I 2026-09-12 12:51:29,973] Trial 33 finished with value: 0.26236718273225434 and parameters: {'phi_model': 'mass', 'w': 0.7127042069598573, 'svgd_iters': 50, 'debt_weight': 0.9988952095013561, 'visit_sat': 0.3887760179292615, 'visit_halflife': 1.184797049501384, 'phi_mode': 'density', 'n_particles': 128}. Best is trial 17 with value: 0.25338444922501435.
[I 2026-09-12 12:51:57,881] Trial 34 pruned. 
[I 2026-09-12 12:53:22,458] Trial 35 finished with value: 0.2619152974911108 and parameters: {'phi_model': 'mass', 'w': 0.5158252594119705, 'svgd_iters': 25, 'debt_weight': 0.6485179359022768, 'visit_sat': 0.4143206250721681, 'visit_halflife': 4.148188733517624, 'phi_mode': 'density', 'n_particles': 128}. Best is trial 17 with value: 0.25338444922501435.
[I 2026-09-12 12:55:47,818] Trial 36 finished with value: 0.26840232458279073 and parameters: {'phi_model': 'mass', 'w': 0.5377756836811637, 'svgd_iters': 125, 'debt_weight': 0.7649713268882363, 'visit_sat': 0.5535011704610466, 'visit_halflife': 1.7849704072815038, 'phi_mode': 'density', 'n_particles': 128}. Best is trial 17 with value: 0.25338444922501435.
[I 2026-09-12 12:57:28,703] Trial 37 finished with value: 0.2588353381416165 and parameters: {'phi_model': 'mass', 'w': 0.4890788460558972, 'svgd_iters': 50, 'debt_weight': 0.8496305934190143, 'visit_sat': 0.4796304095482802, 'visit_halflife': 2.798438438020477, 'phi_mode': 'density', 'n_particles': 128}. Best is trial 17 with value: 0.25338444922501435.
[I 2026-09-12 12:58:16,701] Trial 38 pruned. 
[I 2026-09-12 13:00:41,369] Trial 39 finished with value: 0.2588172260707962 and parameters: {'phi_model': 'mass', 'w': 0.3282247758443032, 'svgd_iters': 125, 'debt_weight': 0.9871978387036874, 'visit_sat': 0.17502159695628258, 'visit_halflife': 3.222235314336186, 'phi_mode': 'density', 'n_particles': 128}. Best is trial 17 with value: 0.25338444922501435.
[I 2026-09-12 13:01:04,016] Trial 40 pruned. 
[I 2026-09-12 13:02:09,768] Trial 41 pruned. 
[I 2026-09-12 13:03:18,732] Trial 42 finished with value: 0.26060254566488006 and parameters: {'phi_model': 'mass', 'w': 0.3545568549349827, 'svgd_iters': 0, 'debt_weight': 0.8601908900274737, 'visit_sat': 0.4155038739572163, 'visit_halflife': 3.1448414779396923, 'phi_mode': 'density', 'n_particles': 128}. Best is trial 17 with value: 0.25338444922501435.
[I 2026-09-12 13:04:11,732] Trial 43 pruned. 
[I 2026-09-12 13:04:45,254] Trial 44 pruned. 
[I 2026-09-12 13:05:23,548] Trial 45 pruned. 
[I 2026-09-12 13:05:57,187] Trial 46 pruned. 
[I 2026-09-12 13:08:50,332] Trial 47 finished with value: 0.26442034728483843 and parameters: {'phi_model': 'mass', 'w': 0.36062004872980974, 'svgd_iters': 175, 'debt_weight': 0.9654540714165186, 'visit_sat': 0.2399411892178539, 'visit_halflife': 3.206045335888589, 'phi_mode': 'density', 'n_particles': 128}. Best is trial 17 with value: 0.25338444922501435.
[I 2026-09-12 13:11:00,577] Trial 48 finished with value: 0.2638683298720627 and parameters: {'phi_model': 'mass', 'w': 0.48242369716384415, 'svgd_iters': 100, 'debt_weight': 0.7598005131112493, 'visit_sat': 0.37846074880857034, 'visit_halflife': 3.6143676431898264, 'phi_mode': 'density', 'n_particles': 128}. Best is trial 17 with value: 0.25338444922501435.
[I 2026-09-12 13:11:28,471] Trial 49 pruned. 
[I 2026-09-12 13:13:08,589] Trial 50 finished with value: 0.26203566231988895 and parameters: {'phi_model': 'mass', 'w': 0.6083968797336878, 'svgd_iters': 50, 'debt_weight': 0.9947947259209269, 'visit_sat': 0.17213254759773533, 'visit_halflife': 4.410024109160689, 'phi_mode': 'density', 'n_particles': 128}. Best is trial 17 with value: 0.25338444922501435.
[I 2026-09-12 13:13:31,271] Trial 51 pruned. 
[I 2026-09-12 13:14:24,694] Trial 52 pruned. 
[I 2026-09-12 13:15:12,829] Trial 53 pruned. 
[I 2026-09-12 13:16:54,231] Trial 54 finished with value: 0.2542781078386874 and parameters: {'phi_model': 'mass', 'w': 0.4761938793313019, 'svgd_iters': 50, 'debt_weight': 0.8226055426706352, 'visit_sat': 0.6203483798377262, 'visit_halflife': 2.3820439875718704, 'phi_mode': 'density', 'n_particles': 128}. Best is trial 17 with value: 0.25338444922501435.
[I 2026-09-12 13:17:38,136] Trial 55 pruned. 
[I 2026-09-12 13:19:19,724] Trial 56 finished with value: 0.25059641055286747 and parameters: {'phi_model': 'mass', 'w': 0.326034843041937, 'svgd_iters': 50, 'debt_weight': 0.9277978294650603, 'visit_sat': 0.26409311056003887, 'visit_halflife': 5.324208353994486, 'phi_mode': 'density', 'n_particles': 128}. Best is trial 56 with value: 0.25059641055286747.
[I 2026-09-12 13:20:44,654] Trial 57 finished with value: 0.2582874920047277 and parameters: {'phi_model': 'mass', 'w': 0.417848554115195, 'svgd_iters': 25, 'debt_weight': 0.9261829308235209, 'visit_sat': 0.4522545161774315, 'visit_halflife': 1.807785913529719, 'phi_mode': 'density', 'n_particles': 128}. Best is trial 56 with value: 0.25059641055286747.
[I 2026-09-12 13:21:07,431] Trial 58 pruned. 
[I 2026-09-12 13:21:41,117] Trial 59 pruned. 
[I 2026-09-12 13:22:19,732] Trial 60 pruned. 
[I 2026-09-12 13:24:30,772] Trial 61 finished with value: 0.2624722984216485 and parameters: {'phi_model': 'mass', 'w': 0.43963580999026086, 'svgd_iters': 100, 'debt_weight': 0.8516992255964075, 'visit_sat': 0.2329943147805218, 'visit_halflife': 5.76253630821576, 'phi_mode': 'density', 'n_particles': 128}. Best is trial 56 with value: 0.25059641055286747.
[I 2026-09-12 13:26:26,443] Trial 62 finished with value: 0.2656817614673247 and parameters: {'phi_model': 'mass', 'w': 0.41494962948109215, 'svgd_iters': 75, 'debt_weight': 0.9873987781153852, 'visit_sat': 0.27709697078587325, 'visit_halflife': 5.231732736852492, 'phi_mode': 'density', 'n_particles': 128}. Best is trial 56 with value: 0.25059641055286747.
[I 2026-09-12 13:27:00,204] Trial 63 pruned. 
[I 2026-09-12 13:27:48,354] Trial 64 pruned. 
[I 2026-09-12 13:28:26,566] Trial 65 pruned. 
[I 2026-09-12 13:30:36,592] Trial 66 finished with value: 0.26368067812777446 and parameters: {'phi_model': 'mass', 'w': 0.45896331954104214, 'svgd_iters': 100, 'debt_weight': 0.9666335151070997, 'visit_sat': 0.15830787562615042, 'visit_halflife': 3.5005736237040384, 'phi_mode': 'density', 'n_particles': 128}. Best is trial 56 with value: 0.25059641055286747.
[I 2026-09-12 13:32:17,590] Trial 67 finished with value: 0.25491029015195316 and parameters: {'phi_model': 'mass', 'w': 0.22911334918238813, 'svgd_iters': 50, 'debt_weight': 0.9265208155857401, 'visit_sat': 0.17161410657106274, 'visit_halflife': 3.1418170545835618, 'phi_mode': 'density', 'n_particles': 128}. Best is trial 56 with value: 0.25059641055286747.
[I 2026-09-12 13:32:56,325] Trial 68 pruned. 
[I 2026-09-12 13:34:21,004] Trial 69 finished with value: 0.25421377039421195 and parameters: {'phi_model': 'mass', 'w': 0.2750686015684053, 'svgd_iters': 25, 'debt_weight': 0.9970279176767857, 'visit_sat': 0.24825480626674606, 'visit_halflife': 2.15548763056957, 'phi_mode': 'density', 'n_particles': 128}. Best is trial 56 with value: 0.25059641055286747.
[I 2026-09-12 13:35:45,505] Trial 70 finished with value: 0.25583478384775804 and parameters: {'phi_model': 'mass', 'w': 0.28180353111961703, 'svgd_iters': 25, 'debt_weight': 0.9402078237080705, 'visit_sat': 0.14326924082592796, 'visit_halflife': 1.5581747799924268, 'phi_mode': 'density', 'n_particles': 128}. Best is trial 56 with value: 0.25059641055286747.
[I 2026-09-12 13:36:08,300] Trial 71 pruned. 
[I 2026-09-12 13:36:36,320] Trial 72 pruned. 
[I 2026-09-12 13:37:14,773] Trial 73 pruned. 
[I 2026-09-12 13:37:53,386] Trial 74 pruned. 
[I 2026-09-12 13:38:21,413] Trial 75 pruned. 
[I 2026-09-12 13:38:55,004] Trial 76 pruned. 
[I 2026-09-12 13:39:22,948] Trial 77 pruned. 
[I 2026-09-12 13:40:47,821] Trial 78 finished with value: 0.25915319221756866 and parameters: {'phi_model': 'mass', 'w': 0.2978664870187282, 'svgd_iters': 25, 'debt_weight': 0.985392831366592, 'visit_sat': 0.11747616746400594, 'visit_halflife': 2.092813883543067, 'phi_mode': 'density', 'n_particles': 128}. Best is trial 56 with value: 0.25059641055286747.
[I 2026-09-12 13:41:10,611] Trial 79 pruned. 
[I 2026-09-12 13:42:52,063] Trial 80 finished with value: 0.2553759716579249 and parameters: {'phi_model': 'mass', 'w': 0.26181178238740127, 'svgd_iters': 50, 'debt_weight': 0.9877783307693982, 'visit_sat': 0.22061490988400806, 'visit_halflife': 0.7401890018135522, 'phi_mode': 'density', 'n_particles': 128}. Best is trial 56 with value: 0.25059641055286747.
[I 2026-09-12 13:43:14,832] Trial 81 pruned. 
[I 2026-09-12 13:43:48,695] Trial 82 pruned. 
[I 2026-09-12 13:45:13,549] Trial 83 finished with value: 0.25445013843515635 and parameters: {'phi_model': 'mass', 'w': 0.29306997757976505, 'svgd_iters': 25, 'debt_weight': 0.8593962881379797, 'visit_sat': 0.3652902272793944, 'visit_halflife': 2.785822212112831, 'phi_mode': 'density', 'n_particles': 128}. Best is trial 56 with value: 0.25059641055286747.
[I 2026-09-12 13:45:41,538] Trial 84 pruned. 
[I 2026-09-12 13:47:06,381] Trial 85 finished with value: 0.25888033775444097 and parameters: {'phi_model': 'mass', 'w': 0.289106090117046, 'svgd_iters': 25, 'debt_weight': 0.9612048951123927, 'visit_sat': 0.342974671184536, 'visit_halflife': 1.7925827108725392, 'phi_mode': 'density', 'n_particles': 128}. Best is trial 56 with value: 0.25059641055286747.
[I 2026-09-12 13:49:02,039] Trial 86 finished with value: 0.2560995348740503 and parameters: {'phi_model': 'mass', 'w': 0.33054819636113336, 'svgd_iters': 75, 'debt_weight': 0.9993218246627102, 'visit_sat': 0.21182051753203113, 'visit_halflife': 1.561557524222661, 'phi_mode': 'density', 'n_particles': 128}. Best is trial 56 with value: 0.25059641055286747.
[I 2026-09-12 13:49:24,805] Trial 87 pruned. 
[I 2026-09-12 13:51:20,488] Trial 88 finished with value: 0.26154049338170104 and parameters: {'phi_model': 'mass', 'w': 0.699649968160139, 'svgd_iters': 75, 'debt_weight': 0.9943345158170486, 'visit_sat': 0.2054557250625065, 'visit_halflife': 0.7309233000760134, 'phi_mode': 'density', 'n_particles': 128}. Best is trial 56 with value: 0.25059641055286747.
[I 2026-09-12 13:51:48,549] Trial 89 pruned. 
[I 2026-09-12 13:52:16,531] Trial 90 pruned. 
[I 2026-09-12 13:53:58,039] Trial 91 finished with value: 0.2526353289897275 and parameters: {'phi_model': 'mass', 'w': 0.3749067032949927, 'svgd_iters': 50, 'debt_weight': 0.9845788377551035, 'visit_sat': 0.2153693771994448, 'visit_halflife': 1.8557836794489435, 'phi_mode': 'density', 'n_particles': 128}. Best is trial 56 with value: 0.25059641055286747.
[I 2026-09-12 13:54:26,182] Trial 92 pruned. 
[I 2026-09-12 13:54:59,719] Trial 93 pruned. 
[I 2026-09-12 13:56:02,605] Trial 94 pruned. 
[I 2026-09-12 13:56:41,073] Trial 95 pruned. 
[I 2026-09-12 13:57:14,796] Trial 96 pruned. 
[I 2026-09-12 13:58:12,424] Trial 97 pruned. 
[I 2026-09-12 14:00:23,037] Trial 98 finished with value: 0.2581131195213917 and parameters: {'phi_model': 'mass', 'w': 0.3876455118704941, 'svgd_iters': 100, 'debt_weight': 0.9061659703165319, 'visit_sat': 0.1758474653712089, 'visit_halflife': 1.3362371001393847, 'phi_mode': 'density', 'n_particles': 128}. Best is trial 56 with value: 0.25059641055286747.
[I 2026-09-12 14:01:47,779] Trial 99 finished with value: 0.2548464407420769 and parameters: {'phi_model': 'mass', 'w': 0.3471670339792877, 'svgd_iters': 25, 'debt_weight': 0.9331687609109636, 'visit_sat': 0.25493240254657756, 'visit_halflife': 1.4450530855858221, 'phi_mode': 'density', 'n_particles': 128}. Best is trial 56 with value: 0.25059641055286747.
[I 2026-09-12 14:03:12,601] Trial 100 finished with value: 0.2565114005869134 and parameters: {'phi_model': 'mass', 'w': 0.35532090620493173, 'svgd_iters': 25, 'debt_weight': 0.9766264364618076, 'visit_sat': 0.1176246404206929, 'visit_halflife': 1.078402194629046, 'phi_mode': 'density', 'n_particles': 128}. Best is trial 56 with value: 0.25059641055286747.
[I 2026-09-12 14:03:35,444] Trial 101 pruned. 
[I 2026-09-12 14:03:58,275] Trial 102 pruned. 
[I 2026-09-12 14:04:26,268] Trial 103 pruned. 
[I 2026-09-12 14:06:07,996] Trial 104 finished with value: 0.26030788029605706 and parameters: {'phi_model': 'mass', 'w': 0.3900416915691653, 'svgd_iters': 50, 'debt_weight': 0.907250073516781, 'visit_sat': 0.29443256188288175, 'visit_halflife': 1.6498854287274507, 'phi_mode': 'density', 'n_particles': 128}. Best is trial 56 with value: 0.25059641055286747.
