[I 2026-09-14 19:51:00,497] Trial 314 pruned. 
[I 2026-09-14 19:54:28,922] Trial 315 finished with value: 0.25900524888640036 and parameters: {'phi_model': 'eid', 'kappa': 1.9881746283457002, 'svgd_iters': 0, 'debt_weight': 0.8703008578823265, 'visit_sat': 0.39817614886338015, 'visit_halflife': 2.5665035652586066, 'phi_mode': 'quantile', 'n_particles': 128, 'phi_quantile': 0.35005144780840414, 'gp_lengthscale': 0.12231936768283225, 'gp_noise': 0.049937108058741214, 'cfg_weight': 1.2534399968348233}. Best is trial 276 with value: 0.25683753145087285.
[I 2026-09-14 19:57:57,284] Trial 316 pruned. 
[I 2026-09-14 20:01:25,689] Trial 317 finished with value: 0.2611900006514219 and parameters: {'phi_model': 'eid', 'kappa': 1.910440773534237, 'svgd_iters': 0, 'debt_weight': 0.8004853557366299, 'visit_sat': 0.3280584618460787, 'visit_halflife': 3.6870997262847527, 'phi_mode': 'quantile', 'n_particles': 128, 'phi_quantile': 0.3504159574278425, 'gp_lengthscale': 0.11359691652905354, 'gp_noise': 0.046624692687194914, 'cfg_weight': 1.194264110828061}. Best is trial 276 with value: 0.25683753145087285.
[I 2026-09-14 20:02:35,304] Trial 318 pruned. 
[I 2026-09-14 20:03:44,901] Trial 319 pruned. 
[I 2026-09-14 20:07:13,379] Trial 320 finished with value: 0.2581423117681824 and parameters: {'phi_model': 'eid', 'kappa': 2.3378677984136873, 'svgd_iters': 0, 'debt_weight': 0.8623773423854133, 'visit_sat': 0.3991653201566485, 'visit_halflife': 2.7274576639965704, 'phi_mode': 'quantile', 'n_particles': 128, 'phi_quantile': 0.2990406093407929, 'gp_lengthscale': 0.1017164121325024, 'gp_noise': 0.05019407102022167, 'cfg_weight': 1.1634650399086268}. Best is trial 276 with value: 0.25683753145087285.
[I 2026-09-14 20:08:23,013] Trial 321 pruned. 
[I 2026-09-14 20:08:46,007] Trial 322 pruned. 
[I 2026-09-14 20:12:14,435] Trial 323 finished with value: 0.26003256580125983 and parameters: {'phi_model': 'eid', 'kappa': 2.1712754306299753, 'svgd_iters': 0, 'debt_weight': 0.8780208936965109, 'visit_sat': 0.38340418459282677, 'visit_halflife': 2.3937740958664206, 'phi_mode': 'quantile', 'n_particles': 128, 'phi_quantile': 0.3149280144563324, 'gp_lengthscale': 0.1281239612915393, 'gp_noise': 0.051004559066653285, 'cfg_weight': 1.2514822676416417}. Best is trial 276 with value: 0.25683753145087285.
[I 2026-09-14 20:15:42,872] Trial 324 finished with value: 0.2562866829471217 and parameters: {'phi_model': 'eid', 'kappa': 2.3113190528763354, 'svgd_iters': 0, 'debt_weight': 0.9456513477102995, 'visit_sat': 0.49174903118279706, 'visit_halflife': 2.3499610499351906, 'phi_mode': 'quantile', 'n_particles': 128, 'phi_quantile': 0.36386056215606155, 'gp_lengthscale': 0.12088762697255029, 'gp_noise': 0.05770905483575836, 'cfg_weight': 1.2503316288202628}. Best is trial 324 with value: 0.2562866829471217.
[I 2026-09-14 20:19:11,229] Trial 325 pruned. 
[I 2026-09-14 20:22:39,633] Trial 326 finished with value: 0.2580666274319461 and parameters: {'phi_model': 'eid', 'kappa': 2.3756929547083705, 'svgd_iters': 0, 'debt_weight': 0.9503283996314557, 'visit_sat': 0.4179438698441402, 'visit_halflife': 2.2247146451109314, 'phi_mode': 'quantile', 'n_particles': 128, 'phi_quantile': 0.28083702564191704, 'gp_lengthscale': 0.11848723661750585, 'gp_noise': 0.04890641519715064, 'cfg_weight': 1.2222037287810101}. Best is trial 324 with value: 0.2562866829471217.
[I 2026-09-14 20:26:08,047] Trial 327 finished with value: 0.26024073247565666 and parameters: {'phi_model': 'eid', 'kappa': 2.6924821684024827, 'svgd_iters': 0, 'debt_weight': 0.9424324560529754, 'visit_sat': 0.5045030265597238, 'visit_halflife': 2.392677229553703, 'phi_mode': 'quantile', 'n_particles': 128, 'phi_quantile': 0.2783371208328033, 'gp_lengthscale': 0.10959989711801943, 'gp_noise': 0.0625135034641979, 'cfg_weight': 1.2498344480607788}. Best is trial 324 with value: 0.2562866829471217.
[I 2026-09-14 20:29:36,406] Trial 328 pruned. 
[I 2026-09-14 20:33:04,880] Trial 329 finished with value: 0.25831775907248195 and parameters: {'phi_model': 'eid', 'kappa': 3.063980402803779, 'svgd_iters': 0, 'debt_weight': 0.9138629702576775, 'visit_sat': 0.5444965608812158, 'visit_halflife': 2.658333701109346, 'phi_mode': 'quantile', 'n_particles': 128, 'phi_quantile': 0.36135511036959156, 'gp_lengthscale': 0.1282820137998124, 'gp_noise': 0.06141212944394816, 'cfg_weight': 1.2170469668561448}. Best is trial 324 with value: 0.2562866829471217.
[I 2026-09-14 20:36:33,321] Trial 330 finished with value: 0.2578721482182041 and parameters: {'phi_model': 'eid', 'kappa': 3.4851418713394753, 'svgd_iters': 0, 'debt_weight': 0.9735502076931755, 'visit_sat': 0.4842855397945162, 'visit_halflife': 1.7826884729936807, 'phi_mode': 'quantile', 'n_particles': 128, 'phi_quantile': 0.3307309744983447, 'gp_lengthscale': 0.1385883216642073, 'gp_noise': 0.057368895589126404, 'cfg_weight': 1.165438114019251}. Best is trial 324 with value: 0.2562866829471217.
[I 2026-09-14 20:37:42,943] Trial 331 pruned. 
[I 2026-09-14 20:41:11,380] Trial 332 finished with value: 0.25860443402804095 and parameters: {'phi_model': 'eid', 'kappa': 3.8167127599062005, 'svgd_iters': 0, 'debt_weight': 0.979658602237706, 'visit_sat': 0.4788679880874819, 'visit_halflife': 2.4221666613837938, 'phi_mode': 'quantile', 'n_particles': 128, 'phi_quantile': 0.32814544797124023, 'gp_lengthscale': 0.14675712521741685, 'gp_noise': 0.06356701153766775, 'cfg_weight': 1.1913868079545926}. Best is trial 324 with value: 0.2562866829471217.
[I 2026-09-14 20:44:39,752] Trial 333 pruned. 
[I 2026-09-14 20:48:08,155] Trial 334 finished with value: 0.2578578220401324 and parameters: {'phi_model': 'eid', 'kappa': 3.7031242547239653, 'svgd_iters': 0, 'debt_weight': 0.8598199821331426, 'visit_sat': 0.49492923471843214, 'visit_halflife': 2.199396953848756, 'phi_mode': 'quantile', 'n_particles': 128, 'phi_quantile': 0.32151287222461566, 'gp_lengthscale': 0.11878715572365642, 'gp_noise': 0.06420878891291501, 'cfg_weight': 1.0288527603744149}. Best is trial 324 with value: 0.2562866829471217.
[I 2026-09-14 20:51:36,525] Trial 335 finished with value: 0.2605836750375142 and parameters: {'phi_model': 'eid', 'kappa': 4.065742134685068, 'svgd_iters': 0, 'debt_weight': 0.8865223609516961, 'visit_sat': 0.5525440648650766, 'visit_halflife': 2.8316925835307205, 'phi_mode': 'quantile', 'n_particles': 128, 'phi_quantile': 0.31644289877243476, 'gp_lengthscale': 0.12497874522993285, 'gp_noise': 0.061212466819079145, 'cfg_weight': 1.277853527122408}. Best is trial 324 with value: 0.2562866829471217.
[I 2026-09-14 20:52:46,124] Trial 336 pruned. 
[I 2026-09-14 20:53:09,101] Trial 337 pruned. 
[I 2026-09-14 20:53:32,084] Trial 338 pruned. 
[I 2026-09-14 20:54:41,684] Trial 339 pruned. 
[I 2026-09-14 20:58:10,012] Trial 340 pruned. 
[I 2026-09-14 21:01:38,381] Trial 341 pruned. 
[I 2026-09-14 21:02:01,360] Trial 342 pruned. 
[I 2026-09-14 21:02:24,342] Trial 343 pruned. 
[I 2026-09-14 21:03:33,940] Trial 344 pruned. 
[I 2026-09-14 21:03:56,906] Trial 345 pruned. 
[I 2026-09-14 21:04:19,885] Trial 346 pruned. 
[I 2026-09-14 21:07:48,228] Trial 347 pruned. 
[I 2026-09-14 21:08:57,834] Trial 348 pruned. 
[I 2026-09-14 21:09:20,810] Trial 349 pruned. 
[I 2026-09-14 21:12:49,142] Trial 350 pruned. 
[I 2026-09-14 21:13:12,124] Trial 351 pruned. 
[I 2026-09-14 21:13:35,105] Trial 352 pruned. 
[I 2026-09-14 21:17:03,471] Trial 353 pruned. 
[I 2026-09-14 21:17:26,458] Trial 354 pruned. 
[I 2026-09-14 21:20:54,884] Trial 355 finished with value: 0.25998153769333504 and parameters: {'phi_model': 'eid', 'kappa': 4.3204287674008786, 'svgd_iters': 0, 'debt_weight': 0.9185272362855941, 'visit_sat': 0.476648495135191, 'visit_halflife': 3.1400849059359923, 'phi_mode': 'quantile', 'n_particles': 128, 'phi_quantile': 0.30642506581315565, 'gp_lengthscale': 0.11613520743860949, 'gp_noise': 0.060516084067418256, 'cfg_weight': 1.1108997669853138}. Best is trial 324 with value: 0.2562866829471217.
[I 2026-09-14 21:21:17,867] Trial 356 pruned. 
[I 2026-09-14 21:24:46,323] Trial 357 finished with value: 0.2593675358968674 and parameters: {'phi_model': 'eid', 'kappa': 2.5872834003232543, 'svgd_iters': 0, 'debt_weight': 0.9205469387268914, 'visit_sat': 0.542373751786717, 'visit_halflife': 2.16996722273301, 'phi_mode': 'quantile', 'n_particles': 128, 'phi_quantile': 0.3550917103994556, 'gp_lengthscale': 0.12606130160597057, 'gp_noise': 0.056228262735980666, 'cfg_weight': 1.1098310641023768}. Best is trial 324 with value: 0.2562866829471217.
[I 2026-09-14 21:28:14,647] Trial 358 pruned. 
[I 2026-09-14 21:29:24,244] Trial 359 pruned. 
[I 2026-09-14 21:32:52,673] Trial 360 finished with value: 0.2591540138690875 and parameters: {'phi_model': 'eid', 'kappa': 1.6281393237288493, 'svgd_iters': 0, 'debt_weight': 0.8108795094410682, 'visit_sat': 0.4288234672825879, 'visit_halflife': 2.6795733769889347, 'phi_mode': 'quantile', 'n_particles': 128, 'phi_quantile': 0.3223003757728339, 'gp_lengthscale': 0.1064534866896315, 'gp_noise': 0.053742819868364655, 'cfg_weight': 1.122567464658283}. Best is trial 324 with value: 0.2562866829471217.
[I 2026-09-14 21:36:21,104] Trial 361 finished with value: 0.258079075985561 and parameters: {'phi_model': 'eid', 'kappa': 2.3382519105370236, 'svgd_iters': 0, 'debt_weight': 0.9981944441729588, 'visit_sat': 0.43375053253996204, 'visit_halflife': 1.5586948027096879, 'phi_mode': 'quantile', 'n_particles': 128, 'phi_quantile': 0.7235644282001612, 'gp_lengthscale': 0.14970526654036662, 'gp_noise': 0.05916980484454359, 'cfg_weight': 1.1757994670833387}. Best is trial 324 with value: 0.2562866829471217.
[I 2026-09-14 21:37:30,736] Trial 362 pruned. 
[I 2026-09-14 21:37:53,720] Trial 363 pruned. 
[I 2026-09-14 21:41:22,148] Trial 364 finished with value: 0.25601826709156156 and parameters: {'phi_model': 'eid', 'kappa': 2.099635519990762, 'svgd_iters': 0, 'debt_weight': 0.9094434788909178, 'visit_sat': 0.436887251462361, 'visit_halflife': 3.5545471466519465, 'phi_mode': 'quantile', 'n_particles': 128, 'phi_quantile': 0.8153937237901161, 'gp_lengthscale': 0.10104197586701891, 'gp_noise': 0.04774162675639781, 'cfg_weight': 1.0372766986950022}. Best is trial 364 with value: 0.25601826709156156.
[I 2026-09-14 21:44:50,590] Trial 365 finished with value: 0.26087198744538237 and parameters: {'phi_model': 'eid', 'kappa': 2.1158813512383774, 'svgd_iters': 0, 'debt_weight': 0.9685214835464281, 'visit_sat': 0.430895678915877, 'visit_halflife': 3.533242798317055, 'phi_mode': 'quantile', 'n_particles': 128, 'phi_quantile': 0.8554324195431205, 'gp_lengthscale': 0.10984934226152429, 'gp_noise': 0.038090043442688536, 'cfg_weight': 1.0119256820201163}. Best is trial 364 with value: 0.25601826709156156.
[I 2026-09-14 21:45:13,587] Trial 366 pruned. 
[I 2026-09-14 21:48:42,008] Trial 367 finished with value: 0.2584295202670153 and parameters: {'phi_model': 'eid', 'kappa': 2.4586866829961758, 'svgd_iters': 0, 'debt_weight': 0.9800339163769469, 'visit_sat': 0.5193569445260048, 'visit_halflife': 2.106428794711705, 'phi_mode': 'quantile', 'n_particles': 128, 'phi_quantile': 0.8864853404389749, 'gp_lengthscale': 0.12631251168893587, 'gp_noise': 0.05939701806425156, 'cfg_weight': 1.3040156622628674}. Best is trial 364 with value: 0.25601826709156156.
[I 2026-09-14 21:52:10,415] Trial 368 finished with value: 0.260826435668638 and parameters: {'phi_model': 'eid', 'kappa': 2.237902514835824, 'svgd_iters': 0, 'debt_weight': 0.9851328609542337, 'visit_sat': 0.5163298313139594, 'visit_halflife': 1.9539595031518118, 'phi_mode': 'quantile', 'n_particles': 128, 'phi_quantile': 0.8613982079911315, 'gp_lengthscale': 0.12114022829986833, 'gp_noise': 0.0568683093092005, 'cfg_weight': 1.2575445911108343}. Best is trial 364 with value: 0.25601826709156156.
[I 2026-09-14 21:55:38,789] Trial 369 finished with value: 0.2583455090073042 and parameters: {'phi_model': 'eid', 'kappa': 2.604707309347591, 'svgd_iters': 0, 'debt_weight': 0.9534440412218503, 'visit_sat': 0.4939659414868917, 'visit_halflife': 1.7007370806203432, 'phi_mode': 'quantile', 'n_particles': 128, 'phi_quantile': 0.2784980928623169, 'gp_lengthscale': 0.12919350216035105, 'gp_noise': 0.05641624145329099, 'cfg_weight': 1.096599944362803}. Best is trial 364 with value: 0.25601826709156156.
[I 2026-09-14 21:56:01,764] Trial 370 pruned. 
[I 2026-09-14 21:56:24,740] Trial 371 pruned. 
[I 2026-09-14 21:59:53,145] Trial 372 finished with value: 0.25890684340724773 and parameters: {'phi_model': 'eid', 'kappa': 2.086790189625709, 'svgd_iters': 0, 'debt_weight': 0.9262881802256295, 'visit_sat': 0.4908876288579465, 'visit_halflife': 1.5141978560756428, 'phi_mode': 'quantile', 'n_particles': 128, 'phi_quantile': 0.2544026275107229, 'gp_lengthscale': 0.1290804472501804, 'gp_noise': 0.05142577744353014, 'cfg_weight': 1.1264137352819357}. Best is trial 364 with value: 0.25601826709156156.
[I 2026-09-14 22:03:21,537] Trial 373 finished with value: 0.258845901887823 and parameters: {'phi_model': 'eid', 'kappa': 2.061203320427054, 'svgd_iters': 0, 'debt_weight': 0.9587821493268485, 'visit_sat': 0.4041214645378745, 'visit_halflife': 3.6960133539425035, 'phi_mode': 'quantile', 'n_particles': 128, 'phi_quantile': 0.7390778697120659, 'gp_lengthscale': 0.09877918988614953, 'gp_noise': 0.05459581461137211, 'cfg_weight': 1.0739314015495371}. Best is trial 364 with value: 0.25601826709156156.
[I 2026-09-14 22:03:44,521] Trial 374 pruned. 
[I 2026-09-14 22:04:07,499] Trial 375 pruned. 
[I 2026-09-14 22:07:35,905] Trial 376 finished with value: 0.2601036989490561 and parameters: {'phi_model': 'eid', 'kappa': 2.229761768971441, 'svgd_iters': 0, 'debt_weight': 0.9821115973222584, 'visit_sat': 0.37959620595482074, 'visit_halflife': 1.7778750780699593, 'phi_mode': 'quantile', 'n_particles': 128, 'phi_quantile': 0.27668214299707, 'gp_lengthscale': 0.14662718684990747, 'gp_noise': 0.05913179285864142, 'cfg_weight': 1.31115086062757}. Best is trial 364 with value: 0.25601826709156156.
[I 2026-09-14 22:11:04,262] Trial 377 pruned. 
[I 2026-09-14 22:14:32,680] Trial 378 finished with value: 0.257003295196167 and parameters: {'phi_model': 'eid', 'kappa': 2.345238140525804, 'svgd_iters': 0, 'debt_weight': 0.9507719261962787, 'visit_sat': 0.5533554640694595, 'visit_halflife': 1.6935104898177997, 'phi_mode': 'quantile', 'n_particles': 128, 'phi_quantile': 0.8523869390996476, 'gp_lengthscale': 0.1397464878252963, 'gp_noise': 0.058685557665406764, 'cfg_weight': 1.1038016267965454}. Best is trial 364 with value: 0.25601826709156156.
[I 2026-09-14 22:18:01,085] Trial 379 finished with value: 0.2584871827406019 and parameters: {'phi_model': 'eid', 'kappa': 2.3742145187216797, 'svgd_iters': 0, 'debt_weight': 0.9120200582988987, 'visit_sat': 0.5629234469414375, 'visit_halflife': 1.7439912575914052, 'phi_mode': 'quantile', 'n_particles': 128, 'phi_quantile': 0.8317974277559258, 'gp_lengthscale': 0.14111029664095823, 'gp_noise': 0.06783831366543697, 'cfg_weight': 1.1715022989149377}. Best is trial 364 with value: 0.25601826709156156.
[I 2026-09-14 22:21:29,503] Trial 380 finished with value: 0.2591840215680908 and parameters: {'phi_model': 'eid', 'kappa': 2.417940792603241, 'svgd_iters': 0, 'debt_weight': 0.88649147217484, 'visit_sat': 0.48792217659693526, 'visit_halflife': 2.1425477150366676, 'phi_mode': 'quantile', 'n_particles': 128, 'phi_quantile': 0.8981695939482707, 'gp_lengthscale': 0.11866611363549479, 'gp_noise': 0.05919710052054987, 'cfg_weight': 1.166749754082334}. Best is trial 364 with value: 0.25601826709156156.
[I 2026-09-14 22:22:39,104] Trial 381 pruned. 
[I 2026-09-14 22:26:07,477] Trial 382 pruned. 
[I 2026-09-14 22:29:35,940] Trial 383 finished with value: 0.25786031086001454 and parameters: {'phi_model': 'eid', 'kappa': 2.9544582868712217, 'svgd_iters': 0, 'debt_weight': 0.9878529600019481, 'visit_sat': 0.5708490032096852, 'visit_halflife': 2.6105766429243604, 'phi_mode': 'quantile', 'n_particles': 128, 'phi_quantile': 0.2839264349183777, 'gp_lengthscale': 0.12727229174105545, 'gp_noise': 0.06071857166156972, 'cfg_weight': 1.295612397259323}. Best is trial 364 with value: 0.25601826709156156.
[I 2026-09-14 22:30:45,543] Trial 384 pruned. 
[I 2026-09-14 22:34:13,950] Trial 385 pruned. 
[I 2026-09-14 22:37:42,364] Trial 386 pruned. 
[I 2026-09-14 22:38:52,007] Trial 387 pruned. 
[I 2026-09-14 22:42:20,472] Trial 388 finished with value: 0.25851208199972103 and parameters: {'phi_model': 'eid', 'kappa': 1.8868735480804355, 'svgd_iters': 0, 'debt_weight': 0.9994158040637051, 'visit_sat': 0.5887751722402951, 'visit_halflife': 2.0308120691879035, 'phi_mode': 'quantile', 'n_particles': 128, 'phi_quantile': 0.8394220372937098, 'gp_lengthscale': 0.12607248578119726, 'gp_noise': 0.05543762902973166, 'cfg_weight': 1.3512495899958528}. Best is trial 364 with value: 0.25601826709156156.
[I 2026-09-14 22:43:30,095] Trial 389 pruned. 
[I 2026-09-14 22:46:58,548] Trial 390 finished with value: 0.25974886867156016 and parameters: {'phi_model': 'eid', 'kappa': 1.5438216362966812, 'svgd_iters': 0, 'debt_weight': 0.9304634267799246, 'visit_sat': 0.5392294421518129, 'visit_halflife': 2.572688459937782, 'phi_mode': 'quantile', 'n_particles': 128, 'phi_quantile': 0.2969790194881848, 'gp_lengthscale': 0.12923129409338668, 'gp_noise': 0.06524004835720257, 'cfg_weight': 1.0330204872598205}. Best is trial 364 with value: 0.25601826709156156.
[I 2026-09-14 22:50:26,936] Trial 391 pruned. 
[I 2026-09-14 22:50:49,937] Trial 392 pruned. 
[I 2026-09-14 22:51:12,923] Trial 393 pruned. 
[I 2026-09-14 22:54:41,368] Trial 394 finished with value: 0.2602463917263423 and parameters: {'phi_model': 'eid', 'kappa': 1.4594030216735523, 'svgd_iters': 0, 'debt_weight': 0.8989641474282472, 'visit_sat': 0.3956342972986833, 'visit_halflife': 3.615500503731259, 'phi_mode': 'quantile', 'n_particles': 128, 'phi_quantile': 0.6866430694622334, 'gp_lengthscale': 0.08567512970203076, 'gp_noise': 0.046015571724555906, 'cfg_weight': 1.4200143512896795}. Best is trial 364 with value: 0.25601826709156156.
[I 2026-09-14 22:58:09,755] Trial 395 pruned. 
[I 2026-09-14 23:01:38,116] Trial 396 pruned. 
[I 2026-09-14 23:05:06,503] Trial 397 pruned. 
[I 2026-09-14 23:08:34,916] Trial 398 finished with value: 0.2587156397659751 and parameters: {'phi_model': 'eid', 'kappa': 3.8347475284376795, 'svgd_iters': 0, 'debt_weight': 0.9678726461107522, 'visit_sat': 0.582028973526716, 'visit_halflife': 2.607572093995695, 'phi_mode': 'quantile', 'n_particles': 128, 'phi_quantile': 0.24789749662128563, 'gp_lengthscale': 0.11698295447103392, 'gp_noise': 0.055303216914209564, 'cfg_weight': 1.1728753718130935}. Best is trial 364 with value: 0.25601826709156156.
[I 2026-09-14 23:12:03,286] Trial 399 finished with value: 0.2606234952060195 and parameters: {'phi_model': 'eid', 'kappa': 3.1332462143804016, 'svgd_iters': 0, 'debt_weight': 0.9307248338272858, 'visit_sat': 0.43827671105494653, 'visit_halflife': 1.7636090461966556, 'phi_mode': 'quantile', 'n_particles': 128, 'phi_quantile': 0.3401230083782517, 'gp_lengthscale': 0.1560863567039088, 'gp_noise': 0.05869850107539943, 'cfg_weight': 1.0206668321310002}. Best is trial 364 with value: 0.25601826709156156.
[I 2026-09-14 23:15:31,673] Trial 400 finished with value: 0.25999617871562025 and parameters: {'phi_model': 'eid', 'kappa': 1.3874710159295804, 'svgd_iters': 0, 'debt_weight': 0.9361886150899038, 'visit_sat': 0.6101674095904637, 'visit_halflife': 2.804405984545378, 'phi_mode': 'quantile', 'n_particles': 128, 'phi_quantile': 0.2869403489904282, 'gp_lengthscale': 0.1315815348467333, 'gp_noise': 0.06199816371264497, 'cfg_weight': 1.197075800992287}. Best is trial 364 with value: 0.25601826709156156.
[I 2026-09-14 23:16:41,277] Trial 401 pruned. 
[I 2026-09-14 23:17:50,886] Trial 402 pruned. 
[I 2026-09-14 23:19:00,484] Trial 403 pruned. 
[I 2026-09-14 23:22:28,900] Trial 404 finished with value: 0.2595064971522691 and parameters: {'phi_model': 'eid', 'kappa': 1.4405929044730195, 'svgd_iters': 0, 'debt_weight': 0.9442287021040531, 'visit_sat': 0.4145943071453926, 'visit_halflife': 3.3851307441408074, 'phi_mode': 'quantile', 'n_particles': 128, 'phi_quantile': 0.3105329422285271, 'gp_lengthscale': 0.11840832773016331, 'gp_noise': 0.05778760566000763, 'cfg_weight': 1.224059526747425}. Best is trial 364 with value: 0.25601826709156156.
[I 2026-09-14 23:25:57,302] Trial 405 finished with value: 0.25758461213067435 and parameters: {'phi_model': 'eid', 'kappa': 3.566255581745643, 'svgd_iters': 0, 'debt_weight': 0.9011214616737693, 'visit_sat': 0.4193853354949956, 'visit_halflife': 4.008621719310335, 'phi_mode': 'quantile', 'n_particles': 128, 'phi_quantile': 0.49410742526114976, 'gp_lengthscale': 0.09572348492953328, 'gp_noise': 0.04691848677623423, 'cfg_weight': 1.0174369591846733}. Best is trial 364 with value: 0.25601826709156156.
[I 2026-09-14 23:27:06,906] Trial 406 pruned. 
C:\Users\Philipp\Documents\Uni\Master_Thesis\Master_thesis_ergodic_learning\thesis_architecture\exploration_optimierung\optuna_search.py:525: ExperimentalWarning: Argument ``group`` is an experimental feature. The interface can change in the future.
  sampler=optuna.samplers.TPESampler(
[I 2026-09-15 09:15:56,617] Using an existing study with `study_name='ideal_v2'` instead of creating a new one.
  1 verwaiste(r) Versuch(e) aus einem frueheren Abbruch gefunden, 1 als FAIL markiert.

======================================================================
  Optuna-Suche  study=ideal_v2  space=ideal
  bereits in der Datenbank: 408 Versuche
  dieser Aufruf: +5000 Versuche, Deckel 16.5h
  n_max=12  n_shapes=25  quality=cov
  Rollout-Seeds je Versuch: 3   Sampler-Seed: 0
  Hyperband: Sprossen 4 -> ... -> 36 Runden (Faktor 3)
  erste 50 Versuche zufaellig (= Kontrollgruppe)
  immer fest: {'sensor_radius': 0.06, 'meas_noise': 0.02}
  Strg+C haelt nach dem laufenden Versuch an (nichts geht verloren).
======================================================================

  25 Formen geladen, Planer bereit

  SVGD-Pool mit 10 Prozessen

