C:\Users\Philipp\Documents\Uni\Master_Thesis\Master_thesis_ergodic_learning\thesis_architecture\exploration_optimierung\optuna_search.py:498: ExperimentalWarning: Argument ``group`` is an experimental feature. The interface can change in the future.
  sampler=optuna.samplers.TPESampler(seed=a.seed, multivariate=True,
[I 2026-09-12 15:35:22,746] A new study created in RDB with name: ideal_v1
[I 2026-09-12 15:54:19,719] Trial 0 finished with value: 0.3306746933323132 and parameters: {'phi_model': 'eid', 'kappa': 6.347516377955791, 'svgd_iters': 400, 'debt_weight': 0.3834415188257777, 'visit_sat': 0.8125525342743981, 'visit_halflife': 4.466711898146784, 'phi_mode': 'density', 'n_particles': 512, 'gp_lengthscale': 0.1427571691783423, 'gp_noise': 0.13549145341210658, 'cfg_weight': 3.935855026698292}. Best is trial 0 with value: 0.3306746933323132.
[I 2026-09-12 16:06:33,995] Trial 1 finished with value: 0.3064523930875653 and parameters: {'phi_model': 'mi', 'kappa': 1.3424402794776595, 'svgd_iters': 175, 'debt_weight': 0.26455561210462697, 'visit_sat': 0.796810320490795, 'visit_halflife': 3.921127491624114, 'phi_mode': 'quantile', 'n_particles': 512, 'phi_quantile': 0.6454562392827867, 'gp_lengthscale': 0.04958813918936874, 'gp_noise': 0.03703323754998522, 'cfg_weight': 3.0928935877817945, 'phi_gamma': 0.014345321642323522}. Best is trial 1 with value: 0.3064523930875653.
[I 2026-09-12 16:21:43,477] Trial 2 finished with value: 0.3052075974525513 and parameters: {'phi_model': 'eid', 'kappa': 0.9463687548222457, 'svgd_iters': 400, 'debt_weight': 0.10204481074802807, 'visit_sat': 0.2879890804853512, 'visit_halflife': 1.7098213841374719, 'phi_mode': 'uniform', 'n_particles': 128, 'gp_lengthscale': 0.10494566266427421, 'gp_noise': 0.015127952931538246, 'cfg_weight': 1.5897470850401605}. Best is trial 2 with value: 0.3052075974525513.
[I 2026-09-12 16:33:32,185] Trial 3 finished with value: 0.31016685563010565 and parameters: {'phi_model': 'ei', 'xi': 0.4327617600696444, 'svgd_iters': 250, 'debt_weight': 0.7392635793983017, 'visit_sat': 0.1352690130288886, 'visit_halflife': 2.621052219323072, 'phi_mode': 'density', 'n_particles': 256, 'gp_lengthscale': 0.11497663580760792, 'gp_noise': 0.054596586124474676, 'cfg_weight': 1.7961684728183362}. Best is trial 2 with value: 0.3052075974525513.
[I 2026-09-12 16:43:38,042] Trial 4 finished with value: 0.29757002959899204 and parameters: {'phi_model': 'niveau', 'tau': 0.6503679396243377, 'svgd_iters': 100, 'debt_weight': 0.18319136200711683, 'visit_sat': 0.6278616413290748, 'visit_halflife': 0.6508065964062016, 'phi_mode': 'uniform', 'n_particles': 512, 'gp_lengthscale': 0.03748778750882005, 'gp_noise': 0.056182100759943274, 'cfg_weight': 2.776125793815517}. Best is trial 4 with value: 0.29757002959899204.
[I 2026-09-12 16:51:32,844] Trial 5 finished with value: 0.28800882487443374 and parameters: {'phi_model': 'mass', 'w': 0.7824180377322295, 'svgd_iters': 150, 'debt_weight': 0.8811031971111616, 'visit_sat': 0.6231455853722728, 'visit_halflife': 7.113015213911396, 'phi_mode': 'density', 'n_particles': 128, 'gp_lengthscale': 0.09251002196259928, 'gp_noise': 0.010591828171692786, 'cfg_weight': 1.904724450023648}. Best is trial 5 with value: 0.28800882487443374.
[I 2026-09-12 17:01:38,554] Trial 6 finished with value: 0.3424821911755034 and parameters: {'phi_model': 'ucb', 'kappa': 1.7938629208040526, 'svgd_iters': 225, 'debt_weight': 0.6532008198571336, 'visit_sat': 0.68689294300152, 'visit_halflife': 3.7356382657548046, 'phi_mode': 'uniform', 'n_particles': 128, 'gp_lengthscale': 0.025761424375012217, 'gp_noise': 0.15713555397721904, 'cfg_weight': 3.1427238986473345}. Best is trial 5 with value: 0.28800882487443374.
[I 2026-09-12 17:11:40,193] Trial 7 finished with value: 0.2922692264688514 and parameters: {'phi_model': 'ucb', 'kappa': 4.452125156948536, 'svgd_iters': 225, 'debt_weight': 0.40718329722599966, 'visit_sat': 0.16225029590962425, 'visit_halflife': 5.730715798584227, 'phi_mode': 'quantile', 'n_particles': 128, 'phi_quantile': 0.3879824515826912, 'gp_lengthscale': 0.12640491268586515, 'gp_noise': 0.016722274887490677, 'cfg_weight': 2.563109818612388}. Best is trial 5 with value: 0.28800882487443374.
[I 2026-09-12 17:12:26,486] Trial 8 pruned. 
[I 2026-09-12 17:27:31,077] Trial 9 finished with value: 0.3080108733764961 and parameters: {'phi_model': 'ucb', 'kappa': 0.5556207976577571, 'svgd_iters': 275, 'debt_weight': 0.3777518392924809, 'visit_sat': 0.26164330980367134, 'visit_halflife': 0.6850904629349842, 'phi_mode': 'density', 'n_particles': 512, 'gp_lengthscale': 0.03458967405872805, 'gp_noise': 0.07289279979636075, 'cfg_weight': 1.789967130211452}. Best is trial 5 with value: 0.28800882487443374.
[I 2026-09-12 17:28:47,621] Trial 10 pruned. 
[I 2026-09-12 17:40:14,863] Trial 11 finished with value: 0.29417523993660916 and parameters: {'phi_model': 'mass', 'w': 0.4612093323770606, 'svgd_iters': 275, 'debt_weight': 0.6792608261823919, 'visit_sat': 0.407698208021402, 'visit_halflife': 6.073800979645143, 'phi_mode': 'density', 'n_particles': 128, 'gp_lengthscale': 0.08043348590917158, 'gp_noise': 0.01047781993738454, 'cfg_weight': 2.3976741569443454}. Best is trial 5 with value: 0.28800882487443374.
[I 2026-09-12 17:49:34,962] Trial 12 finished with value: 0.29080117470186845 and parameters: {'phi_model': 'ucb', 'kappa': 0.17435154946267306, 'svgd_iters': 200, 'debt_weight': 0.2743541182734697, 'visit_sat': 0.5734274016318744, 'visit_halflife': 6.617809237874255, 'phi_mode': 'quantile', 'n_particles': 128, 'phi_quantile': 0.18315138929730163, 'gp_lengthscale': 0.22605068986220633, 'gp_noise': 0.010919442161620834, 'cfg_weight': 1.8781170966485625}. Best is trial 5 with value: 0.28800882487443374.
[I 2026-09-12 17:59:40,411] Trial 13 finished with value: 0.29208416567916057 and parameters: {'phi_model': 'ucb', 'kappa': 0.15340389308410776, 'svgd_iters': 225, 'debt_weight': 0.24526902019459976, 'visit_sat': 0.3317562303654983, 'visit_halflife': 6.286794979874274, 'phi_mode': 'density', 'n_particles': 128, 'gp_lengthscale': 0.19218588992677227, 'gp_noise': 0.01979874171313441, 'cfg_weight': 1.4206016165690247}. Best is trial 5 with value: 0.28800882487443374.
[I 2026-09-12 18:00:37,920] Trial 14 pruned. 
[I 2026-09-12 18:02:01,257] Trial 15 pruned. 
[I 2026-09-12 18:15:40,193] Trial 16 finished with value: 0.30806768117567424 and parameters: {'phi_model': 'ucb', 'kappa': 0.16066557686936506, 'svgd_iters': 350, 'debt_weight': 0.2942351401468517, 'visit_sat': 0.6398966820816553, 'visit_halflife': 7.172992858099829, 'phi_mode': 'quantile', 'n_particles': 128, 'phi_quantile': 0.16074725981867632, 'gp_lengthscale': 0.1933584592584143, 'gp_noise': 0.014863524433222898, 'cfg_weight': 1.9474940306773412}. Best is trial 5 with value: 0.28800882487443374.
[I 2026-09-12 18:21:25,384] Trial 17 finished with value: 0.2871455674350047 and parameters: {'phi_model': 'mass', 'w': 0.5475327328783038, 'svgd_iters': 75, 'debt_weight': 0.1038250088962458, 'visit_sat': 0.6888950044424895, 'visit_halflife': 7.128768487509055, 'phi_mode': 'quantile', 'n_particles': 128, 'phi_quantile': 0.8819679777182566, 'gp_lengthscale': 0.15349870463585352, 'gp_noise': 0.010541819252762574, 'cfg_weight': 2.088052189198946}. Best is trial 17 with value: 0.2871455674350047.
[I 2026-09-12 18:22:08,246] Trial 18 pruned. 
[I 2026-09-12 18:27:09,606] Trial 19 finished with value: 0.27690133668271044 and parameters: {'phi_model': 'mass', 'w': 0.633782570698122, 'svgd_iters': 50, 'debt_weight': 0.6304077172155425, 'visit_sat': 0.5877511043040212, 'visit_halflife': 6.591370654489106, 'phi_mode': 'density', 'n_particles': 128, 'gp_lengthscale': 0.08274097202864049, 'gp_noise': 0.01285484845225134, 'cfg_weight': 2.5809194176199255}. Best is trial 19 with value: 0.27690133668271044.
[I 2026-09-12 18:32:55,375] Trial 20 finished with value: 0.2733450468212298 and parameters: {'phi_model': 'mass', 'w': 0.5779311144760774, 'svgd_iters': 75, 'debt_weight': 0.14173176232097784, 'visit_sat': 0.7934148409093064, 'visit_halflife': 7.071354771715722, 'phi_mode': 'density', 'n_particles': 128, 'gp_lengthscale': 0.08052234486810922, 'gp_noise': 0.01619042593002811, 'cfg_weight': 2.4763077832797755}. Best is trial 20 with value: 0.2733450468212298.
[I 2026-09-12 18:33:39,003] Trial 21 pruned. 
[I 2026-09-12 18:38:41,218] Trial 22 finished with value: 0.27730485363153656 and parameters: {'phi_model': 'mass', 'w': 0.6566820774129629, 'svgd_iters': 50, 'debt_weight': 0.09429923960229922, 'visit_sat': 0.7954805419536857, 'visit_halflife': 6.604529637821525, 'phi_mode': 'quantile', 'n_particles': 128, 'phi_quantile': 0.5311771718233813, 'gp_lengthscale': 0.14681755853991937, 'gp_noise': 0.015766763767325113, 'cfg_weight': 2.019956020529015}. Best is trial 20 with value: 0.2733450468212298.
[I 2026-09-12 18:42:54,977] Trial 23 finished with value: 0.2740803871150961 and parameters: {'phi_model': 'mass', 'w': 0.6830814033194857, 'svgd_iters': 25, 'debt_weight': 0.2309164478778973, 'visit_sat': 0.9517634175308597, 'visit_halflife': 7.237699336410744, 'phi_mode': 'quantile', 'n_particles': 128, 'phi_quantile': 0.4922469520529516, 'gp_lengthscale': 0.19222397487239298, 'gp_noise': 0.030888768469935404, 'cfg_weight': 1.2436361855731257}. Best is trial 20 with value: 0.2733450468212298.
[I 2026-09-12 18:43:28,716] Trial 24 pruned. 
[I 2026-09-12 18:47:41,421] Trial 25 finished with value: 0.2692598123209162 and parameters: {'phi_model': 'mass', 'w': 0.7150216880622193, 'svgd_iters': 25, 'debt_weight': 0.25745152445038394, 'visit_sat': 0.535746644349889, 'visit_halflife': 6.028357148987152, 'phi_mode': 'density', 'n_particles': 128, 'gp_lengthscale': 0.06961936112916668, 'gp_noise': 0.017394506305172815, 'cfg_weight': 2.631309460750857}. Best is trial 25 with value: 0.2692598123209162.
[I 2026-09-12 18:48:09,353] Trial 26 pruned. 
[I 2026-09-12 18:53:13,666] Trial 27 finished with value: 0.26685188522938974 and parameters: {'phi_model': 'stretch', 'kappa': 0.44053618372739706, 'svgd_iters': 50, 'debt_weight': 0.2825633531998112, 'visit_sat': 0.812134797876889, 'visit_halflife': 7.302293431897292, 'phi_mode': 'quantile', 'n_particles': 128, 'phi_quantile': 0.3890093206707056, 'gp_lengthscale': 0.13463251202780238, 'gp_noise': 0.03226121166785177, 'cfg_weight': 1.3372373548252456}. Best is trial 27 with value: 0.26685188522938974.
[I 2026-09-12 18:53:47,259] Trial 28 pruned. 
[I 2026-09-12 18:54:29,224] Trial 29 pruned. 
[I 2026-09-12 18:57:56,577] Trial 30 finished with value: 0.2851619064357014 and parameters: {'phi_model': 'mass', 'w': 0.7799861543435509, 'svgd_iters': 0, 'debt_weight': 0.26754306732546623, 'visit_sat': 0.5874667240095086, 'visit_halflife': 7.62276354608607, 'phi_mode': 'density', 'n_particles': 128, 'gp_lengthscale': 0.061851994185675954, 'gp_noise': 0.03331848471945663, 'cfg_weight': 3.10849232412149}. Best is trial 27 with value: 0.26685188522938974.
[I 2026-09-12 19:02:10,423] Trial 31 finished with value: 0.27723686767108185 and parameters: {'phi_model': 'mass', 'w': 0.6504623722156537, 'svgd_iters': 25, 'debt_weight': 0.2875621236088895, 'visit_sat': 0.9826225680554078, 'visit_halflife': 6.583448429043109, 'phi_mode': 'quantile', 'n_particles': 128, 'phi_quantile': 0.3914288433186736, 'gp_lengthscale': 0.23396637410333943, 'gp_noise': 0.030151369817098102, 'cfg_weight': 1.6554682471972657}. Best is trial 27 with value: 0.26685188522938974.
[I 2026-09-12 19:05:38,098] Trial 32 finished with value: 0.270871440438984 and parameters: {'phi_model': 'stretch', 'kappa': 0.4475541157566102, 'svgd_iters': 0, 'debt_weight': 0.16821056861314138, 'visit_sat': 0.7746162852502227, 'visit_halflife': 6.047275890214926, 'phi_mode': 'quantile', 'n_particles': 128, 'phi_quantile': 0.3752016500126871, 'gp_lengthscale': 0.12546472204959272, 'gp_noise': 0.04268618052437435, 'cfg_weight': 1.7309581918112655}. Best is trial 27 with value: 0.26685188522938974.
[I 2026-09-12 19:06:12,013] Trial 33 pruned. 
[I 2026-09-12 19:09:39,612] Trial 34 finished with value: 0.2612447053269669 and parameters: {'phi_model': 'stretch', 'kappa': 0.38578519949155865, 'svgd_iters': 0, 'debt_weight': 0.32375890883769676, 'visit_sat': 0.8779803607008313, 'visit_halflife': 7.658450648821166, 'phi_mode': 'quantile', 'n_particles': 128, 'phi_quantile': 0.31545597279631854, 'gp_lengthscale': 0.09874382055243457, 'gp_noise': 0.07953045421260266, 'cfg_weight': 1.2661584234264438}. Best is trial 34 with value: 0.2612447053269669.
[I 2026-09-12 19:13:57,522] Trial 35 finished with value: 0.2616064873604007 and parameters: {'phi_model': 'stretch', 'kappa': 0.43234881202101544, 'svgd_iters': 25, 'debt_weight': 0.42241126950673913, 'visit_sat': 0.9181841145661085, 'visit_halflife': 6.17801603234639, 'phi_mode': 'quantile', 'n_particles': 128, 'phi_quantile': 0.29197382463431953, 'gp_lengthscale': 0.1306049705365208, 'gp_noise': 0.0665604576964368, 'cfg_weight': 1.0208575735570404}. Best is trial 34 with value: 0.2612447053269669.
[I 2026-09-12 19:19:03,244] Trial 36 finished with value: 0.26424648161729997 and parameters: {'phi_model': 'stretch', 'kappa': 0.34590980776078795, 'svgd_iters': 50, 'debt_weight': 0.34320759060719735, 'visit_sat': 0.7899563849243105, 'visit_halflife': 7.942787026056301, 'phi_mode': 'quantile', 'n_particles': 128, 'phi_quantile': 0.25453995521571915, 'gp_lengthscale': 0.08754232190706851, 'gp_noise': 0.13818272415053515, 'cfg_weight': 1.4571152245865944}. Best is trial 34 with value: 0.2612447053269669.
[I 2026-09-12 19:23:19,802] Trial 37 finished with value: 0.25999457189163033 and parameters: {'phi_model': 'stretch', 'kappa': 0.38923002634579873, 'svgd_iters': 25, 'debt_weight': 0.2916235175690029, 'visit_sat': 0.9964705056843792, 'visit_halflife': 7.460848534713506, 'phi_mode': 'quantile', 'n_particles': 128, 'phi_quantile': 0.2637232712071997, 'gp_lengthscale': 0.09093006118682835, 'gp_noise': 0.0535758400728964, 'cfg_weight': 1.2207607052118303}. Best is trial 37 with value: 0.25999457189163033.
[I 2026-09-12 19:28:27,431] Trial 38 finished with value: 0.26961144884697313 and parameters: {'phi_model': 'stretch', 'kappa': 0.3055860439413643, 'svgd_iters': 25, 'debt_weight': 0.30692490826787255, 'visit_sat': 0.9628293568950648, 'visit_halflife': 6.885209751978744, 'phi_mode': 'quantile', 'n_particles': 128, 'phi_quantile': 0.2488601458584148, 'gp_lengthscale': 0.07569531196648996, 'gp_noise': 0.14468098955669426, 'cfg_weight': 1.4768033740791573}. Best is trial 37 with value: 0.25999457189163033.
[I 2026-09-12 19:29:15,236] Trial 39 pruned. 
