[I 2026-09-15 13:52:25,972] Trial 558 finished with value: 0.2599476890986778 and parameters: {'phi_model': 'eid', 'kappa': 0.341512581314422, 'svgd_iters': 0, 'debt_weight': 0.9320101152337747, 'visit_sat': 0.532729952640124, 'visit_halflife': 1.5024255952453247, 'phi_mode': 'quantile', 'n_particles': 128, 'phi_quantile': 0.10807920992066627, 'gp_lengthscale': 0.11647946198570056, 'gp_noise': 0.08985993865079901, 'cfg_weight': 1.005781731258581}. Best is trial 424 with value: 0.2539690003117714.
[I 2026-09-15 13:52:49,014] Trial 559 pruned. 
[I 2026-09-15 13:53:12,033] Trial 560 pruned. 
[I 2026-09-15 13:56:40,634] Trial 561 pruned. 
[I 2026-09-15 14:00:09,329] Trial 562 pruned. 
[I 2026-09-15 14:01:18,910] Trial 563 pruned. 
[I 2026-09-15 14:01:41,916] Trial 564 pruned. 
[I 2026-09-15 14:02:51,627] Trial 565 pruned. 
[I 2026-09-15 14:06:20,329] Trial 566 finished with value: 0.25969725964213386 and parameters: {'phi_model': 'eid', 'kappa': 1.6094674641386961, 'svgd_iters': 0, 'debt_weight': 0.8607140966299828, 'visit_sat': 0.5094299260963824, 'visit_halflife': 2.1778663601707073, 'phi_mode': 'quantile', 'n_particles': 128, 'phi_quantile': 0.6186687798924142, 'gp_lengthscale': 0.14846203418781062, 'gp_noise': 0.08348814318015271, 'cfg_weight': 1.2109719874509628}. Best is trial 424 with value: 0.2539690003117714.
[I 2026-09-15 14:09:49,046] Trial 567 finished with value: 0.2594971689674088 and parameters: {'phi_model': 'eid', 'kappa': 0.9791364992108036, 'svgd_iters': 0, 'debt_weight': 0.9975531771155709, 'visit_sat': 0.5129456822138485, 'visit_halflife': 1.4991758789372078, 'phi_mode': 'quantile', 'n_particles': 128, 'phi_quantile': 0.18829743551496686, 'gp_lengthscale': 0.11008335002331249, 'gp_noise': 0.09182835192758702, 'cfg_weight': 1.056117849890886}. Best is trial 424 with value: 0.2539690003117714.
[I 2026-09-15 14:13:17,772] Trial 568 finished with value: 0.25845971504329096 and parameters: {'phi_model': 'eid', 'kappa': 1.500428557387252, 'svgd_iters': 0, 'debt_weight': 0.9336898638278982, 'visit_sat': 0.4543471896865695, 'visit_halflife': 1.9253249580245857, 'phi_mode': 'quantile', 'n_particles': 128, 'phi_quantile': 0.13709706788447096, 'gp_lengthscale': 0.09805544842360865, 'gp_noise': 0.0917195404827579, 'cfg_weight': 1.0519644902065126}. Best is trial 424 with value: 0.2539690003117714.
[I 2026-09-15 14:14:27,482] Trial 569 pruned. 
[I 2026-09-15 14:14:50,508] Trial 570 pruned. 
[I 2026-09-15 14:15:13,545] Trial 571 pruned. 
[I 2026-09-15 14:16:23,283] Trial 572 pruned. 
[I 2026-09-15 14:19:52,008] Trial 573 finished with value: 0.2551738873560142 and parameters: {'phi_model': 'eid', 'kappa': 1.084396257702717, 'svgd_iters': 0, 'debt_weight': 0.7968841380719542, 'visit_sat': 0.564467812798683, 'visit_halflife': 1.5763848409698606, 'phi_mode': 'quantile', 'n_particles': 128, 'phi_quantile': 0.3041934724415273, 'gp_lengthscale': 0.13586517323371788, 'gp_noise': 0.06584849860715093, 'cfg_weight': 1.4039113402604955}. Best is trial 424 with value: 0.2539690003117714.
[I 2026-09-15 14:23:20,747] Trial 574 finished with value: 0.25406593806688926 and parameters: {'phi_model': 'eid', 'kappa': 1.0326901802428963, 'svgd_iters': 0, 'debt_weight': 0.9846432926611888, 'visit_sat': 0.5383237959430749, 'visit_halflife': 1.7882590165483614, 'phi_mode': 'quantile', 'n_particles': 128, 'phi_quantile': 0.3063239864970481, 'gp_lengthscale': 0.10013252294495979, 'gp_noise': 0.06358712976365341, 'cfg_weight': 1.0141558129483161}. Best is trial 424 with value: 0.2539690003117714.
[I 2026-09-15 14:26:49,399] Trial 575 pruned. 
[I 2026-09-15 14:27:59,135] Trial 576 pruned. 
[I 2026-09-15 14:31:27,874] Trial 577 finished with value: 0.2552841392852277 and parameters: {'phi_model': 'eid', 'kappa': 0.908229736302666, 'svgd_iters': 0, 'debt_weight': 0.7963241047878923, 'visit_sat': 0.6303244729283621, 'visit_halflife': 1.9731584933812334, 'phi_mode': 'quantile', 'n_particles': 128, 'phi_quantile': 0.2840435669687598, 'gp_lengthscale': 0.1469002250707745, 'gp_noise': 0.06343161376271111, 'cfg_weight': 1.3464373767525946}. Best is trial 424 with value: 0.2539690003117714.
[I 2026-09-15 14:34:56,543] Trial 578 pruned. 
[I 2026-09-15 14:38:25,197] Trial 579 pruned. 
[I 2026-09-15 14:39:34,916] Trial 580 pruned. 
[I 2026-09-15 14:40:44,622] Trial 581 pruned. 
[I 2026-09-15 14:44:13,329] Trial 582 finished with value: 0.2562197678036893 and parameters: {'phi_model': 'eid', 'kappa': 1.0446265772827918, 'svgd_iters': 0, 'debt_weight': 0.8140500779485159, 'visit_sat': 0.5296985981829837, 'visit_halflife': 1.83469468370503, 'phi_mode': 'quantile', 'n_particles': 128, 'phi_quantile': 0.29432070426614426, 'gp_lengthscale': 0.12635177660776217, 'gp_noise': 0.07605081978637186, 'cfg_weight': 1.4000286956678816}. Best is trial 424 with value: 0.2539690003117714.
[I 2026-09-15 14:47:41,961] Trial 583 pruned. 
[I 2026-09-15 14:48:51,664] Trial 584 pruned. 
[I 2026-09-15 14:52:20,307] Trial 585 pruned. 
[I 2026-09-15 14:55:48,995] Trial 586 finished with value: 0.2589209617611498 and parameters: {'phi_model': 'eid', 'kappa': 0.9345414028360866, 'svgd_iters': 0, 'debt_weight': 0.8322608259253413, 'visit_sat': 0.4966974832864662, 'visit_halflife': 1.555587976578041, 'phi_mode': 'quantile', 'n_particles': 128, 'phi_quantile': 0.2729037369650875, 'gp_lengthscale': 0.14569495979920333, 'gp_noise': 0.05850469297063401, 'cfg_weight': 1.3158643239119685}. Best is trial 424 with value: 0.2539690003117714.
[I 2026-09-15 14:59:17,642] Trial 587 pruned. 
[I 2026-09-15 15:00:27,386] Trial 588 pruned. 
[I 2026-09-15 15:03:56,103] Trial 589 finished with value: 0.2585569508373975 and parameters: {'phi_model': 'eid', 'kappa': 1.1595166954016487, 'svgd_iters': 0, 'debt_weight': 0.9038131669678087, 'visit_sat': 0.44575597285289287, 'visit_halflife': 1.691945044455161, 'phi_mode': 'quantile', 'n_particles': 128, 'phi_quantile': 0.26804365024190296, 'gp_lengthscale': 0.14609273202782616, 'gp_noise': 0.053375503254860325, 'cfg_weight': 1.3846878298875256}. Best is trial 424 with value: 0.2539690003117714.
[I 2026-09-15 15:04:19,156] Trial 590 pruned. 
[I 2026-09-15 15:07:47,884] Trial 591 finished with value: 0.25933410398756446 and parameters: {'phi_model': 'eid', 'kappa': 0.9544925852887041, 'svgd_iters': 0, 'debt_weight': 0.8340953154333569, 'visit_sat': 0.560895151539577, 'visit_halflife': 1.6700587096086537, 'phi_mode': 'quantile', 'n_particles': 128, 'phi_quantile': 0.3003467311213951, 'gp_lengthscale': 0.12965451975255543, 'gp_noise': 0.08054056928578235, 'cfg_weight': 1.5368797249564168}. Best is trial 424 with value: 0.2539690003117714.
[I 2026-09-15 15:11:16,916] Trial 592 finished with value: 0.2589309631485586 and parameters: {'phi_model': 'eid', 'kappa': 1.1069016737408268, 'svgd_iters': 0, 'debt_weight': 0.802132178311668, 'visit_sat': 0.5448493131358173, 'visit_halflife': 1.863490704738854, 'phi_mode': 'quantile', 'n_particles': 128, 'phi_quantile': 0.27775678772933143, 'gp_lengthscale': 0.11886125461133398, 'gp_noise': 0.07952892318584108, 'cfg_weight': 1.3222413181027277}. Best is trial 424 with value: 0.2539690003117714.
[I 2026-09-15 15:14:46,291] Trial 593 finished with value: 0.2579860106631501 and parameters: {'phi_model': 'eid', 'kappa': 1.0848015879862776, 'svgd_iters': 0, 'debt_weight': 0.8612632549174665, 'visit_sat': 0.3866250418457514, 'visit_halflife': 3.76540553890388, 'phi_mode': 'quantile', 'n_particles': 128, 'phi_quantile': 0.23021584283035418, 'gp_lengthscale': 0.10115976658004774, 'gp_noise': 0.052754193934481414, 'cfg_weight': 1.2377308444566077}. Best is trial 424 with value: 0.2539690003117714.
[I 2026-09-15 15:15:56,252] Trial 594 pruned. 
[I 2026-09-15 15:19:25,614] Trial 595 finished with value: 0.2553424667270115 and parameters: {'phi_model': 'eid', 'kappa': 1.130124989470665, 'svgd_iters': 0, 'debt_weight': 0.987169270960234, 'visit_sat': 0.5366944609876472, 'visit_halflife': 2.231801166790686, 'phi_mode': 'quantile', 'n_particles': 128, 'phi_quantile': 0.2953180196951112, 'gp_lengthscale': 0.10180431209080995, 'gp_noise': 0.06848158859546583, 'cfg_weight': 1.0136887685356317}. Best is trial 424 with value: 0.2539690003117714.
[I 2026-09-15 15:22:54,925] Trial 596 finished with value: 0.2593216689985273 and parameters: {'phi_model': 'eid', 'kappa': 1.074449958601643, 'svgd_iters': 0, 'debt_weight': 0.7865724490011525, 'visit_sat': 0.6252232010205495, 'visit_halflife': 1.6159956970639229, 'phi_mode': 'quantile', 'n_particles': 128, 'phi_quantile': 0.8747045950501352, 'gp_lengthscale': 0.1503184495655941, 'gp_noise': 0.05422228305347103, 'cfg_weight': 1.4351806434345598}. Best is trial 424 with value: 0.2539690003117714.
[I 2026-09-15 15:23:18,038] Trial 597 pruned. 
[I 2026-09-15 15:24:27,769] Trial 598 pruned. 
[I 2026-09-15 15:27:57,128] Trial 599 finished with value: 0.2573483606299716 and parameters: {'phi_model': 'eid', 'kappa': 0.9812626829231084, 'svgd_iters': 0, 'debt_weight': 0.7799877170116359, 'visit_sat': 0.6663824764810333, 'visit_halflife': 2.149622605027905, 'phi_mode': 'quantile', 'n_particles': 128, 'phi_quantile': 0.8472523375081618, 'gp_lengthscale': 0.1382389212261652, 'gp_noise': 0.05993239187388101, 'cfg_weight': 1.3066282269086822}. Best is trial 424 with value: 0.2539690003117714.
[I 2026-09-15 15:29:06,994] Trial 600 pruned. 
[I 2026-09-15 15:32:36,330] Trial 601 finished with value: 0.25874076829807047 and parameters: {'phi_model': 'eid', 'kappa': 0.8123251034997215, 'svgd_iters': 0, 'debt_weight': 0.7722586203213384, 'visit_sat': 0.554258370260512, 'visit_halflife': 1.476910408112665, 'phi_mode': 'quantile', 'n_particles': 128, 'phi_quantile': 0.8551058054486229, 'gp_lengthscale': 0.11882268660212862, 'gp_noise': 0.06664175315437124, 'cfg_weight': 1.5115668208812187}. Best is trial 424 with value: 0.2539690003117714.
[I 2026-09-15 15:32:59,427] Trial 602 pruned. 
[I 2026-09-15 15:34:09,356] Trial 603 pruned. 
[I 2026-09-15 15:37:38,705] Trial 604 finished with value: 0.2565689579310422 and parameters: {'phi_model': 'eid', 'kappa': 0.9713500516110171, 'svgd_iters': 0, 'debt_weight': 0.7637056936594606, 'visit_sat': 0.5270568467334954, 'visit_halflife': 1.3053931029420083, 'phi_mode': 'quantile', 'n_particles': 128, 'phi_quantile': 0.8678132766990856, 'gp_lengthscale': 0.1470162615630896, 'gp_noise': 0.06706977606433301, 'cfg_weight': 1.398749998488644}. Best is trial 424 with value: 0.2539690003117714.
[I 2026-09-15 15:38:48,612] Trial 605 pruned. 
[I 2026-09-15 15:42:17,952] Trial 606 finished with value: 0.25656368423286313 and parameters: {'phi_model': 'eid', 'kappa': 0.8583796894844241, 'svgd_iters': 0, 'debt_weight': 0.9799717014540213, 'visit_sat': 0.5645412944842954, 'visit_halflife': 1.8879553207718893, 'phi_mode': 'quantile', 'n_particles': 128, 'phi_quantile': 0.8813154547336658, 'gp_lengthscale': 0.07599506302429332, 'gp_noise': 0.0692681899779196, 'cfg_weight': 1.0574562532078324}. Best is trial 424 with value: 0.2539690003117714.
[I 2026-09-15 15:42:41,055] Trial 607 pruned. 
[I 2026-09-15 15:43:04,158] Trial 608 pruned. 
[I 2026-09-15 15:43:27,248] Trial 609 pruned. 
[I 2026-09-15 15:43:50,365] Trial 610 pruned. 
[I 2026-09-15 15:47:19,721] Trial 611 finished with value: 0.2601352198113848 and parameters: {'phi_model': 'eid', 'kappa': 0.859375712051043, 'svgd_iters': 0, 'debt_weight': 0.7829902675735934, 'visit_sat': 0.49062642469933515, 'visit_halflife': 2.2753335516459403, 'phi_mode': 'quantile', 'n_particles': 128, 'phi_quantile': 0.8577119766851854, 'gp_lengthscale': 0.13102879267951076, 'gp_noise': 0.08448218609738828, 'cfg_weight': 1.1372548196427312}. Best is trial 424 with value: 0.2539690003117714.
[I 2026-09-15 15:50:49,039] Trial 612 pruned. 
[I 2026-09-15 15:54:18,359] Trial 613 pruned. 
[I 2026-09-15 15:54:41,464] Trial 614 pruned. 
[I 2026-09-15 15:55:51,376] Trial 615 pruned. 
[I 2026-09-15 15:57:01,328] Trial 616 pruned. 
[I 2026-09-15 16:00:30,592] Trial 617 pruned. 
[I 2026-09-15 16:00:53,696] Trial 618 pruned. 
[I 2026-09-15 16:04:23,223] Trial 619 finished with value: 0.2572164390929092 and parameters: {'phi_model': 'eid', 'kappa': 0.9063325449920328, 'svgd_iters': 0, 'debt_weight': 0.9416085101982603, 'visit_sat': 0.4802139455916571, 'visit_halflife': 4.480284986020783, 'phi_mode': 'quantile', 'n_particles': 128, 'phi_quantile': 0.24729185577728094, 'gp_lengthscale': 0.12802710804825576, 'gp_noise': 0.053674151620598624, 'cfg_weight': 1.1427702749324344}. Best is trial 424 with value: 0.2539690003117714.
[I 2026-09-15 16:07:52,488] Trial 620 pruned. 
[I 2026-09-15 16:08:15,577] Trial 621 pruned. 
[I 2026-09-15 16:11:44,887] Trial 622 finished with value: 0.25729377095170264 and parameters: {'phi_model': 'eid', 'kappa': 1.0218218828858978, 'svgd_iters': 0, 'debt_weight': 0.904684627716769, 'visit_sat': 0.4565090651149363, 'visit_halflife': 3.735918237996284, 'phi_mode': 'quantile', 'n_particles': 128, 'phi_quantile': 0.27815056881362943, 'gp_lengthscale': 0.1072586406959796, 'gp_noise': 0.0633031460438109, 'cfg_weight': 1.2201748556900762}. Best is trial 424 with value: 0.2539690003117714.
[I 2026-09-15 16:15:14,191] Trial 623 finished with value: 0.25173625097173163 and parameters: {'phi_model': 'eid', 'kappa': 1.2694620477425402, 'svgd_iters': 0, 'debt_weight': 0.9850011067645752, 'visit_sat': 0.5103124212707921, 'visit_halflife': 2.4472734044773023, 'phi_mode': 'quantile', 'n_particles': 128, 'phi_quantile': 0.25809111492428305, 'gp_lengthscale': 0.10187203717215758, 'gp_noise': 0.07782527641228142, 'cfg_weight': 1.0696155522851443}. Best is trial 623 with value: 0.25173625097173163.
[I 2026-09-15 16:15:37,307] Trial 624 pruned. 
[I 2026-09-15 16:19:06,595] Trial 625 finished with value: 0.25743315024128877 and parameters: {'phi_model': 'eid', 'kappa': 1.1853714667412776, 'svgd_iters': 0, 'debt_weight': 0.8500397630198482, 'visit_sat': 0.5689599681886527, 'visit_halflife': 1.6073803463295238, 'phi_mode': 'quantile', 'n_particles': 128, 'phi_quantile': 0.25669649800231564, 'gp_lengthscale': 0.1403875624448699, 'gp_noise': 0.07251188963852002, 'cfg_weight': 1.2938789454207416}. Best is trial 623 with value: 0.25173625097173163.
[I 2026-09-15 16:22:35,892] Trial 626 finished with value: 0.2596918550491047 and parameters: {'phi_model': 'eid', 'kappa': 1.3059730357943904, 'svgd_iters': 0, 'debt_weight': 0.7656712730408751, 'visit_sat': 0.5454817622639261, 'visit_halflife': 1.8523512858214837, 'phi_mode': 'quantile', 'n_particles': 128, 'phi_quantile': 0.22915292088440603, 'gp_lengthscale': 0.15256020745335722, 'gp_noise': 0.05779823263080088, 'cfg_weight': 1.3459163961903093}. Best is trial 623 with value: 0.25173625097173163.
[I 2026-09-15 16:26:05,273] Trial 627 finished with value: 0.25720255869468417 and parameters: {'phi_model': 'eid', 'kappa': 1.2314370608415008, 'svgd_iters': 0, 'debt_weight': 0.9689496580103778, 'visit_sat': 0.48549189268067877, 'visit_halflife': 2.7731105976998323, 'phi_mode': 'quantile', 'n_particles': 128, 'phi_quantile': 0.25085724367388385, 'gp_lengthscale': 0.10022518508152894, 'gp_noise': 0.0801597739145572, 'cfg_weight': 1.1162459182572135}. Best is trial 623 with value: 0.25173625097173163.
[I 2026-09-15 16:27:15,188] Trial 628 pruned. 
[I 2026-09-15 16:30:44,422] Trial 629 pruned. 
[I 2026-09-15 16:34:13,708] Trial 630 finished with value: 0.2580125825544835 and parameters: {'phi_model': 'eid', 'kappa': 1.0125913822645252, 'svgd_iters': 0, 'debt_weight': 0.8565973992762036, 'visit_sat': 0.48974119429422325, 'visit_halflife': 2.2517526510774246, 'phi_mode': 'quantile', 'n_particles': 128, 'phi_quantile': 0.24230524647911458, 'gp_lengthscale': 0.15401622037346044, 'gp_noise': 0.09742871690296248, 'cfg_weight': 1.011581910674446}. Best is trial 623 with value: 0.25173625097173163.
[I 2026-09-15 16:34:36,808] Trial 631 pruned. 
[I 2026-09-15 16:35:46,720] Trial 632 pruned. 
[I 2026-09-15 16:36:56,647] Trial 633 pruned. 
[I 2026-09-15 16:37:19,738] Trial 634 pruned. 
[I 2026-09-15 16:38:29,656] Trial 635 pruned. 
[I 2026-09-15 16:41:58,942] Trial 636 pruned. 
[I 2026-09-15 16:45:28,267] Trial 637 finished with value: 0.25868150885035684 and parameters: {'phi_model': 'eid', 'kappa': 0.9672100279802106, 'svgd_iters': 0, 'debt_weight': 0.9491198458913395, 'visit_sat': 0.4892989329144766, 'visit_halflife': 1.458552538652367, 'phi_mode': 'quantile', 'n_particles': 128, 'phi_quantile': 0.8155015423676629, 'gp_lengthscale': 0.10404365261052845, 'gp_noise': 0.059628287092344176, 'cfg_weight': 1.2963569406262996}. Best is trial 623 with value: 0.25173625097173163.
[I 2026-09-15 16:46:38,040] Trial 638 pruned. 
[I 2026-09-15 16:47:01,137] Trial 639 pruned. 
[I 2026-09-15 16:47:24,237] Trial 640 pruned. 
[I 2026-09-15 16:50:53,550] Trial 641 finished with value: 0.2552525362906816 and parameters: {'phi_model': 'eid', 'kappa': 1.239242889265269, 'svgd_iters': 0, 'debt_weight': 0.7631624203745366, 'visit_sat': 0.5086553551511885, 'visit_halflife': 1.7944253337530518, 'phi_mode': 'quantile', 'n_particles': 128, 'phi_quantile': 0.8772011595789099, 'gp_lengthscale': 0.13439779402361854, 'gp_noise': 0.0638124296193112, 'cfg_weight': 1.5817309072110946}. Best is trial 623 with value: 0.25173625097173163.
[I 2026-09-15 16:51:16,620] Trial 642 pruned. 
[I 2026-09-15 16:51:39,708] Trial 643 pruned. 
[I 2026-09-15 16:52:02,797] Trial 644 pruned. 
[I 2026-09-15 16:53:12,687] Trial 645 pruned. 
[I 2026-09-15 16:56:41,920] Trial 646 pruned. 
[I 2026-09-15 16:57:05,019] Trial 647 pruned. 
[I 2026-09-15 17:00:34,321] Trial 648 finished with value: 0.253241517376982 and parameters: {'phi_model': 'eid', 'kappa': 0.8352249912812033, 'svgd_iters': 0, 'debt_weight': 0.8729480627229256, 'visit_sat': 0.5926106444815719, 'visit_halflife': 1.7496431688916967, 'phi_mode': 'quantile', 'n_particles': 128, 'phi_quantile': 0.8429656410663648, 'gp_lengthscale': 0.12350338182584092, 'gp_noise': 0.06085967183809645, 'cfg_weight': 1.256090542385597}. Best is trial 623 with value: 0.25173625097173163.
[I 2026-09-15 17:04:03,638] Trial 649 finished with value: 0.2570327899685214 and parameters: {'phi_model': 'eid', 'kappa': 0.9914507181113403, 'svgd_iters': 0, 'debt_weight': 0.9345236136208461, 'visit_sat': 0.518614828143424, 'visit_halflife': 1.8593930195089388, 'phi_mode': 'quantile', 'n_particles': 128, 'phi_quantile': 0.8299980626905067, 'gp_lengthscale': 0.12021253473823336, 'gp_noise': 0.07386459739432837, 'cfg_weight': 1.0002403313766004}. Best is trial 623 with value: 0.25173625097173163.
[I 2026-09-15 17:05:13,541] Trial 650 pruned. 
[I 2026-09-15 17:08:42,888] Trial 651 finished with value: 0.25662612907867133 and parameters: {'phi_model': 'eid', 'kappa': 0.8970689459307862, 'svgd_iters': 0, 'debt_weight': 0.9207094639740947, 'visit_sat': 0.5603585282456492, 'visit_halflife': 2.2660007730741034, 'phi_mode': 'quantile', 'n_particles': 128, 'phi_quantile': 0.8104651052318068, 'gp_lengthscale': 0.09867541548185979, 'gp_noise': 0.08567209336591293, 'cfg_weight': 1.011362724123225}. Best is trial 623 with value: 0.25173625097173163.
[I 2026-09-15 17:09:06,016] Trial 652 pruned. 
[I 2026-09-15 17:09:29,122] Trial 653 pruned. 
[I 2026-09-15 17:10:39,032] Trial 654 pruned. 
[I 2026-09-15 17:11:02,124] Trial 655 pruned. 
[I 2026-09-15 17:11:25,223] Trial 656 pruned. 
[I 2026-09-15 17:11:48,321] Trial 657 pruned. 
[I 2026-09-15 17:12:58,237] Trial 658 pruned. 
[I 2026-09-15 17:14:08,145] Trial 659 pruned. 
[I 2026-09-15 17:14:31,244] Trial 660 pruned. 
[I 2026-09-15 17:14:54,334] Trial 661 pruned. 
[I 2026-09-15 17:16:04,351] Trial 662 pruned. 
[I 2026-09-15 17:16:27,478] Trial 663 pruned. 
[I 2026-09-15 17:17:37,338] Trial 664 pruned. 
[I 2026-09-15 17:21:06,872] Trial 665 finished with value: 0.25406617543172927 and parameters: {'phi_model': 'eid', 'kappa': 1.0595943320886256, 'svgd_iters': 0, 'debt_weight': 0.9965429402770732, 'visit_sat': 0.5053093711044745, 'visit_halflife': 2.5366842371132576, 'phi_mode': 'quantile', 'n_particles': 128, 'phi_quantile': 0.8527357012241694, 'gp_lengthscale': 0.09457213446077709, 'gp_noise': 0.06820537624209032, 'cfg_weight': 1.0693148159767047}. Best is trial 623 with value: 0.25173625097173163.
[I 2026-09-15 17:21:29,997] Trial 666 pruned. 
[I 2026-09-15 17:24:59,483] Trial 667 finished with value: 0.25934673087251064 and parameters: {'phi_model': 'eid', 'kappa': 1.0833422566270225, 'svgd_iters': 0, 'debt_weight': 0.996361570295896, 'visit_sat': 0.552537773416579, 'visit_halflife': 1.320644573864266, 'phi_mode': 'quantile', 'n_particles': 128, 'phi_quantile': 0.8065807579138355, 'gp_lengthscale': 0.104739400351443, 'gp_noise': 0.057370425121968924, 'cfg_weight': 1.3055530969354494}. Best is trial 623 with value: 0.25173625097173163.
[I 2026-09-15 17:28:28,952] Trial 668 pruned. 
[I 2026-09-15 17:29:38,940] Trial 669 pruned. 
[I 2026-09-15 17:30:02,059] Trial 670 pruned. 
[I 2026-09-15 17:33:31,485] Trial 671 pruned. 
[I 2026-09-15 17:33:54,599] Trial 672 pruned. 
[I 2026-09-15 17:34:17,711] Trial 673 pruned. 
[I 2026-09-15 17:34:40,836] Trial 674 pruned. 
[I 2026-09-15 17:35:03,964] Trial 675 pruned. 
[I 2026-09-15 17:38:33,263] Trial 676 finished with value: 0.25995161922357496 and parameters: {'phi_model': 'eid', 'kappa': 1.1925523196241692, 'svgd_iters': 0, 'debt_weight': 0.8687116651958239, 'visit_sat': 0.5676516722376095, 'visit_halflife': 1.8093506598398108, 'phi_mode': 'quantile', 'n_particles': 128, 'phi_quantile': 0.7940402378404703, 'gp_lengthscale': 0.11344220061344518, 'gp_noise': 0.067312301401694, 'cfg_weight': 1.1469002381385307}. Best is trial 623 with value: 0.25173625097173163.
[I 2026-09-15 17:38:56,358] Trial 677 pruned. 
[I 2026-09-15 17:42:25,614] Trial 678 pruned. 
[I 2026-09-15 17:42:48,714] Trial 679 pruned. 
[I 2026-09-15 17:46:17,973] Trial 680 pruned. 
[I 2026-09-15 17:47:27,878] Trial 681 pruned. 
[I 2026-09-15 17:47:50,975] Trial 682 pruned. 
